key,track,artist,album,genre,date
ABSOLUTE/ABSOLUTE - Live @ Glastonbury Festival 2022 in Somerset (02.07.22).mp3,ABSOLUTE,ABSOLUTE,"{'name': 'Glastonbury Festival 2022', 'artist': 'Various Artists'}",Electronic,2022-07-02
AMTRAC/AMTRAC - Live @ Coachella Music Festival 2017 in California (16.04.17).mp3,AMTRAC,AMTRAC,"{'name': 'Coachella 2017', 'artist': 'Various Artists'}",House,2017-04-16
ARTBAT/ARTBAT - Live on Radio1 Essential Mix (30.01.22).mp3,ARTBAT 2022,ARTBAT,"{'name': 'Essential Mix', 'artist': 'Various Artists'}",Techno,2022-01-30
Above & Beyond/Above & Beyond - Live @ Creamfields 2017 in Liverpool (05.08.17).mp3,Above & Beyond,Above & Beyond,"{'name': 'Creamfields 2017', 'artist': 'Various Artists'}",Trance,2017-08-05
"Above & Beyond/Above & Beyond - Live @ Radio 1 Party, Cream, Privilege in Ibiza (02.08.14).mp3",Above & Beyond,Above & Beyond,"{'name': 'Cream Ibiza 2014', 'artist': 'Various Artists'}",Trance,2014-08-02
"Above & Beyond/Radio 1 Dance Presents..., Anjunabeats Above & Beyond.mp4","Above & Beyond, Anjunabeats",Above & Beyond,"{'name': 'Radio 1 Dance Presents...', 'artist': 'Various Artists'}",Trance,
"Adem Ten/Radio 1's Essential Mix, Adam Ten.mp4",Adem Ten,Adem Ten,"{'name': 'Essential Mix', 'artist': 'Various Artists'}",Electronic,
Adriatique/Adriatique - Live on Radio 1 Essential Mix (04.02.17).mp3,Adriatique 2017,Adriatique,"{'name': 'Essential Mix', 'artist': 'Various Artists'}",House,2017-02-04
Adventure Club/Adventure Club - Live @ Coachella Music Festival 2014 in California (13.04.14).mp3,Adventure Club,Adventure Club,"{'name': 'Coachella 2014', 'artist': 'Various Artists'}",Electro House,2014-04-13
Alesso/Alesso - Live @ Coachella Festival 2012 in California (14.04.12).mp3,Alesso,Alesso,"{'name': 'Coachella 2012', 'artist': 'Various Artists'}",Electronic,2012-04-14
Alesso/Alesso - Live @ Coachella Music Festival 2014 in California (14.04.14).mp3,Alesso,Alesso,"{'name': 'Coachella 2014', 'artist': 'Various Artists'}",House,2014-04-14
Alesso/Alesso - Live @ Coachella Music Festival 2015 in California (10.04.15).mp3,Alesso,Alesso,"{'name': 'Coachella 2015', 'artist': 'Various Artists'}",Electronic,2015-04-10
Alesso/Alesso - Live on Radio 1 Essential Mix (24.03.12).mp3,Alesso 2012,Alesso,"{'name': 'Essential Mix', 'artist': 'Various Artists'}",House,2012-03-24
Alison Swing/Alison Swing - Live @ Coachella Music Festival 2017 in California (14.04.17).mp3,Alison Swing,Alison Swing,"{'name': 'Coachella 2017', 'artist': 'Various Artists'}",Electronic,2017-04-14
Alok/Alok - Live on Radio 1 Essential Mix (12.02.22).mp3,Alok 2022,Alok,"{'name': 'Essential Mix', 'artist': 'Various Artists'}",Electronic,2022-02-12
Alvin Risk/Alvin Risk - Live @ Coachella Music Festival 2015 in California (10.04.15).mp3,Alvin Risk,Alvin Risk,"{'name': 'Coachella 2015', 'artist': 'Various Artists'}",Electronic,2015-04-10
Amelie Lens/Amelie Lens - Live @ Coachella 2019 in California (19.04.19).mp3,Amelie Lens,Amelie Lens,"{'name': 'Coachella 2019', 'artist': 'Various Artists'}",Techno,2019-04-19
Amelie Lens/Amelie Lens - Live on Radio 1 Essential Mix (03.04.20).mp3,Amelie Lens 2020,Amelie Lens,"{'name': 'Essential Mix', 'artist': 'Various Artists'}",Techno,2020
Amine Edge & Dance/Amine Edge & Dance - Live @ Coachella Music Festival 2016 in California (24.04.16).mp3,Amine Edge & Dance,Amine Edge & Dance,"{'name': 'Coachella 2016', 'artist': 'Various Artists'}",House,2016-04-24
"Amy Wiles/Radio 1 Dance Presents..., Anjunabeats Amy Wiles.mp4","Amy Wiles, Anjunabeats",Amy Wiles,"{'name': 'Radio 1 Dance Presents...', 'artist': 'Various Artists'}",Electronic,
Anastasia Kristensen/Anastasia Kristensen - Live on Radio 1 Essential Mix (03.09.22).mp3,Anastasia Kristensen 2022,Anastasia Kristensen,"{'name': 'Essential Mix', 'artist': 'Various Artists'}",Techno,2022
Andhim/Andhim - Live on Radio 1 Essential Mix (06.06.15).mp3,Andhim 2015,Andhim,"{'name': 'Essential Mix', 'artist': 'Various Artists'}",Electronic,2015-06-06
Andre Power/Andre Power - Live @ Coachella Music Festival 2017 in California (14.04.17).mp3,Andre Power,Andre Power,"{'name': 'Coachella 2017', 'artist': 'Various Artists'}",Electronic,2017-04-14
Andrea Oliva/Andrea Oliva - Live @ Ibiza Rocks Hotel in Ibiza (02.08.15).mp3,Andrea Oliva,Andrea Oliva,"{'name': 'Ibiza Rocks 2015', 'artist': 'Various Artists'}",House,2015-08-02
Andrew Weatherall/Andrew Weatherall - Tribute - Live on Radio 1 Essential Mix (21.02.20).mp3,Andrew Weatherall - Tribute 2020,Andrew Weatherall,"{'name': 'Essential Mix', 'artist': 'Various Artists'}",Electronic,2020-02-21
Andy C/Andy C - Live @ Hackney Weekend 2012 in London (07.07.12).mp3,Andy C,Andy C,"{'name': 'Hackney Weekend 2012', 'artist': 'Various Artists'}",Drum & Bass,2012-07-07
Anja Schneider/Anja Schneider - Live on Radio 1 Essential Mix (04.10.14).mp3,Anja Schneider 2014,Anja Schneider,"{'name': 'Essential Mix', 'artist': 'Various Artists'}",Electronic,2014-10-04
Anna Lunoe/Anna Lunoe - Live @ Coachella Music Festival 2017 in California (14.04.17).mp3,Anna Lunoe,Anna Lunoe,"{'name': 'Coachella 2017', 'artist': 'Various Artists'}",Electronic,2017-04-14
Anna Lunoe/Anna Lunoe - Live @ Coachella Music Festival 2017 in California (16.04.17).mp3,Anna Lunoe,Anna Lunoe,"{'name': 'Coachella 2017', 'artist': 'Various Artists'}",Electronic,2017-04-16
Annie Mac/Annie Mac - Live @ Glastonbury 2017 in Sommerset (23.06.17).mp3,Annie Mac,Annie Mac,"{'name': 'Glastonbury 2017', 'artist': 'Various Artists'}",Electronic,2017-06-23
Annie Mac/Annie Mac - Live @ Ibiza Rocks Hotel in Ibiza (02.08.15).mp3,Annie Mac,Annie Mac,"{'name': 'Ibiza Rocks 2015', 'artist': 'Various Artists'}",House,2015-08-02
"Annie Mac/Annie Mac - Live @ Radio 1 Party, Cream, Privilege in Ibiza (02.08.14).mp3",Annie Mac,Annie Mac,"{'name': 'Cream Ibiza 2014', 'artist': 'Various Artists'}",House,2014-08-02
"Annie Mac/Annie Mac - Live @ Radio 1 Party, Ushuaia Hotel in Ibiza (31.07.15).mp3",Annie Mac,Annie Mac,"{'name': 'Ushuaia 2015', 'artist': 'Various Artists'}",Electronic,2015-07-31
Annie Mac/Annie Mac - Live @ Sonar Festival 2012 in Barcelona (16.06.12).mp3,Annie Mac,Annie Mac,"{'name': 'Sonar Festival 2012', 'artist': 'Various Artists'}",Electronic,2012-06-16
Annie Mac & Friends/Annie Mac & Friends - Live @ Radio 1 - Live @ Ushuaia Hotel in Ibiza (03.08.12).mp3,Annie Mac & Friends,Annie Mac,"{'name': 'Ushuaia 2012', 'artist': 'Various Artists'}",Electronic,2012-08-03
"Annie Mac & Kiesza/Annie Mac & Kiesza - Live @ Radio 1 Party, Ushuaia in Ibiza (01.08.14).mp3",Annie Mac & Kiesza,Annie Mac & Kiesza,"{'name': 'Ushuaia 2014', 'artist': 'Various Artists'}",House,2014-08-01
"Annie Mac & Pete Tong/Annie Mac & Pete Tong - Live @ Radio 1 Party, Ushuaia Hotel in Ibiza (31.07.15).mp3",Annie Mac b2b Pete Tong,Annie Mac b2b Pete Tong,"{'name': 'Ushuaia 2015', 'artist': 'Various Artists'}",Electronic,2015-07-31
Annie Mac b2b Tiga/Annie Mac b2b Tiga - Live @ Glastonbury 2014 in Somerset (28.06.14).mp3,Annie Mac b2b Tiga,Annie Mac b2b Tiga,"{'name': 'Glastonbury 2014', 'artist': 'Various Artists'}",Electronic,2014-06-28
Antal/Antal - Live in radio 1 Essential Mix (15.10.22).mp3,Antal 2022,Antal,"{'name': 'Essential Mix', 'artist': 'Various Artists'}",Electronic,2022-10-15
Apollonia/Apollonia - Live on Radio 1 Essential Mix (25.10.14).mp3,Apollonia 2014,Apollonia,"{'name': 'Essential Mix', 'artist': 'Various Artists'}",House,2014-10-25
Archie Hamilton/Archie Hamilton - Live on Radio 1 Essential Mix (17.01.20).mp3,Archie Hamilton 2020,Archie Hamilton,"{'name': 'Essential Mix', 'artist': 'Various Artists'}",Techno,2020-01-17
"Arielle Free & Sonny Fedora/Radio 1's Dance Weekend, Dance Anthems Ibiza, Arielle Free and Sonny Fodera.mp4",Arielle Free and Sonny Fodera,Arielle Free and Sonny Fodera,"{'name': ""Radio 1's Dance Weekend"", 'artist': 'Various Artists'}",Electronic,
"Arrica/Radio 1 Dance Presents..., Drumsheds Airrica.mp4",Airrica,Airrica,"{'name': 'Drumsheds', 'artist': 'Various Artists'}",Electronic,
Artwork/Artwork - Live on Radio 1 Essential Mix (16.12.17).mp3,Artwork 2017,Artwork,"{'name': 'Essential Mix', 'artist': 'Various Artists'}",House,2017
Arty/Arty - Live on Radio 1 Essential Mix (11.02.12).mp3,Arty 2012,Arty,"{'name': 'Essential Mix', 'artist': 'Various Artists'}",Trance,2012-02-11
Autograf/Autograf - Live @ Coachella Music Festival 2017 in California (15.04.17).mp3,Autograf,Autograf,"{'name': 'Coachella 2017', 'artist': 'Various Artists'}",Electronic,2017-04-15
Axwell Ingrosso/Axwell Ingrosso - Live @ Coachella Music Festival 2015 in California (11.04.15).mp3,Axwell Ingrosso,Axwell Ingrosso,"{'name': 'Coachella 2015', 'artist': 'Various Artists'}",Electronic,2015-04-11
Azari & III/Azari & III - Live on Radio 1 Essential Mix (14.01.12).mp3,Azari & III 2012,Azari & III,"{'name': 'Essential Mix', 'artist': 'Various Artists'}",Electronic,2012
B Traits/B Traits - Live @ Ibiza Rocks Hotel in Ibiza (02.08.15).mp3,B.Traits,B.Traits,"{'name': 'Ibiza Rocks 2015', 'artist': 'Various Artists'}",House,2015-08-02
"B Traits & Monki/B Traits & Monki - Live @ Radio 1 Party, Ushuaia in Ibiza (01.08.14).mp3",B Traits & Monki,B Traits & Monki,"{'name': 'Ushuaia 2014', 'artist': 'Various Artists'}",House,2014-08-01
BT/BT - Live @ Coachella Festival 2002 in California (05.05.02).mp3,BT,BT,"{'name': 'Coachella 2002', 'artist': 'Various Artists'}",Electronic,2002
BURNS/BURNS - Live on Radio 1 Essential Mix (19.02.22).mp3,BURNS 2022,BURNS,"{'name': 'Essential Mix', 'artist': 'Various Artists'}",House,2022-02-19
Baauer/Baauer - Live @ Coachella Music Festival 2016 in California (24.04.16).mp3,Baauer,Baauer,"{'name': 'Coachella 2016', 'artist': 'Various Artists'}",Electronic,2016-04-24
Banks/Banks - Live @ Coachella Music Festival 2017 in California (14.04.17).mp3,Banks,Banks,"{'name': 'Coachella 2017', 'artist': 'Various Artists'}",Electronic,2017
Barely Legal/Barely Legal - Live on Radio 1 Essential Mix (11.01.20).mp3,Barely Legal 2020,Barely Legal,"{'name': 'Essential Mix', 'artist': 'Various Artists'}",House,2020
Becky Hill/Becky_Hill_-_Believe_Me_Now_Album_Launch_Party_Mixmag.mp3,Believe Me Now Album Launch Party,Becky Hill,"{'name': 'Becky Hill Sets', 'artist': 'Becky Hill'}",Dance,2024
Becky Hill/Becky_Hill_-_Full_Set_Live_at_Capital_s_Summertime_Ball_2024_Capital.mp3,Capital Summertime Ball 2024,Becky Hill,"{'name': 'Becky Hill Sets', 'artist': 'Becky Hill'}",Dance,2024
Becky Hill/Becky_Hill_Full_Set_Capital_Dance_Live_In_Ibiza.mp3,Capital Dance in Ibiza,Becky Hill,"{'name': 'Becky Hill Sets', 'artist': 'Becky Hill'}",Dance,2023
"Becky Hill/Radio 1's Dance Party with Danny Howard, Becky Hill!.mp4",Becky Hill,Danny Howard,"{'name': ""Radio 1's Dance Party"", 'artist': 'Various Artists'}",Dance,
"Becky Hill/Radio 1's Dance Weekend, Dance Anthems Ibiza, Becky Hill.mp4",Becky Hill,Becky Hill,"{'name': ""Radio 1's Dance Weekend"", 'artist': 'Various Artists'}",Dance,
Bedouin/Bedouin - Live on Radio 1 Essential Mix (06.03.20).mp3,Bedouin 2020,Bedouin,"{'name': 'Essential Mix', 'artist': 'Various Artists'}",Electronic,2020
Ben Hemsley/Ben Hemsley - Live on Radio 1 Essential Mix (01.10.22).mp3,Ben Hemsley 2022,Ben Hemsley,"{'name': 'Essential Mix', 'artist': 'Various Artists'}",Electronic,2022-10-01
Ben Hemsley/Ben_Hemsley_-_Angel_Of_The_North_Live_Stream_Ministry_of_Sound.mp3,Angel Of The North,Ben Hemsley,"{'name': 'Ben Hemsley Sets', 'artist': 'Ben Hemsley'}",Electronic,
"Ben Hemsley/Radio 1 Dance Presents..., Drumsheds Ben Hemsley.mp4",Ben Hemsley,Ben Hemsley,"{'name': 'Drumsheds', 'artist': 'Various Artists'}",House,
Ben Klock/Ben Klock - Liv on Radio 1 Essential Mix (10.10.15).mp3,Ben Klock 2015,Ben Klock,"{'name': 'Essential Mix', 'artist': 'Various Artists'}",Techno,2015-10-10
Ben Pierce/Ben Pierce - Live on Radio 1 Essential Mix (13.05.17).mp3,Ben Pearce 2017,Ben Pearce,"{'name': 'Essential Mix', 'artist': 'Various Artists'}",House,2017-05-13
Ben Sims/Ben Sims - Live on Radio 1 Essential Mix (23.04.22).mp3,Ben Sims 2022,Ben Sims,"{'name': 'Essential Mix', 'artist': 'Various Artists'}",Techno,2022-04-23
Benny Benassi/Benny Benassi - Live @ Coachella Music Festival 2013 in California (13.04.13).mp3,Benny Benassi,Benny Benassi,"{'name': 'Coachella 2013', 'artist': 'Various Artists'}",Electronic,2013-04-13
Benny Benassi/Benny Benassi - Live @ Privilege in Ibiza (04.08.12).mp3,Live at Privilege Ibiza,Benny Benassi,"{'name': 'Benny Benassi Sets', 'artist': 'Benny Benassi'}",House,2012-08-04
Better Lost Than Stupid/Better Lost Than Stupid - Live @ Miami WMC 2017 in Miani (25.03.17).mp3,Better Lost Than Stupid,Better Lost Than Stupid,"{'name': 'Miami WMC 2017', 'artist': 'Various Artists'}",House,2017-03-25
Bicep/Bicep - Live on Radio 1 Essential Mix (09.12.17).mp3,Bicep 2017,Bicep,"{'name': 'Essential Mix', 'artist': 'Various Artists'}",House,2017
Bicep/Bicep - Live on Radio 1 Essential Mix (27.09.14).mp3,Bicep 2014,Bicep,"{'name': 'Essential Mix', 'artist': 'Various Artists'}",House,2014-09-27
Big Gigantic/Big Gigantic - Live @ Coachella Music Festival 2017 in California (14.04.17).mp3,Big Gigantic,Big Gigantic,"{'name': 'Coachella 2017', 'artist': 'Various Artists'}",Electronic,2017-04-14
Bklava/Bklava - Live on Radio 1 Essential Mix (20.08.22).mp3,Bklava 2022,Bklava,"{'name': 'Essential Mix', 'artist': 'Various Artists'}",Electronic,2022-08-20
Black Coffee/Black Coffee - Live @ Coachella 2022 in California (19.04.22).mp3,Black Coffee,Black Coffee,"{'name': 'Coachella 2022', 'artist': 'Various Artists'}",Electronic,2022
Black Coffee/Black Coffee - Live @ Coachella Music Festival 2016 in California (22.04.16).mp3,Black Coffee,Black Coffee,"{'name': 'Coachella 2016', 'artist': 'Various Artists'}",House,2016-04-22
Black Coffee/Black Coffee - Live on Radio 1 Essential Mix (04.07.20).mp3,Black Coffee 2020,Black Coffee,"{'name': 'Essential Mix', 'artist': 'Various Artists'}",House,2020
Black Coffee/Black Coffee - Live on Radio 1 Essential Mix (21.11.15).mp3,Black Coffee 2015,Black Coffee,"{'name': 'Essential Mix', 'artist': 'Various Artists'}",Electronic,2015
Bob Moses/Bob Moses - Live @ Coachella Music Festival 2016 in California (23.04.16).mp3,Bob Moses,Bob Moses,"{'name': 'Coachella 2016', 'artist': 'Various Artists'}",House,2016-04-23
Bodinski & Gesaffelstein/Bodinski & Gesaffelstein - Live @ Sonar Festival 2012 in Barcelona (16.06.12).mp3,Brodinski & Gesaffelstein,Brodinski & Gesaffelstein,"{'name': 'Sonar Festival 2012', 'artist': 'Various Artists'}",Electronic,2012-06-16
Bonobo/Bonobo - Live @ Coachella Music Festival 2017 in California (14.04.17).mp3,Bonobo,Bonobo,"{'name': 'Coachella 2017', 'artist': 'Various Artists'}",Electronic,2017-04-14
Bonobo/Bonobo - Live @ Glastonbury Festival 2022 in Somerset (02.07.22).mp3,Bonobo,Bonobo,"{'name': 'Glastonbury Festival 2022', 'artist': 'Various Artists'}",Electronic,2022
Bonobo/Bonobo - Live on Radio 1 Essential Mix (12.04.14).mp3,Bonobo 2014,Bonobo,"{'name': 'Essential Mix', 'artist': 'Various Artists'}",Electronic,2014-04-12
Bonobo & TEED/Bonobo & TEED - Live on Radio 1 Essential Mix (17.10.20).mp3,Bonobo & TEED 2020,Bonobo & TEED,"{'name': 'Essential Mix', 'artist': 'Various Artists'}",Electronic,2020-10-17
Bontan/Bontan - Live on Radio 1 Essential Mix (25.11.17).mp3,Bontan 2017,Bontan,"{'name': 'Essential Mix', 'artist': 'Various Artists'}",House,2017-11-25
Bou/Bou - Live on Radio 1 Essential Mix (05.11.22).mp3,Bou 2022,Bou,"{'name': 'Essential Mix', 'artist': 'Various Artists'}",Electronic,2022-11-05
Bradley Zero/Bradley Zero - Live on Radio 1 Essential Mix (24.10.20).mp3,Bradley Zero 2020,Bradley Zero,"{'name': 'Essential Mix', 'artist': 'Various Artists'}",Electronic,2020-10-24
Butch/Butch - Live on Radio 1 Essential Mix (03.03.12).mp3,Butch 2012,Butch,"{'name': 'Essential Mix', 'artist': 'Various Artists'}",Electronic,2012
"CC Disco!/Radio 1's Essential Mix, CC DISCO!.mp4",CC DISCO!,CC DISCO!,"{'name': 'Essential Mix', 'artist': 'Various Artists'}",Electronic,
Calibrre/Calibrre - Live on Radio 1 Essential Mix (01.07.17).mp3,Calibrre 2017,Calibrre,"{'name': 'Essential Mix', 'artist': 'Various Artists'}",Electronic,2017-07-01
Calvin Harris/Calvin Harris - Live @ Coachella Music Festival 2014 in California (13.04.14).mp3,Calvin Harris,Calvin Harris,"{'name': 'Coachella 2014', 'artist': 'Various Artists'}",House,2014-04-13
Calvin Harris/Calvin Harris - Live @ Radio 1 Big Weekend in Coventry (18.06.22).mp3,Calvin Harris,Calvin Harris,"{'name': 'Radio 1 Big Weekend 2022', 'artist': 'Various Artists'}",House,2022-06-18
"Calvin Harris/Calvin Harris - Live @ Radio 1 Party, Ushuaia Hotel in Ibiza (31.07.15).mp3",Calvin Harris,Calvin Harris,"{'name': 'Ushuaia 2015', 'artist': 'Various Artists'}",House,2015-07-31
Calyx & Teebee/Calyx & Teebee - Live on Radio 1 Essential Mix (08.12.12).mp3,Calyx & Teebee 2012,Calyx & Teebee,"{'name': 'Essential Mix', 'artist': 'Various Artists'}",Drum & Bass,2012-12-08
Camelphat/Camelphat - Live @ Coachella 2019 in California (19.04.19).mp3,CamelPhat,CamelPhat,"{'name': 'Coachella 2019', 'artist': 'Various Artists'}",Techno,2019-04-19
Camelphat/Camelphat - Live on Radio 1 Essential Mix (31.10.20).mp3,CamelPhat 2020,CamelPhat,"{'name': 'Essential Mix', 'artist': 'Various Artists'}",House,2020-10-31
Camo & Krooked/Camo & Krooked - Live on Radio 1 Essential Mix (06.05.17).mp3,Camo & Krooked 2017,Camo & Krooked,"{'name': 'Essential Mix', 'artist': 'Various Artists'}",Drum & Bass,2017-05-06
Caribou/Caribou - Live @ Coachella 2022 in California (19.04.22).mp3,Caribou,Caribou,"{'name': 'Coachella 2022', 'artist': 'Various Artists'}",Electronic,2022-04-19
Caribou/Caribou - Live on Radio 1 Essential Mix (18.10.14).mp3,Caribou 2014,Caribou,"{'name': 'Essential Mix', 'artist': 'Various Artists'}",Electronic,2014-10-18
Caribou/Caribou - Live on Radio 1 Essential Mix (29.02.20).mp3,Caribou 2020,Caribou,"{'name': 'Essential Mix', 'artist': 'Various Artists'}",Electronic,2020-02-29
Caribou/Caribou - Live on Radio 1 Essential Mix of The Year (27.12.14).mp3,Caribou 2014,Caribou,"{'name': 'Essential Mix', 'artist': 'Various Artists'}",Electronic,2014-12-27
Carista/Carista - Live on Radio 1 Essential Mix (07.02.20).mp3,Carista 2020,Carista,"{'name': 'Essential Mix', 'artist': 'Various Artists'}",Electronic,2020-02-07
"Carl Cox/Carl Cox - Live @ Carl Cox Birthday Party, Space in Ibiza (31.07.12).mp3",Carl Cox Live at Space Ibiza 2012,Carl Cox,"{'name': 'Carl Cox Sets', 'artist': 'Carl Cox'}",Techno,2012-07-31
Carl Cox/Carl Cox - Live @ Ibiza Rocks Hotel in Ibiza (02.08.15).mp3,Carl Cox,Carl Cox,"{'name': 'Ibiza Rocks 2015', 'artist': 'Various Artists'}",Techno,2015
"Carl Cox/Carl Cox - Live @ Radio 1 Essential Mix Ibiza 20 Special Part 6, Space (27.07.15).mp3",Carl Cox 2015,Carl Cox,"{'name': 'Essential Mix', 'artist': 'Various Artists'}",Techno,2015-07-27
Carl Cox/Carl Cox - Live @ Space in Ibiza (11.10.14).mp3,Live at Space Ibiza 2014,Carl Cox,"{'name': 'Carl Cox Sets', 'artist': 'Carl Cox'}",Techno,2014-10-11
Carl Cox/Carl Cox - Live on Radio 1 Essential Mix (01.08.20).mp3,Carl Cox 2020,Carl Cox,"{'name': 'Essential Mix', 'artist': 'Various Artists'}",Techno,2020
Carnage/Carnage - Live @ Coachella Music Festival 2014 in California (13.04.14).mp3,Carnage,Carnage,"{'name': 'Coachella 2014', 'artist': 'Various Artists'}",Electronic,2014-04-13
Chaos In The CBD/Chaos In The CBD - Live on Radio 1 Essential Mix (21.03.20).mp3,Chaos In The CBD 2020,Chaos In The CBD,"{'name': 'Essential Mix', 'artist': 'Various Artists'}",House,2020-03-21
"Charli XCX/BBC Radio 1's Big Weekend, Live Sets_ Luton 2024, Charli XCX.mp4",Charli XCX,Charli XCX,"{'name': ""BBC Radio 1's Big Weekend 2024"", 'artist': 'Various Artists'}",Pop,2024
"Charlie Hedges/Radio 1's Dance Weekend, Dance Anthems Ibiza, Charlie Hedges live from Ibiza.mp4",Charlie Hedges,Charlie Hedges,"{'name': ""Radio 1's Dance Weekend"", 'artist': 'Various Artists'}",Dance,
Charlotte De Witte/Charlotte De Witte - Live @ Coachella 2019 in California (21.04.19).mp3,Charlotte De Witte,Charlotte De Witte,"{'name': 'Coachella 2019', 'artist': 'Various Artists'}",Techno,2019-04-21
Chase & Status/Chase & Status - Live @ Privilege in Ibiza (04.08.12).mp3,Live at Privilege Ibiza 2012,Chase & Status,"{'name': 'Chase & Status Sets', 'artist': 'Chase & Status'}",Drum & Bass,2012-08-04
"Chase & Status/Radio 1's Dance Weekend, Radio 1 Dance Ibiza, Chase and Status.mp4",Chase & Status,Chase & Status,"{'name': ""Radio 1's Dance Weekend"", 'artist': 'Various Artists'}",Drum & Bass,
Chloe Robinson/Chloe Robinson - LIve on Radio 1 Essential Mix (24.09.22).mp3,Chloe Robinson 2022,Chloe Robinson,"{'name': 'Essential Mix', 'artist': 'Various Artists'}",Electronic,2022-09-24
Chris Lake/Chris Lake - Live @ Coachella 2019 in California (19.04.19).mp3,Chris Lake,Chris Lake,"{'name': 'Coachella 2019', 'artist': 'Various Artists'}",Techno,2019-04-19
Chris Liebing/Chris Liebing - Live @ Coachella 2022 in California (19.04.22).mp3,Chris Liebing,Chris Liebing,"{'name': 'Coachella 2022', 'artist': 'Various Artists'}",Techno,2022-04-19
Chuckie/Chuckie - Live @ Essential Mix in Hull (28.01.12).mp3,Chuckie 2012,Chuckie,"{'name': 'Essential Mix', 'artist': 'Various Artists'}",House,2012-01-28
Claptone/Claptone - Live @ Coachella Music Festival 2016 in California (24.04.16).mp3,Claptone,Claptone,"{'name': 'Coachella 2016', 'artist': 'Various Artists'}",House,2016-04-24
Claptone/Claptone - Live on Radio 1 Essential Mix (25.04.15).mp3,Claptone 2015,Claptone,"{'name': 'Essential Mix', 'artist': 'Various Artists'}",House,2015-04-25
Claptone/Claptone - Live on Radio 1 Essential Mix (25.07.20).mp3,Claptone 2020,Claptone,"{'name': 'Essential Mix', 'artist': 'Various Artists'}",House,2020-07-25
Classix/Classixx - Live @ Coachella Music Festival 2017 in California (15.04.17).mp3,Classixx,Classixx,"{'name': 'Coachella 2017', 'artist': 'Various Artists'}",Electronic,2017-04-15
Claude Von Stroke/Claude Von Stroke - Live on Radio 1 Essential Mix (15.02.20).mp3,Claude VonStroke 2020,Claude VonStroke,"{'name': 'Essential Mix', 'artist': 'Various Artists'}",House,2020-02-15
Coldcut & Seven Davis Jr/Coldcut & Seven Davis Jr - Live on Radio Essential Mix (26.09.15).mp3,Coldcut & Seven Davis Jr 2015,Coldcut & Seven Davis Jr,"{'name': 'Essential Mix', 'artist': 'Various Artists'}",Electronic,2015-09-26
"Confidence Man/BBC Radio 1's Big Weekend, Live Sets_ Liverpool 2025, Confidence Man.mp4",Confidence Man,Confidence Man,"{'name': ""BBC Radio 1's Big Weekend 2025"", 'artist': 'Various Artists'}",Dance,2025
Courtland/Courtland - Live @ Coachella Music Festival 2017 in California (15.04.17).mp3,Courtland,Courtland,"{'name': 'Coachella 2017', 'artist': 'Various Artists'}",Electronic,2017-04-15
Cut Snake/Cut Snake - Live @ Coachella Music Festival 2016 in California (23.04.16).mp3,Cut Snake,Cut Snake,"{'name': 'Coachella 2016', 'artist': 'Various Artists'}",House,2016-04-23
Cystal Castles/Crystal Castles - Live @ Coachella Music Festival 2017 in California (14.04.17).mp3,Crystal Castles,Crystal Castles,"{'name': 'Coachella 2017', 'artist': 'Various Artists'}",Electronic,2017-04-14
"D.O.D./Radio 1 Dance Presents..., Armada Music_ D.O.D..mp4",D.O.D,D.O.D,"{'name': 'Radio 1 Dance Presents...', 'artist': 'Various Artists'}",Electronic,
DJ Boring/DJ Boring - Live on Radio 1 Essential Mix (13.06.20).mp3,DJ Boring 2020,DJ Boring,"{'name': 'Essential Mix', 'artist': 'Various Artists'}",House,2020-06-13
DJ Craze/DJ Craze - Live on Radio 1 Essential Mix (18.11.17).mp3,DJ Craze 2017,DJ Craze,"{'name': 'Essential Mix', 'artist': 'Various Artists'}",Electronic,2017-11-18
DJ EZ/DJ EZ - Live on Radio 1 Essential Mix (11.04.15).mp3,DJ EZ 2015,DJ EZ,"{'name': 'Essential Mix', 'artist': 'Various Artists'}",Electronic,2015-04-11
DJ Khaled/DJ Khaled - Live @ Coachella Music Festival 2017 in California (16.04.17).mp3,DJ Khaled,DJ Khaled,"{'name': 'Coachella 2017', 'artist': 'Various Artists'}",Hip Hop,2017-04-16
DJ Minx/DJ Minx - Live on Raio 1 Essential Mix (29.01.22).mp3,DJ Minx 2022,DJ Minx,"{'name': 'Essential Mix', 'artist': 'Various Artists'}",Electronic,2022-01-29
DJ Mustard/DJ Mustard - Live @ Coachella Music Festival 2016 in California (22.04.16).mp3,DJ Mustard,DJ Mustard,"{'name': 'Coachella 2016', 'artist': 'Various Artists'}",Hip Hop,2016-04-22
"DJ Seinfeld/The Radio 1 Mini Mix, DJ Seinfeld's 'Six Month Fever Dream' Mini Mix.mp4",Six Month Fever Dream Mini Mix,DJ Seinfeld,"{'name': 'DJ Seinfeld Sets', 'artist': 'DJ Seinfeld'}",House,
DJ Shadow/DJ Shadow - Live @ Coachella Music Festival 2017 in California (14.04.17).mp3,DJ Shadow,DJ Shadow,"{'name': 'Coachella 2017', 'artist': 'Various Artists'}",Electronic,2017-04-14
DJ Snake/DJ Snake - Live @ Coachella Music Festival 2015 in California (10.04.15).mp3,DJ Snake,DJ Snake,"{'name': 'Coachella 2015', 'artist': 'Various Artists'}",Electronic,2015-04-10
DJ Snake/DJ Snake - Live @ Coachella Music Festival 2017 in California (14.04.17).mp3,DJ Snake,DJ Snake,"{'name': 'Coachella 2017', 'artist': 'Various Artists'}",Electronic,2017-04-14
DJ Snake/DJ Snake - Live @ Coachella Music Festival 2017 in California (15.04.17).mp3,DJ Snake,DJ Snake,"{'name': 'Coachella 2017', 'artist': 'Various Artists'}",Electronic,2017-04-15
DJ Snake/DJ Snake - Live on Radio 1 Essential Mix (25.01.14).mp3,DJ Snake 2014,DJ Snake,"{'name': 'Essential Mix', 'artist': 'Various Artists'}",Electronic,2014-01-25
"DJ Sneak/DJ Sneak - Live @ Carnival, Sankeys in Ibiza (28.07.12).mp3",Live at Carnival Sankeys Ibiza 2012,DJ Sneak,"{'name': 'DJ Sneak Sets', 'artist': 'DJ Sneak'}",House,2012-07-28
DJ Tennis/DJ Tennis - Live on Radio 1 Essential Mix (14.10.17).mp3,DJ Tennis 2017,DJ Tennis,"{'name': 'Essential Mix', 'artist': 'Various Artists'}",House,2017-10-14
Daft Punk/Daft Punk - Live @ Coachella Festival 2006 in California (29.04.06).mp3,Daft Punk,Daft Punk,"{'name': 'Coachella 2006', 'artist': 'Various Artists'}",Electronic,2006-04-29
Damian Lazarus & The Ancient Moons/Damian Lazarus & The Ancient Moons - Live on Radio 1 Essential Mix (16.05.15).mp3,Damian Lazarus & The Ancient Moons 2015,Damian Lazarus & The Ancient Moons,"{'name': 'Essential Mix', 'artist': 'Various Artists'}",Electronic,2015-05-16
Dan Shake/Dan Shake - Live on Radio 1 Essential Mix (11.06.22).mp3,Dan Shake 2022,Dan Shake,"{'name': 'Essential Mix', 'artist': 'Various Artists'}",House,2022
"Dan Shake B2B Myd/Radio 1 Dance Presents..., Radio 1 in Ibiza_ Dan Shake B2B Myd at Glitterbox, Hï Ibiza.mp4",Dan Shake B2B Myd,Dan Shake B2B Myd,"{'name': 'Radio 1 Dance Presents...', 'artist': 'Various Artists'}",Electronic,
Daniel Avery/Daniel Avery - Live on Radio 1 Essential Mix (29.03.14).mp3,Daniel Avery 2014,Daniel Avery,"{'name': 'Essential Mix', 'artist': 'Various Artists'}",House,2014
"Danny Howard/Danny Howard's Club Mix, Diplo, Charli XCX, Becky Hill and Eric Prydz!.mp4","Diplo, Charli XCX, Becky Hill and Eric Prydz",Danny Howard,"{'name': 'Danny Howard Sets', 'artist': 'Danny Howard'}",Dance,
"Danny Howard/Danny Howard's Club Mix, FISH56OCTAGON, Skream and Gaskin.mp4","Danny Howard's Club Mix, FISH56OCTAGON, Skream, Gaskin",Danny Howard,"{'name': 'Danny Howard Sets', 'artist': 'Danny Howard'}",House,
"Danny Howard/Danny Howard's Club Mix, Gorgon City, Olive F & Hot Since 82..mp4","Danny Howard's Club Mix, Gorgon City, Olive F and Hot Since 82",Danny Howard,"{'name': 'Danny Howard Sets', 'artist': 'Danny Howard'}",House,
"Danny Howard/Danny Howard's Club Mix, Hot Since 82, Arielle Free, Patrick Topping and Ewan McVicar!.mp4","Danny Howard's Club Mix, Hot Since 82, Arielle Free, Patrick Topping and Ewan McVicar",Danny Howard,"{'name': 'Danny Howard Sets', 'artist': 'Danny Howard'}",Dance,
"Danny Howard/Danny Howard's Club Mix, Jamie Jones & Green Velvet, Angel Lee, La La..mp4","Danny Howard's Club Mix, Jamie Jones, Green Velvet, Angel Lee and La La.",Danny Howard,"{'name': 'Danny Howard Sets', 'artist': 'Danny Howard'}",Tech House,
"Danny Howard/Danny Howard's Club Mix, Murphy's Law, Kristen Velvet and Mark Knight & Armand Van Helden.mp4","Danny Howard's Club Mix, Murphy's Law, Kristen Velvet, Mark Knight and Armand Van Helden",Danny Howard,"{'name': 'Danny Howard Sets', 'artist': 'Danny Howard'}",House,
"Danny Howard/Danny Howard's Club Mix, Summer Feels Club Mix Beach Vibes.mp4",Summer Feels Club Mix Beach Vibes,Danny Howard,"{'name': 'Danny Howard Sets', 'artist': 'Danny Howard'}",Dance,
"Danny Howard/Danny Howard's Club Mix, Summer Feels Club Mix Ibiza 2023.mp4",Summer Feels Club Mix Ibiza 2023,Danny Howard,"{'name': 'Danny Howard Sets', 'artist': 'Danny Howard'}",House,2023
"Danny Howard/Danny Howard's Club Mix, Summer Feels Club Mix Ibiza Classics.mp4",Summer Feels Club Mix Ibiza Classics,Danny Howard,"{'name': 'Danny Howard Sets', 'artist': 'Danny Howard'}",Dance,
"Danny Howard/Danny Howard's Club Mix, Summer Feels Club Mix Piano House.mp4",Summer Feels Club Mix Piano House,Danny Howard,"{'name': 'Danny Howard Sets', 'artist': 'Danny Howard'}",House,
"Danny Howard/Danny Howard's Club Mix, Summer Feels Club Mix Pool Party.mp4",Summer Feels Club Mix Pool Party,Danny Howard,"{'name': 'Danny Howard Sets', 'artist': 'Danny Howard'}",Dance,
"Danny Howard/Danny Howard's Club Mix, The Feel Good Series, Chris Stussy, Skream and Patrick Topping.mp4","The Feel Good Series, Chris Stussy, Skream and Patrick Topping",Danny Howard,"{'name': 'Danny Howard Sets', 'artist': 'Danny Howard'}",Dance,
Dave Clarke/Dave Clarke - Live on Radio 1 Essential Mix (31.10.15).mp3,Dave Clarke 2015,Dave Clarke,"{'name': 'Essential Mix', 'artist': 'Various Artists'}",Electronic,2015-10-31
David Guetta/David Guetta & BEP - Live @ Coachella Music Festival 2015 in California (12.04.15).mp3,David Guetta & BEP,David Guetta & BEP,"{'name': 'Coachella 2015', 'artist': 'Various Artists'}",House,2015
David Guetta/David Guetta - Live @ Hackney Weekend 2012 in London (30.06.12).mp3,David Guetta,David Guetta,"{'name': 'Hackney Weekend 2012', 'artist': 'Various Artists'}",House,2012-06-30
"David Guetta/David Guetta - Live @ Radio 1 Party, Ushuaia in Ibiza (01.08.14).mp3",David Guetta,David Guetta,"{'name': 'Ushuaia 2014', 'artist': 'Various Artists'}",House,2014-08-01
David Guetta/David Guetta - Live on Radio 1 Essential Mix (23.05.15).mp3,David Guetta 2015,David Guetta,"{'name': 'Essential Mix', 'artist': 'Various Artists'}",House,2015-05-23
David Guetta/David_Guetta_live_@_Tomorrowland_2024.mp3,David Guetta,David Guetta,"{'name': 'Tomorrowland 2024', 'artist': 'Various Artists'}",House,2024
Davide Squillace/Davide Squillace - Live on Radio 1 Essential Mix (29.09.12).mp3,Davide Squillace 2012,Davide Squillace,"{'name': 'Essential Mix', 'artist': 'Various Artists'}",Electronic,2012
Daði Freyr/Daoi_Freyr_-_Live_@_Roundhouse_London_2022.mp3,"Live at Roundhouse, London 2022",Daði Freyr,"{'name': 'Daði Freyr Sets', 'artist': 'Daði Freyr'}",Pop,2022
Daði Freyr/Daoi_Freyr_-_live_at_Pinkpop_2023.mp3,"Daði Freyr, Pinkpop 2023",Daði Freyr,"{'name': 'Daði Freyr Sets', 'artist': 'Daði Freyr'}",Pop,2023
Deadmau5/Deadmau5 - Live @ Coachella Festival 2011 in California (15.04.11).mp3,Deadmau5,Deadmau5,"{'name': 'Coachella 2011', 'artist': 'Various Artists'}",Electronic,2011-04-15
Deadmau5/Deadmau5 - Live @ Hackney Weekend 2012 in London (30.06.12).mp3,Deadmau5,Deadmau5,"{'name': 'Hackney Weekend 2012', 'artist': 'Various Artists'}",Electronic,2012-06-30
Deadmau5 & Luciano/Deadmau5 & Luciano - Live @ Radio 1 Essential Mix Ibiza 20 Special Part 3 (26.07.15).mp3,Deadmau5 & Luciano 2015,Deadmau5 & Luciano,"{'name': 'Essential Mix', 'artist': 'Various Artists'}",Electronic,2015-07-26
Deep Dish/Deep Dish - Live @ Coachella 2019 in California (20.04.19).mp3,Deep Dish,Deep Dish,"{'name': 'Coachella 2019', 'artist': 'Various Artists'}",House,2019-04-20
Deep Dish/Deep Dish - Live on Radio 1 Essential Mix (22.03.14).mp3,Deep Dish 2014,Deep Dish,"{'name': 'Essential Mix', 'artist': 'Various Artists'}",Electronic,2014-03-22
Deetron/Deetron - Live on Radio 1 Essential Mix (17.11.12).mp3,Deetron 2012,Deetron,"{'name': 'Essential Mix', 'artist': 'Various Artists'}",Techno,2012-11-17
"Denis Sulta/Radio 1's Classic Essential Mix, Denis Sulta 2018.mp4",Denis Sulta 2018,Denis Sulta,"{'name': 'Essential Mix', 'artist': 'Various Artists'}",Electronic,2018
Deorro/Deorro - Live @ Coachella Music Festival 2015 in California (11.04.15).mp3,Deorro,Deorro,"{'name': 'Coachella 2015', 'artist': 'Various Artists'}",House,2015-04-11
Detroit Swindle/Detroit Swindle - Live on Radio Essential Mix (20.06.15).mp3,Detroit Swindle 2015,Detroit Swindle,"{'name': 'Essential Mix', 'artist': 'Various Artists'}",House,2015-06-20
Dillon Francis/Dillon Francis - Live @ Coachella Music Festival 2014 in California (13.04.14).mp3,Dillon Francis,Dillon Francis,"{'name': 'Coachella 2014', 'artist': 'Various Artists'}",Electronic,2014-04-13
Dillon Francis/Dillon Francis - Live @ Coachella Music Festival 2017 in California (14.04.17).mp3,Dillon Francis,Dillon Francis,"{'name': 'Coachella 2017', 'artist': 'Various Artists'}",Electronic,2017
Diplo/Diplo - Live on Radio 1 Essential Mix (19.03.22).mp3,Diplo 2022,Diplo,"{'name': 'Essential Mix', 'artist': 'Various Artists'}",Electronic,2022
Dirty South/Dirty South - Live @ Coachella Music Festival 2015 in California (11.04.15).mp3,Dirty South,Dirty South,"{'name': 'Coachella 2015', 'artist': 'Various Artists'}",House,2015-04-11
Disciples/Disciples - Live on Radio 1 Essential Mix (21.01.17).mp3,Disciples 2017,Disciples,"{'name': 'Essential Mix', 'artist': 'Various Artists'}",House,2017-01-21
Disclosure/Disclosure - Live @ Coachella 2022 in California (19.04.22).mp3,Disclosure,Disclosure,"{'name': 'Coachella 2022', 'artist': 'Various Artists'}",Electronic,2022-04-19
Disclosure/Disclosure - Live @ Coachella Music Festival 2014 in California (13.04.14).mp3,Disclosure,Disclosure,"{'name': 'Coachella 2014', 'artist': 'Various Artists'}",Electronic,2014-04-13
Disclosure/Disclosure - Live @ Radio 1 Big Weekend in Coventry (18.06.22).mp3,Disclosure,Disclosure,"{'name': 'Radio 1 Big Weekend 2022', 'artist': 'Various Artists'}",Electronic,2022-06-18
"Disclosure/Disclosure - Live @ Radio 1 Party, Ushuaia Hotel in Ibiza (31.07.15).mp3",Disclosure,Disclosure,"{'name': 'Ushuaia 2015', 'artist': 'Various Artists'}",House,2015-07-31
"Disclosure/Radio 1's Classic Essential Mix, Disclosure 2013.mp4",Disclosure 2013,Disclosure,"{'name': 'Essential Mix', 'artist': 'Various Artists'}",Electronic,2013
Doc Scott/Doc Scott - Live on Radio 1 Essential Mix (28.11.20).mp3,Doc Scott 2020,Doc Scott,"{'name': 'Essential Mix', 'artist': 'Various Artists'}",Drum & Bass,2020-11-28
Dom Dolla/Dom Dolla - Live @ Coachella 2022 in California (19.04.22).mp3,Dom Dolla,Dom Dolla,"{'name': 'Coachella 2022', 'artist': 'Various Artists'}",House,2022-04-19
Dom Dolla/Dom_Dolla_Live_@_Coachella_2024_Sahara_Tent.mp3,Dom Dolla,Dom Dolla,"{'name': 'Coachella 2024', 'artist': 'Various Artists'}",House,2024
Dom Dolla/Dom_Dolla_Live_@_Drumsheds_London_2024.mp3,Dom Dolla Live,Dom Dolla,"{'name': 'Drumsheds', 'artist': 'Various Artists'}",House,2024
Dom Dolla/Dom_Dolla_Live_@_EDC_Las_Vegas_2024_circuitGROUNDS.mp3,Dom Dolla,Dom Dolla,"{'name': 'EDC Las Vegas 2024', 'artist': 'Various Artists'}",Electronic,2024
Dom Dolla/Dom_Dolla_b2b_Solomun_Live_@_The_Wool_Store_Melbourne_2024.mp3,Live at The Wool Store Melbourne,Dom Dolla b2b Solomun,"{'name': 'Dom Dolla Sets', 'artist': 'Various Artists'}",Electronic,2024
Dom Dolla/Selected_Sessions_Dom_Dolla_Belgrade_DJ_Set.mp3,Belgrade DJ Set,Dom Dolla,"{'name': 'Dom Dolla Sets', 'artist': 'Various Artists'}",House,
Don Diablo/Don Diablo - Live on Radio 1 Essential Mix (15.04.17).mp3,Don Diablo 2017,Don Diablo,"{'name': 'Essential Mix', 'artist': 'Various Artists'}",House,2017-04-15
Drumsound & Bassline Smith/Drumsound & Bassline Smith - Live on Radio 1 Essential Mix (22.09.12).mp3,Drumsound & Bassline Smith 2012,Drumsound & Bassline Smith,"{'name': 'Essential Mix', 'artist': 'Various Artists'}",Drum & Bass,2012-09-22
Dubfire/Dubfire - Live on Radio 1 Essential Mix (08.10.22).mp3,Dubfire 2022,Dubfire,"{'name': 'Essential Mix', 'artist': 'Various Artists'}",Electronic,2022
Dubfire/Dubfire - Live on Radio 1 Essential Mix (26.05.12).mp3,Dubfire 2012,Dubfire,"{'name': 'Essential Mix', 'artist': 'Various Artists'}",Electronic,2012-05-26
Dubtendo/Dubtendo_Pop_Up_Party_-_Bristol_-_Dubtendo_Allstars.mp3,Pop Up Party Bristol,Dubtendo,"{'name': 'Dubtendo Sets', 'artist': 'Dubtendo'}",Electronic,2024
Duck Sauce/Duck Sauce - Live @ Coachella 2022 in California (19.04.22).mp3,Duck Sauce,Duck Sauce,"{'name': 'Coachella 2022', 'artist': 'Various Artists'}",Electronic,2022
Duck Sauce/Duck Sauce - Live @ Coachella Music Festival 2014 in California (13.04.14).mp3,Duck Sauce,Duck Sauce,"{'name': 'Coachella 2014', 'artist': 'Various Artists'}",Electro House,2014-04-13
Duck Sauce/Duck Sauce - Live on Radio 1 Essential Mix (12.12.20).mp3,Duck Sauce 2020,Duck Sauce,"{'name': 'Essential Mix', 'artist': 'Various Artists'}",Electronic,2020-12-12
Duke Dumont/Duke Dumont - Live @ Coachella 2022 in California (19.04.22).mp3,Duke Dumont,Duke Dumont,"{'name': 'Coachella 2022', 'artist': 'Various Artists'}",Electronic,2022-04-19
Duke Dumont/Duke Dumont - Live @ Coachella Music Festival 2015 in California (11.04.15).mp3,Duke Dumont,Duke Dumont,"{'name': 'Coachella 2015', 'artist': 'Various Artists'}",Electronic,2015-04-11
"Duke Dumont/Duke Dumont - Live @ Radio 1 Party, Ushuaia in Ibiza (01.08.14).mp3",Duke Dumont,Duke Dumont,"{'name': 'Ushuaia 2014', 'artist': 'Various Artists'}",House,2014-08-01
Duke Dumont/Duke_Dumont_-_BBC_Radio_1_Essential_Mix_2020.mp3,Duke Dumont 2020,Duke Dumont,"{'name': 'Essential Mix', 'artist': 'Various Artists'}",House,2020
"Dusky/Dusky - Live @ Radio 1 Party, Ushuaia Hotel in Ibiza (31.07.15).mp3",Dusky,Dusky,"{'name': 'Ushuaia 2015', 'artist': 'Various Artists'}",House,2015-07-31
Dusky/Dusky - Live on Radio 1 Essential Mix (13.10.12).mp3,Dusky 2012,Dusky,"{'name': 'Essential Mix', 'artist': 'Various Artists'}",House,2012-10-13
East End Dubs/East End Dubs - Live on Radio 1 Essential Mix (29.10.22).mp3,East End Dubs 2022,East End Dubs,"{'name': 'Essential Mix', 'artist': 'Various Artists'}",Electronic,2022-10-29
Eats Everything/Eats Everything - Live @ Radio 1 Big Weekend in Coventry (18.06.22).mp3,Eats Everything,Eats Everything,"{'name': 'Radio 1 Big Weekend 2022', 'artist': 'Various Artists'}",House,2022-06-18
Eats Everything/Eats Everything - Live on Radio 1 Essential Mix (15.12.12).mp3,Eats Everything 2012,Eats Everything,"{'name': 'Essential Mix', 'artist': 'Various Artists'}",Electronic,2012-12-15
"Eats Everything/Radio 1's Dance Weekend, Radio 1 Dance Ibiza, Eats Everything.mp4",Eats Everything,Eats Everything,"{'name': ""Radio 1's Dance Weekend"", 'artist': 'Various Artists'}",House,
Ed Banger Special/Ed Banger Special - Live on Radio 1 Essential Mix (17.10.15).mp3,Ed Banger Special 2015,Ed Banger Special,"{'name': 'Essential Mix', 'artist': 'Various Artists'}",Electronic,2015-10-17
Eli and Fur/Eli and Fur - Live @ Coachella Music Festival 2017 in California (15.04.17).mp3,Eli and Fur,Eli and Fur,"{'name': 'Coachella 2017', 'artist': 'Various Artists'}",House,2017-04-15
Ellie Gouldin/Ellie Gouldin - Live @ Coachella Music Festival 2016 in California (22.04.16).mp3,Ellie Goulding,Ellie Goulding,"{'name': 'Coachella 2016', 'artist': 'Various Artists'}",Pop,2016-04-22
Emo Nite/Emo Nite - Live @ Coachella 2022 in California (19.04.22).mp3,Emo Nite,Emo Nite,"{'name': 'Coachella 2022', 'artist': 'Various Artists'}",Electronic,2022-04-19
Empire Of The Sun/Empire Of The Sun - Live @ Coachella Music Festival 2017 in California (14.04.17).mp3,Empire Of The Sun,Empire Of The Sun,"{'name': 'Coachella 2017', 'artist': 'Various Artists'}",Electronic,2017-04-14
Eric Prydz/Eric_Prydz_-_Live_from_History_Toronto_2025_FULL_SET.mp3,"Eric Prydz, History Toronto 2025",Eric Prydz,"{'name': 'Eric Prydz Sets', 'artist': 'Eric Prydz'}",House,2025
"Eric Prydz/Erid Prydz - Live @ Radio 1 Party, Ushuaia in Ibiza (01.08.14).mp3",Eric Prydz,Eric Prydz,"{'name': 'Ushuaia 2014', 'artist': 'Various Artists'}",House,2014-08-01
"Eric Prydz/Radio 1's Classic Essential Mix, Eric Prydz 2013.mp4",Eric Prydz 2013,Eric Prydz,"{'name': 'Essential Mix', 'artist': 'Various Artists'}",Electronic,2013
Eric Prydz & Jeremy Olander/Eric Prydz & Jeremy Olander - Live on Radio 1 Essential Mix (03.01.15).mp3,Eric Prydz & Jeremy Olander 2015,Eric Prydz & Jeremy Olander,"{'name': 'Essential Mix', 'artist': 'Various Artists'}",Electronic,2015-03-01
Erick Morillo/Erick Morillo - Live on Radio 1 Essential Mix - Masters Series 1 (14.02.15).mp3,Erick Morillo 2015,Erick Morillo,"{'name': 'Essential Mix', 'artist': 'Various Artists'}",House,2015-02-14
Etienne de Crecy/Etienne de Crecy - Live on Radio 1 Essential Mix (07.03.15).mp3,Etienne de Crecy 2015,Etienne de Crecy,"{'name': 'Essential Mix', 'artist': 'Various Artists'}",Electronic,2015
"Europe's Biggest Dance Show/Europe's Biggest Dance Show, 2025, Austria, FM4.mp4","Austria, FM4",FM4,"{'name': ""Europe's Biggest Dance Show 2025"", 'artist': 'Various Artists'}",Dance,2025
"Europe's Biggest Dance Show/Europe's Biggest Dance Show, 2025, Belgium, Studio Brussel.mp4","Belgium, Studio Brussel",Studio Brussel,"{'name': ""Europe's Biggest Dance Show 2025"", 'artist': 'Various Artists'}",Dance,2025
"Europe's Biggest Dance Show/Europe's Biggest Dance Show, 2025, Estonia, ERR Raadio 2.mp4","Estonia, ERR Raadio 2",ERR Raadio 2,"{'name': ""Europe's Biggest Dance Show 2025"", 'artist': 'Various Artists'}",Dance,2025
"Europe's Biggest Dance Show/Europe's Biggest Dance Show, 2025, Finland, YleX.mp4","Finland, YleX",YleX,"{'name': ""Europe's Biggest Dance Show 2025"", 'artist': 'Various Artists'}",Electronic,2025
"Europe's Biggest Dance Show/Europe's Biggest Dance Show, 2025, Germany, 1LIVE.mp4","Germany, 1LIVE",1LIVE,"{'name': ""Europe's Biggest Dance Show 2025"", 'artist': 'Various Artists'}",Electronic,2025
"Europe's Biggest Dance Show/Europe's Biggest Dance Show, 2025, Germany,_09Fritz.mp4","Germany, 09Fritz",09Fritz,"{'name': ""Europe's Biggest Dance Show 2025"", 'artist': 'Various Artists'}",Electronic,2025
"Europe's Biggest Dance Show/Europe's Biggest Dance Show, 2025, Ireland, RTÉ 2FM.mp4","Ireland, RTÉ 2FM",RTÉ 2FM,"{'name': ""Europe's Biggest Dance Show 2025"", 'artist': 'Various Artists'}",Electronic,2025
"Europe's Biggest Dance Show/Europe's Biggest Dance Show, 2025, Netherlands, NPO 3FM.mp4","Netherlands, NPO 3FM",NPO 3FM,"{'name': ""Europe's Biggest Dance Show 2025"", 'artist': 'Various Artists'}",Electronic,2025
"Europe's Biggest Dance Show/Europe's Biggest Dance Show, 2025, Norway, NRK P3.mp4","Norway, NRK P3",NRK P3,"{'name': ""Europe's Biggest Dance Show 2025"", 'artist': 'Various Artists'}",Electronic,2025
"Europe's Biggest Dance Show/Europe's Biggest Dance Show, 2025, Sweden, Sveriges Radio P3.mp4","Sweden, Sveriges Radio P3",Sveriges Radio P3,"{'name': ""Europe's Biggest Dance Show 2025"", 'artist': 'Various Artists'}",Dance,2025
"Europe's Biggest Dance Show/Europe's Biggest Dance Show, 2025, UK, BBC Radio 1.mp4","UK, BBC Radio 1",BBC Radio 1,"{'name': ""Europe's Biggest Dance Show"", 'artist': 'Various Artists'}",Dance,2025
"Europe's Biggest Dance Show/Europe's Biggest Dance Show, 2025, Ukraine, Radio Promin.mp4","Ukraine, Radio Promin",Radio Promin,"{'name': ""Europe's Biggest Dance Show 2025"", 'artist': 'Various Artists'}",Dance,2025
FISHER/AUCKLAND_NEW_ZEALAND_2025_FULL_LIVE_SET.mp3,Auckland 2025,FISHER,"{'name': 'FISHER Sets', 'artist': 'FISHER'}",House,2025
FISHER/FISHER_-_EDC_LAS_VEGAS_2024_FULL_LIVE_SET.mp3,FISHER,FISHER,"{'name': 'EDC Las Vegas 2024', 'artist': 'Various Artists'}",Tech House,2024
FISHER/Fisher - Live on Radio 1 Essential Mix (25.01.20).mp3,FISHER 2020,FISHER,"{'name': 'Essential Mix', 'artist': 'Various Artists'}",House,2020-01-25
"FISHER/Radio 1's Dance Weekend, Radio 1 Dance Ibiza, FISHER.mp4",FISHER,FISHER,"{'name': ""Radio 1's Dance Weekend"", 'artist': 'Various Artists'}",House,
Faithless/Faithless - Live @ Ibiza Rocks Hotel in Ibiza (02.08.15).mp3,Faithless,Faithless,"{'name': 'Ibiza Rocks 2015', 'artist': 'Various Artists'}",Electronic,2015-08-02
Adam Beyer/Adam Beyer live from Drumcode London at Drumsheds 2024 [xnieF7a0qKM].opus,Adam Beyer,Adam Beyer,"{'name': 'Drumsheds', 'artist': 'Various Artists'}",Techno,2024
Amelie Lens/Amelie Lens Tomorrowland 2025 ｜ MainStage Closing [q5Oz6Ja8iZs].opus,Amelie Lens,Amelie Lens,"{'name': 'Tomorrowland 2025', 'artist': 'Various Artists'}",Techno,2025
"Armin van Buuren/Armin van Buuren f2f HI-LO ｜ live at A State of Trance, London 2025 [JmClyiIE9ik].opus",Armin van Buuren f2f HI-LO,Armin van Buuren & HI-LO,"{'name': 'A State of Trance 2025', 'artist': 'Various Artists'}",Trance,2025
Bonobo/Bonobo & Anna Lapwood perform Otomo live at the Royal Albert Hall [AdyAF9M3XVw].opus,Otomo - Live,Bonobo,"{'name': 'Bonobo Sets', 'artist': 'Bonobo'}",Ambient,
Camelphat/CAMELPHAT at Giza Pyramids 2025 (Zamna) [h_aESLekNEQ].opus,CamelPhat - Giza Pyramids 2025,CamelPhat,"{'name': 'CamelPhat Sets', 'artist': 'CamelPhat'}",House,2025
Chris Lake/Chris Lake LIVE from Brooklyn Storehouse 2025 ｜ Chemistry Release Weekend [mHp7y-9oKOk].opus,Brooklyn Storehouse 2025,Chris Lake,"{'name': 'Chris Lake Sets', 'artist': 'Chris Lake'}",House,2025
Chris Stussy/Chris Stussy @ Coachella 2025 - YUMA Stage [k1ipFTg0sM8].opus,Chris Stussy,Chris Stussy,"{'name': 'Coachella 2025', 'artist': 'Various Artists'}",House,2025
Chris Stussy/Chris Stussy ｜ Boiler Room： Edinburgh [42XFNGZrpaQ].opus,Chris Stussy - Edinburgh,Chris Stussy,"{'name': 'Boiler Room', 'artist': 'Various Artists'}",House,
"Claptone/Claptone： Day Trip In The Park, LA (Full Set) [vDbvcuDn-2Y].opus","Day Trip In The Park, LA",Claptone,"{'name': 'Claptone Sets', 'artist': 'Claptone'}",House,
Cream Classical/Cream Classical in the Park LIVE @ Sefton Park [S8h3AQ7Rgxs].opus,Cream Classical in the Park - Sefton Park,Cream Classical,"{'name': 'Classical House', 'artist': 'Various Artists'}",House,
D.O.D./D.O.D Live @ Creamfields 2025 ｜ Full DJ Set [g3NGORYpcjI].opus,D.O.D,D.O.D,"{'name': 'Creamfields 2025', 'artist': 'Various Artists'}",House,2025
"D.O.D./D.O.D Live at LPR, New York City 2025 [2eQclohopJY].opus",Live at LPR New York City 2025,D.O.D,"{'name': 'D.O.D Sets', 'artist': 'D.O.D'}",House,2025
D.O.D./D.O.D Live in Brooklyn NYC ｜ Full DJ Set [bHGHzifLcrA].opus,Brooklyn NYC,D.O.D,"{'name': 'D.O.D Sets', 'artist': 'D.O.D'}",House,
DJs from Mars/DJS FROM MARS LIVE @ USHUAÏA IBIZA - F＊＊＊ ME I'M FAMOUS 23-06-2025 - FULL SET [L4VeFKUT42k].opus,F*** ME I'M FAMOUS - Ushuaïa Ibiza 2025,DJs from Mars,"{'name': 'DJs from Mars Sets', 'artist': 'DJs from Mars'}",House,2025-06-23
David Guetta/David Guetta Presents Galactic Circus Live From [UNVRS] Ibiza [lSk-DWAJPbA].opus,Galactic Circus - Ibiza,David Guetta,"{'name': 'David Guetta Sets', 'artist': 'David Guetta'}",House,2025
David Guetta & MORTEN/David Guetta & MORTEN ｜ Future Rave Live @ SOUNDSTORM 2024 [_aR_OwHJQwc].opus,David Guetta & MORTEN,David Guetta & MORTEN,"{'name': 'SOUNDSTORM 2024', 'artist': 'Various Artists'}",Electronic,2024
Dom Dolla/Dom Dolla - BBC Radio 1 Essential Mix [1rma3vBSstU].opus,Dom Dolla,Dom Dolla,"{'name': 'Essential Mix', 'artist': 'Various Artists'}",House,
"Dom Dolla/Dom Dolla Live @ Creamfields Steel Yard, 2025 [NblVVOwQRqw].opus",Dom Dolla,Dom Dolla,"{'name': 'Creamfields 2025', 'artist': 'Various Artists'}",House,2025
"Duke Dumont/Duke Dumont - DJ Set at Steelyard, Creamfields 2025 [EiTiJHgf0NA].opus",Duke Dumont,Duke Dumont,"{'name': 'Creamfields 2025', 'artist': 'Various Artists'}",House,2025
"Eric Prydz/Eric Prydz Pres. 20 Years of Pryda @ The Concourse Project - Austin, Texas (March 15, 2025) [GeWXb_NVjpg].opus","20 Years of Pryda, Concourse Project, Austin",Eric Prydz,"{'name': 'Eric Prydz Sets', 'artist': 'Eric Prydz'}",House,2025-03-15
Eric Prydz/Eric Prydz WE2 ｜ Tomorrowland 2025 [LIZCWL2zdPo].opus,Eric Prydz,Eric Prydz,"{'name': 'Tomorrowland 2025', 'artist': 'Various Artists'}",House,2025
FISHER/FISHER LIVE FROM CREAMFIELDS 2025 [MT7zB-SbUl4].opus,FISHER,FISHER,"{'name': 'Creamfields 2025', 'artist': 'Various Artists'}",House,2025
"FISHER/FISHER LIVE FROM GUNNERSBURY PARK, LONDON, UK !! [dhTLPOAdbjE].opus","Gunnersbury Park, London",FISHER,"{'name': 'FISHER Sets', 'artist': 'FISHER'}",House,
FISHER/FISHER LIVE FROM OLD ROYAL NAVY COLLEGE IN LONDON [6ko1L5ZfK1k].opus,"Old Royal Navy College, London",FISHER,"{'name': 'FISHER Sets', 'artist': 'FISHER'}",House,
FISHER/FISHER LIVE FROM TOMORROWLAND MAINSTAGE 2025 [vxNvRHhxBfo].opus,FISHER,FISHER,"{'name': 'Tomorrowland 2025', 'artist': 'Various Artists'}",House,2025
Faithless Soundsystem/Faithless Soundsystem - Live on Radio 1 Essential Mix (26.02.20).mp3,Faithless Soundsystem 2020,Faithless Soundsystem,"{'name': 'Essential Mix', 'artist': 'Various Artists'}",Electronic,2020-02-26
"Faithless Soundsystem/Radio 1's Classic Essential Mix, Faithless Soundsystem 2010.mp4",Faithless Soundsystem 2010,Faithless Soundsystem,"{'name': 'Essential Mix', 'artist': 'Various Artists'}",Electronic,2010
Fatboy Slim/Fatboy Slim - Live @ Coachella Festival 2008 in California (25.08.08).mp3,Fatboy Slim,Fatboy Slim,"{'name': 'Coachella 2008', 'artist': 'Various Artists'}",Electronic,2008
Fatboy Slim/Fatboy Slim - Live @ Coachella Music Festival 2014 in California (13.04.14).mp3,Fatboy Slim,Fatboy Slim,"{'name': 'Coachella 2014', 'artist': 'Various Artists'}",Electronic,2014-04-13
Fatima Yamaha/Fatima Yamaha - Live on Radio 1 Essential Mix (09.09.17).mp3,Fatima Yamaha 2017,Fatima Yamaha,"{'name': 'Essential Mix', 'artist': 'Various Artists'}",House,2017-09-09
Feed Me/Feed Me - Live on Radio Essential Mix (08.09.12).mp3,Feed Me 2012,Feed Me,"{'name': 'Essential Mix', 'artist': 'Various Artists'}",House,2012
Fideles/Fideles - Live on Radio 1 Essential Mix (17.06.22).mp3,Fideles 2022,Fideles,"{'name': 'Essential Mix', 'artist': 'Various Artists'}",Electronic,2022-06-17
Finnebassen/Finnebassen - Live on Radio 1 Essential Mix (16.08.14).mp3,Finnebassen 2014,Finnebassen,"{'name': 'Essential Mix', 'artist': 'Various Artists'}",House,2014-08-16
Floating Points/Floating Points - Live on Radio 1 Essential Mix (28.11.15).mp3,Floating Points 2015,Floating Points,"{'name': 'Essential Mix', 'artist': 'Various Artists'}",Electronic,2015-11-28
Floorplan/Floorplan - Live on Radio 1 Essential Mix (27.05.17).mp3,Floorplan 2017,Floorplan,"{'name': 'Essential Mix', 'artist': 'Various Artists'}",House,2017-05-27
Flosstradamus/Flosstradamus - Live @ Coachella Music Festival 2014 in California (13.04.14).mp3,Flosstradamus,Flosstradamus,"{'name': 'Coachella 2014', 'artist': 'Various Artists'}",Dubstep,2014-04-13
Flosstradamus/Flosstradamus - Live @ Coachella Music Festival 2015 in California (11.04.15).mp3,Flosstradamus,Flosstradamus,"{'name': 'Coachella 2015', 'artist': 'Various Artists'}",Electronic,2015-04-11
Flume/Flume - Live @ Coachella 2022 in California (19.04.22).mp3,Flume,Flume,"{'name': 'Coachella 2022', 'artist': 'Various Artists'}",Electronic,2022-04-19
Flume/Flume - Live @ Coachella Music Festival 2016 in California (24.04.16).mp3,Flume,Flume,"{'name': 'Coachella 2016', 'artist': 'Various Artists'}",Electronic,2016-04-24
Flume/Flume - Live on Radio Essential Mix (03.10.15).mp3,Flume 2015,Flume,"{'name': 'Essential Mix', 'artist': 'Various Artists'}",Electronic,2015
Flux Pavilion/Flux Pavilion - Live on Radio 1 Essential Mix (14.04.12).mp3,Flux Pavilion 2012,Flux Pavilion,"{'name': 'Essential Mix', 'artist': 'Various Artists'}",Electronic,2012-04-14
"Folamour/Radio 1's Classic Essential Mix, Folamour 2021.mp4",Folamour 2021,Folamour,"{'name': 'Essential Mix', 'artist': 'Various Artists'}",House,2021
Four Tet & Peggy Gou/Four Tet & Peggy Gou - Live Classic Essential Mix @ Glastonbury (25.06.22].mp3,Four Tet & Peggy Gou,Four Tet & Peggy Gou,"{'name': 'Glastonbury Festival 2022', 'artist': 'Various Artists'}",Electronic,2022-06-25
Four Tet X Jamie XX/Four Tet X Jamie XX - Live on Radio 1 Essential Mix (28.03.15).mp3,Four Tet X Jamie xx 2015,Four Tet & Jamie xx,"{'name': 'Essential Mix', 'artist': 'Various Artists'}",Electronic,2015-03-28
"Four Tet X Jamie XX/Radio 1's Classic Essential Mix, Four Tet X Jamie xx.mp4",Four Tet X Jamie xx,Four Tet & Jamie xx,"{'name': 'Essential Mix', 'artist': 'Various Artists'}",House,
Fout Tet/Fout Tet - Live @ Glastonbury in Somerset Replay (27.06.20).mp3,Four Tet,Four Tet,"{'name': 'Glastonbury 2020', 'artist': 'Various Artists'}",Electronic,2020-06-27
Frankey & Sandrino/Frankey & Sandrino - Live on Radio 1 Essential Mix (16.04.22).mp3,Frankey & Sandrino 2022,Frankey & Sandrino,"{'name': 'Essential Mix', 'artist': 'Various Artists'}",House,2022-04-16
Frankie Knuckles/Frankie Knuckles - Live on Radio 1 Essential Mix - Masters Series 2 (04.04.15).mp3,Frankie Knuckles 2015,Frankie Knuckles,"{'name': 'Essential Mix', 'artist': 'Various Artists'}",House,2015-04-04
Franky Rizardo/Franky Rizardo - Live on Radio 1 Essential Mix (02.09.17).mp3,Franky Rizardo 2017,Franky Rizardo,"{'name': 'Essential Mix', 'artist': 'Various Artists'}",House,2017
"Franky Wah/FRANKY WAH Progressive House DJ Set ｜ SAKÉ ACT22 @Palace of Culture, Varna [QH-y2T1Ek-k].opus",Progressive House Mix,Franky Wah,"{'name': 'Franky Wah Sets', 'artist': 'Franky Wah'}",Progressive House,
Franky Wah/Franky Wah - Live on Radio 1 Essential Mix (19.12.20).mp3,Franky Wah 2020,Franky Wah,"{'name': 'Essential Mix', 'artist': 'Various Artists'}",Electronic,2020-12-19
Fred Again/Fred Again - Live @ Coachella 2022 in California (19.04.22).mp3,Fred Again,Fred Again,"{'name': 'Coachella 2022', 'artist': 'Various Artists'}",Electronic,2022-04-19
Friction & Gerra & Stone/Friction & Gerra & Stone - Live @ Glastonbury 2015 in Somerset (07.07.15).mp3,Friction & Gerra & Stone,Friction & Gerra & Stone,"{'name': 'Glastonbury Festival 2015', 'artist': 'Various Artists'}",Drum & Bass,2015
"Friction, Andy C & Spor/Friction, Andy C & Spor - Live @ Glastonbury 2015 in Somerset (27.06.15).mp3","Friction, Andy C & Spor","Friction, Andy C & Spor","{'name': 'Glastonbury Festival 2015', 'artist': 'Various Artists'}",Drum & Bass,2015-06-27
Friend Within/Friend Within - Live on Radio 1 Essential Mix (11.01.14).mp3,Friend Within 2014,Friend Within,"{'name': 'Essential Mix', 'artist': 'Various Artists'}",House,2014-01-11
Fun Radio/Fun Radio Ibiza Experience 2025 ｜ L'intégrale de la soirée [7Fe0s-kwK1E].opus,Fun Radio Ibiza Experience 2025,Various Artists,"{'name': 'Fun Radio', 'artist': 'Various Artists'}",Electronic,2025
Fur Coat/Fur Coat - Live on Radio Essential Mix (22.08.15).mp3,Fur Coat 2015,Fur Coat,"{'name': 'Essential Mix', 'artist': 'Various Artists'}",House,2015-08-22
GTA/GTA - Live @ Coachella Music Festival 2014 in California (13.04.14).mp3,GTA,GTA,"{'name': 'Coachella 2014', 'artist': 'Various Artists'}",Electronic,2014-04-13
Gaiser/Gaiser - Live on Radio 1 Essential Mix (05.07.14).mp3,Gaiser 2014,Gaiser,"{'name': 'Essential Mix', 'artist': 'Various Artists'}",Techno,2014
Galantis/Galantis - Live @ Coachella Music Festival 2017 in California (14.04.17).mp3,Galantis,Galantis,"{'name': 'Coachella 2017', 'artist': 'Various Artists'}",Electronic,2017-04-14
Galantis/Galantis - Live @ Coachella Music Festival 2017 in California (16.04.17).mp3,Galantis,Galantis,"{'name': 'Coachella 2017', 'artist': 'Various Artists'}",Electronic,2017-04-16
Gaslamp Killer/Gaslamp Killer - Live on Radio 1 Essential Mix (01.12.12).mp3,Gaslamp Killer 2012,Gaslamp Killer,"{'name': 'Essential Mix', 'artist': 'Various Artists'}",Eclectic,2012
"Genix/Radio 1 Dance Presents..., Anjunabeats Genix.mp4","Genix, Anjunabeats",Genix,"{'name': 'Radio 1 Dance Presents...', 'artist': 'Various Artists'}",Trance,
"George Mensah B2B Sammy Porter/Radio 1 Dance Presents..., Ibiza George Mensah B2B Sammy Porter.mp4",George Mensah B2B Sammy Porter,George Mensah & Sammy Porter,"{'name': 'Radio 1 Dance Presents...', 'artist': 'Various Artists'}",Dance,
Gerd Janson/Gerd Janson - Live on Radio 1 Essential Mix (11.03.17).mp3,Gerd Janson 2017,Gerd Janson,"{'name': 'Essential Mix', 'artist': 'Various Artists'}",House,2017-03-11
Gilles Peterson/Gilles Peterson - Live on Radio 1 Essential Mix (14.06.14).mp3,Gilles Peterson 2014,Gilles Peterson,"{'name': 'Essential Mix', 'artist': 'Various Artists'}",Electronic,2014
"Girls Don't Sync/Radio 1's Essential Mix, Girls Don't Sync.mp4",Girls Don't Sync,Girls Don't Sync,"{'name': 'Essential Mix', 'artist': 'Various Artists'}",Electronic,
Goldlink/Goldlink - Live @ Coachella Music Festival 2017 in California (16.04.17).mp3,Goldlink,Goldlink,"{'name': 'Coachella 2017', 'artist': 'Various Artists'}",Hip-Hop,2017-04-16
Gorgon City/Gorgon City - Live at Above (Sydney) 2024 [t0TpNBaFW1g].opus,Live at Above (Sydney) 2024,Gorgon City,"{'name': 'Gorgon City Sets', 'artist': 'Gorgon City'}",House,2024
Gorgon City/Gorgon City - Live on Radio 1 Essential Mix (23.08.14).mp3,Gorgon City 2014,Gorgon City,"{'name': 'Essential Mix', 'artist': 'Various Artists'}",House,2014
Gorgon City/Gorgon City Live @ EDC Las Vegas 2025 [F2OqDwCr0-c].opus,Gorgon City,Gorgon City,"{'name': 'EDC Las Vegas 2025', 'artist': 'Various Artists'}",House,2025
Gorgon City/Gorgon City Live from Drumsheds London.mp4,Gorgon City,Gorgon City,"{'name': 'Drumsheds', 'artist': 'Various Artists'}",House,
Gorgon City/Gorgon City ｜ ANTS 2025 - Live at Ushuaïa Ibiza #Livestream [1-lfH_aZqjE].opus,Gorgon City,Gorgon City,"{'name': 'ANTS 2025 Ushuaia', 'artist': 'Various Artists'}",House,2025
Gorgon City/Gorgon_City_-_Live_from_Printworks_London_We_Dance_As_One_NYE.mp3,Printworks London NYE,Gorgon City,"{'name': 'Gorgon City Sets', 'artist': 'Gorgon City'}",House,2020
Gorgon City/Gorgon_City_DJ_set_live_at_Printworks_March_2022.mp3,Printworks 2022,Gorgon City,"{'name': 'Gorgon City Sets', 'artist': 'Gorgon City'}",House,2022
Gorgon City/Gorgon_City_Live_from_ARC_Festival_Chicago.mp3,Gorgon City,Gorgon City,"{'name': 'ARC Festival 2024', 'artist': 'Various Artists'}",House,2024
Gorgon City/Gorgon_City_Live_from_Shrine_LA_Outdoors_2024.mp3,Shrine LA Outdoors,Gorgon City,"{'name': 'Gorgon City Sets', 'artist': 'Gorgon City'}",House,2024
"Gorgon City/Radio 1's Essential Mix, Gorgon City.mp4",Gorgon City,Gorgon City,"{'name': 'Essential Mix', 'artist': 'Various Artists'}",House,
Gramatik/Gramatik - Live @ Coachella Music Festival 2015 in California (11.04.15).mp3,Gramatik,Gramatik,"{'name': 'Coachella 2015', 'artist': 'Various Artists'}",Electronic,2015-04-11
Green Velvet/Green Velvet - Live on Radio 1 Essential Mix (19.07.14).mp3,Green Velvet 2014,Green Velvet,"{'name': 'Essential Mix', 'artist': 'Various Artists'}",Techno,2014-07-19
"Green Velvet/Green Velvet @ Drumsheds, London [JSY0adr682k].opus",Green Velvet,Green Velvet,"{'name': 'Drumsheds', 'artist': 'Various Artists'}",House,
"Groove Armada/Groove Armada - Live @ Radio 1 Party, Ushuaia Hotel in Ibiza (31.07.15).mp3",Groove Armada,Groove Armada,"{'name': 'Ushuaia 2015', 'artist': 'Various Artists'}",House,2015-07-31
Groove Armada/Groove Armada - Live on Radio 1 Essential Mix (05.05.12).mp3,Groove Armada 2012,Groove Armada,"{'name': 'Essential Mix', 'artist': 'Various Artists'}",Electronic,2012
Grum/Grum - Live on Radio 1 Essential Mix (24.05.14).mp3,Grum 2014,Grum,"{'name': 'Essential Mix', 'artist': 'Various Artists'}",House,2014-05-24
Gryffin/Gryffin - Live @ Coachella Music Festival 2017 in California (15.04.17).mp3,Gryffin,Gryffin,"{'name': 'Coachella 2017', 'artist': 'Various Artists'}",House,2017-04-15
Guti/Guti - Live on Radio 1 Essential Mix (31.03.12).mp3,Guti 2012,Guti,"{'name': 'Essential Mix', 'artist': 'Various Artists'}",House,2012-03-31
Guy Gerber/Guy Gerber - Live @ Coachella 2019 in California (21.04.19).mp3,Guy Gerber,Guy Gerber,"{'name': 'Coachella 2019', 'artist': 'Various Artists'}",House,2019-04-21
"HAAI B2B I. JORDAN/Radio 1 Dance Presents..., Glastonbury HAAI B2B I. JORDAN.mp4",HAAi B2B I. JORDAN,HAAi & I. JORDAN,"{'name': 'Radio 1 Dance Presents...', 'artist': 'Various Artists'}",Dance,
HVOB/HVOB - Live on Radio 1 Essential Mix (26.03.22).mp3,HVOB 2022,HVOB,"{'name': 'Essential Mix', 'artist': 'Various Artists'}",Electronic,2022-03-26
Hannah Laing/Hannah Laing Live From DJ Mag HQ [YPgiC2oinrU].opus,DJ Mag HQ,Hannah Laing,"{'name': 'Hannah Laing Sets', 'artist': 'Hannah Laing'}",House,
Hannah Laing/Hannah_Laing_-_Full_Set_@_SWG3_Glasgow_Welcome_to_the_Doof.mp3,Welcome to the Doof - SWG3,Hannah Laing,"{'name': 'Hannah Laing Sets', 'artist': 'Hannah Laing'}",House,2023
Hannah Laing/Hannah_Laing_live_from_Creamfields_2024.mp3,Hannah Laing,Hannah Laing,"{'name': 'Creamfields 2024', 'artist': 'Various Artists'}",House,2024
Hannah Wants/Hannah Wants - Live on Radio 1 Essential Mix (20.11.20).mp3,Hannah Wants 2020,Hannah Wants,"{'name': 'Essential Mix', 'artist': 'Various Artists'}",House,2020-11-20
"Hannah Wants/Radio 1's Dance Weekend, Radio 1 Dance Ibiza, Hannah Wants.mp4",Hannah Wants,Hannah Wants,"{'name': ""Radio 1's Dance Weekend"", 'artist': 'Various Artists'}",House,
Hans Zimmer/Hans Zimmer - Live @ Coachella Music Festival 2017 in California (16.04.17).mp3,Hans Zimmer,Hans Zimmer,"{'name': 'Coachella 2017', 'artist': 'Various Artists'}",Electronic,2017-04-16
Hardwell/Hardwell - Live on Radio 1 Essential Mix (24.11.12).mp3,Hardwell 2012,Hardwell,"{'name': 'Essential Mix', 'artist': 'Various Artists'}",Electronic,2012-11-24
Haywyre/Haywyre - Live @ Coachella Music Festival 2017 in California (14.04.17).mp3,Haywyre,Haywyre,"{'name': 'Coachella 2017', 'artist': 'Various Artists'}",Electronic,2017-04-14
Hector Oaks/Hector Oaks - Live on Radio 1 Essential Mix (16.07.22).mp3,Héctor Oaks 2022,Héctor Oaks,"{'name': 'Essential Mix', 'artist': 'Various Artists'}",Techno,2022-07-16
Heidi/Heidi - Live on Radio 1 Essential Mix (20.09.14).mp3,Heidi 2014,Heidi,"{'name': 'Essential Mix', 'artist': 'Various Artists'}",Electronic,2014-09-20
Helena Hauff/Helena Hauff - Live on Radio 1 Essential Mix (25.02.17).mp3,Helena Hauff 2017,Helena Hauff,"{'name': 'Essential Mix', 'artist': 'Various Artists'}",Techno,2017-02-25
Henry Saiz/Henry Saiz - Live on Radio 1 Essential Mix (30.09.17).mp3,Henry Saiz 2017,Henry Saiz,"{'name': 'Essential Mix', 'artist': 'Various Artists'}",House,2017-09-30
"Heritage Orchestra/Ibiza Classics live @ The O2 Arena London (Pete tong, Heritage Orchestra, Wiley, Becky Hill, AU⧸RA) [OKz9LRNgKjs].opus",Ibiza Classics - O2 Arena London,Heritage Orchestra,"{'name': 'Classical House', 'artist': 'Various Artists'}",Electronic,
High Constrast/High Constrast - Live @ Creamfields 2017 in Liverpool (05.08.17).mp3,High Contrast,High Contrast,"{'name': 'Creamfields 2017', 'artist': 'Various Artists'}",Drum & Bass,2017
Honey Dijon/Honey Dijon - Live @ Coachella Music Festival 2017 in California (15.04.17).mp3,Honey Dijon,Honey Dijon,"{'name': 'Coachella 2017', 'artist': 'Various Artists'}",House,2017-04-15
"Honey Dijon/Radio 1's Classic Essential Mix, Honey Dijon 2017.mp4",Honey Dijon 2017,Honey Dijon,"{'name': 'Essential Mix', 'artist': 'Various Artists'}",House,2017
"HoneyLuv/Radio 1's Dance Weekend, Dance Anthems Ibiza, Danny Howard and HoneyLuv.mp4",Danny Howard and HoneyLuv,Danny Howard & HoneyLuv,"{'name': ""Radio 1's Dance Weekend"", 'artist': 'Various Artists'}",Dance,
Honne/Honne - Live @ Coachella Music Festival 2017 in California (16.04.17).mp3,Honne,Honne,"{'name': 'Coachella 2017', 'artist': 'Various Artists'}",Electronic,2017-04-16
Horse Meat Disco/Horse Meat Disco - Live on Radio 1 Essential Mix (23.12.17).mp3,Horse Meat Disco 2017,Horse Meat Disco,"{'name': 'Essential Mix', 'artist': 'Various Artists'}",House,2017
"Hot Chip/Radio 1's Classic Essential Mix, Hot Chip 2012.mp4",Hot Chip 2012,Hot Chip,"{'name': 'Essential Mix', 'artist': 'Various Artists'}",Electronic,2012
Hot Natured/Hot Natured - Live on Radio Essential Mix (26.04.14).mp3,Hot Natured 2014,Hot Natured,"{'name': 'Essential Mix', 'artist': 'Various Artists'}",House,2014-04-26
"Hot Since 82/Hot Since 82 - Live @ Enter, Space in Ibiza (31.07.15).mp3","Enter, Space Ibiza",Hot Since 82,"{'name': 'Hot Since 82 Sets', 'artist': 'Hot Since 82'}",House,2015-07-31
Hunee/Hunee - Live on Radio 1 Essential Mix (29.04.17).mp3,Hunee 2017,Hunee,"{'name': 'Essential Mix', 'artist': 'Various Artists'}",House,2017-04-29
Huxley/Huxley - Live on Radio 1 Essential Mix (15.11.14).mp3,Huxley 2014,Huxley,"{'name': 'Essential Mix', 'artist': 'Various Artists'}",House,2014-11-15
"Hybrid Minds/Radio 1's Classic Essential Mix, Hybrid Minds 2020.mp4",Hybrid Minds 2020,Hybrid Minds,"{'name': 'Essential Mix', 'artist': 'Various Artists'}",Drum and Bass,2020
I Hate Models/I Hate Models - Live on Radio 1 Essential Mix (14.05.22).mp3,I Hate Models 2022,I Hate Models,"{'name': 'Essential Mix', 'artist': 'Various Artists'}",Electronic,2022-05-14
"I. JORDAN/Radio 1's Essential Mix, I. JORDAN.mp4",I. JORDAN,I. JORDAN,"{'name': 'Essential Mix', 'artist': 'Various Artists'}",Electronic,
Idris Elba/Idris Elba - Live @ Coachella 2019 in California (20.04.19).mp3,Idris Elba,Idris Elba,"{'name': 'Coachella 2019', 'artist': 'Various Artists'}",Electronic,2019-04-20
Infected Mushroom/Infected Mushroom - Live @ Coachella Music Festival 2013 in California (13.04.13).mp3,Infected Mushroom,Infected Mushroom,"{'name': 'Coachella 2013', 'artist': 'Various Artists'}",Psytrance,2013-04-13
Innellea/Innellea - Live on Radio 1 Essential Mix (07.01.22).mp3,Innellea 2022,Innellea,"{'name': 'Essential Mix', 'artist': 'Various Artists'}",Techno,2022-01-07
Jack Garratt/Jack Garratt - Live @ Coachella Music Festival 2017 in California (16.04.17).mp3,Jack Garratt,Jack Garratt,"{'name': 'Coachella 2017', 'artist': 'Various Artists'}",Pop,2017-04-16
Jack U/Jack U - Live @ Coachella Music Festival 2016 in California (22.04.16).mp3,Jack U,Jack U,"{'name': 'Coachella 2016', 'artist': 'Various Artists'}",Electronic,2016-04-22
Jackbeats/Jackbeats - Live @ Sonar Festival 2012 in Barcelona (16.06.12).mp3,Jackbeats,Jackbeats,"{'name': 'Sonar Festival 2012', 'artist': 'Various Artists'}",Electronic,2012-06-16
Jackmaster/Jackmaster - Live @ Glastonbury 2017 in Sommerset (23.06.17).mp3,Jackmaster,Jackmaster,"{'name': 'Glastonbury 2017', 'artist': 'Various Artists'}",House,2017-06-23
Jackmaster/Jackmaster - Live on Radio 1 Essential Mix (17.05.14).mp3,Jackmaster 2014,Jackmaster,"{'name': 'Essential Mix', 'artist': 'Various Artists'}",Electronic,2014-05-17
Jackmaster b2b Oneman/Jackmaster b2b Oneman - Live @ Glastonbury 2014 in Somerset (28.06.14).mp3,Jackmaster b2b Oneman,Jackmaster & Oneman,"{'name': 'Glastonbury 2014', 'artist': 'Various Artists'}",Electronic,2014-06-28
Jacques Lu Cont/Jacques Lu Cont - Live on Radio 1 Essential Mix (14.07.12).mp3,Jacques Lu Cont 2012,Jacques Lu Cont,"{'name': 'Essential Mix', 'artist': 'Various Artists'}",Electronic,2012-07-14
"Jaguar/Radio 1's Dance Weekend, Introducing Dance with Jaguar Sleepy SZN Special.mp4",Jaguar,Jaguar,"{'name': ""Radio 1's Dance Weekend"", 'artist': 'Various Artists'}",Dance,
Jagwar Ma/Jagwar Ma - Live @ Coachella Music Festival 2017 in California (14.04.17).mp3,Jagwar Ma,Jagwar Ma,"{'name': 'Coachella 2017', 'artist': 'Various Artists'}",Electronic,2017-04-14
Jakwob/Jakwob - Live on Radio 1 Essential Mix (03.05.14).mp3,Jakwob 2014,Jakwob,"{'name': 'Essential Mix', 'artist': 'Various Artists'}",Electronic,2014
James Hype/JAMES HYPE • IBIZA CLASSICS SET FROM A GYM [rVLLcBxuPB4].opus,Ibiza Classics from a gym,James Hype,"{'name': 'James Hype Sets', 'artist': 'James Hype'}",House,2025
James Hype/James Hype - California Sunrise - 5 deck mix [XM-Wk4jhzGo].opus,California Sunrise,James Hype,"{'name': 'James Hype Sets', 'artist': 'James Hype'}",House,
James Hype/James Hype - Ibiza sunset - 5 deck mix [djSVcKjn-0k].opus,Ibiza Sunset,James Hype,"{'name': 'James Hype Sets', 'artist': 'James Hype'}",House,
James Hype/James Hype Energetic Multi Genre DJ Set Live From DJ Mag HQ [PZhVh09AjKk].opus,Energetic Multi Genre DJ Set - DJ Mag HQ,James Hype,"{'name': 'James Hype Sets', 'artist': 'James Hype'}",House,
James Hype/James Hype Live Stream w⧸ Tita Lau - 2025 Feb 14th [6stLpZrt8EU].opus,James Hype w/ Tita Lau - Live Steam,James Hype & Tita Lau,"{'name': 'James Hype Sets', 'artist': 'James Hype'}",House,2025-02-14
James Hype/James Hype Live from Hï Ibiza • Our House 2024 [OJnvJ9L-nLg].opus,Our House - Hi Ibiza,James Hype,"{'name': 'James Hype Sets', 'artist': 'James Hype'}",House,2024
James Hype/James Hype Mix ｜ KISS [x5fkTUg90rE].opus,James Hype KISS Mix,James Hype,"{'name': 'James Hype Sets', 'artist': 'James Hype'}",House,
"James Hype/James Hype New York City, Brooklyn Rooftop Set [tlmE_aFiqEw].opus","New York City, Brooklyn Rooftop",James Hype,"{'name': 'James Hype Sets', 'artist': 'James Hype'}",House,
James Hype/James Hype WE1 ｜ Tomorrowland 2025 [emQhYGUWl_s].opus,James Hype,James Hype,"{'name': 'Tomorrowland 2025', 'artist': 'Various Artists'}",House,2025
James Hype/James Hype at The Concourse Project ｜ Full Set (6 Jun 2025) [yNwlb06myu8].opus,Concourse Project 2025,James Hype,"{'name': 'James Hype Sets', 'artist': 'James Hype'}",House,2025-06-06
"James Hype/James Hype live @ Drumsheds, London.mp4",James Hype,James Hype,"{'name': 'Drumsheds', 'artist': 'Various Artists'}",House,
"James Hype/James Hype live @ EDC Las Vegas 2025, Kinetic Field [CAWf5dTiFKI].opus",James Hype,James Hype,"{'name': 'EDC Las Vegas 2025', 'artist': 'Various Artists'}",House,2025
"James Hype/James Hype live @ Space, Miami 2025 [z8xRMmsNZrA].opus",Space Miami 2025,James Hype,"{'name': 'James Hype Sets', 'artist': 'James Hype'}",House,2025
"James Hype/James Hype live @ UNVRS Elrow, Ibiza 2025 [tShcFObsQD4].opus",UNVRS Elrow Ibiza 2025,James Hype,"{'name': 'James Hype Sets', 'artist': 'James Hype'}",House,2025
"James Hype/James Hype, SYNC @ HÏ Ibiza - Full set [XUwCeFgFKQc].opus",SYNC HI Ibiza,James Hype,"{'name': 'James Hype Sets', 'artist': 'James Hype'}",House,
James Hype/James_Hype_-_Get_Closer_UK.mp3,Get Closer,James Hype,"{'name': 'James Hype Sets', 'artist': 'James Hype'}",House,2024
James Hype/James_Hype_Live_from_Hi_Ibiza_Our_House_2024.mp3,"Our House, Hi Ibiza",James Hype,"{'name': 'James Hype Sets', 'artist': 'James Hype'}",House,2024
James Hype/James_Hype_live_@_Space_Miami_2025.mp3,Space Miami 2025,James Hype,"{'name': 'James Hype Sets', 'artist': 'James Hype'}",House,2025
"James Hype/Radio 1's Essential Mix, James Hype.mp4",James Hype,James Hype,"{'name': 'Essential Mix', 'artist': 'Various Artists'}",House,
James Hype B2B MEDUZA/James_Hype_B2B_Meduza_live_at_OUR_HOUSE_Amsterdam_2023.mp3,"Our House, Amsterdam, James Hype B2B Meduza",James Hype & MEDUZA,"{'name': 'James Hype & MEDUZA Sets', 'artist': 'James Hype & MEDUZA'}",House,2023
Jamie Jones/Jamie Jones - Live on Radio 1 Essential Mix (28.03.20).mp3,Jamie Jones 2020,Jamie Jones,"{'name': 'Essential Mix', 'artist': 'Various Artists'}",House,2020-03-28
"Jamie Jones & Patrick Topping/Jamie Jones & Patrick Topping - Live @ Radio 1 Party, Ushuaia Hotel in Ibiza (31.07.15).mp3",Jamie Jones & Patrick Topping,Jamie Jones & Patrick Topping,"{'name': 'Ushuaia 2015', 'artist': 'Various Artists'}",House,2015-07-31
Jamie XX/Jamie xx - Live @ Coachella 2022 in California (19.04.22).mp3,Jamie xx,Jamie xx,"{'name': 'Coachella 2022', 'artist': 'Various Artists'}",House,2022-04-19
Jamie xx/Jamie xx - Live @ Coachella 2022 in California (19.04.22).mp3,Jamie xx,Jamie xx,"{'name': 'Coachella 2022', 'artist': 'Various Artists'}",House,2022-04-19
"Jax Jones/Radio 1's Dance Weekend, Dance Anthems Ibiza, Jax Jones.mp4",Jax Jones,Jax Jones,"{'name': ""Radio 1's Dance Weekend"", 'artist': 'Various Artists'}",House,
Jennifer Cardini/Jennifer Cardini - Live on Radio 1 Essential Mix (26.02.22).mp3,Jennifer Cardini 2022,Jennifer Cardini,"{'name': 'Essential Mix', 'artist': 'Various Artists'}",Electronic,2022-02-26
Jessy Lanza/Jessy Lanza - Live on Radio 1 Essential Mix (26.09.20).mp3,Jessy Lanza 2020,Jessy Lanza,"{'name': 'Essential Mix', 'artist': 'Various Artists'}",Electronic,2020-09-26
Jimi Jules/Jimi Jules - Live on Radio 1 Essential Mix (30.04.22).mp3,Jimi Jules 2022,Jimi Jules,"{'name': 'Essential Mix', 'artist': 'Various Artists'}",Electronic,2022-04-30
Jimmy Edgar/Jimmy Edgar - Live on Radio 1 Essential Mix (10.05.14).mp3,Jimmy Edgar 2014,Jimmy Edgar,"{'name': 'Essential Mix', 'artist': 'Various Artists'}",Electronic,2014
Job Jobse/Job Jobse - Live on Radio 1 Essential Mix (02.04.22).mp3,Job Jobse 2022,Job Jobse,"{'name': 'Essential Mix', 'artist': 'Various Artists'}",House,2022-04-02
Joe Goddard/Joe Goddard - Live on Radio 1 Essential Mix (18.03.17).mp3,Joe Goddard 2017,Joe Goddard,"{'name': 'Essential Mix', 'artist': 'Various Artists'}",House,2017-03-18
Joel Corry/JOEL CORRY LIVE @ ULTRA EUROPE 2025 [7zLnwkoeF7A].opus,Joel Corry,Joel Corry,"{'name': 'Ultra Europe 2025', 'artist': 'Various Artists'}",House,2025
John Digweed/John Digweed - Live @ EDC 2017 in Las Vegas (17.06.17).mp3,John Digweed,John Digweed,"{'name': 'EDC Las Vegas 2017', 'artist': 'Various Artists'}",House,2017
John Summit/John Summit - Live @ Coachella 2022 in California (19.04.22).mp3,John Summit,John Summit,"{'name': 'Coachella 2022', 'artist': 'Various Artists'}",House,2022-04-19
John Summit/John Summit Live @ Tomorrowland Freedom Stage 2025 [7bBd8A27jhY].opus,John Summit,John Summit,"{'name': 'Tomorrowland 2025', 'artist': 'Various Artists'}",House,2025
Jon Hopkins/Jon Hopkins - Live on Radio 1 Essential Mix (22.11.14).mp3,Jon Hopkins 2014,Jon Hopkins,"{'name': 'Essential Mix', 'artist': 'Various Artists'}",Electronic,2014-11-22
Jonas Rathsman/Jonas Rathsman - Live on Radio Essential Mix (13.06.15).mp3,Jonas Rathsman 2015,Jonas Rathsman,"{'name': 'Essential Mix', 'artist': 'Various Artists'}",House,2015-06-13
Jordan Suckley/Jordan Suckley - Live on Essential Mix (22.02.14).mp3,Jordan Suckley 2014,Jordan Suckley,"{'name': 'Essential Mix', 'artist': 'Various Artists'}",Trance,2014-02-22
Joris Voorn/@jorisvoorndj  ｜ ANTS 2025 - Live at Ushuaïa Ibiza #Livestream [-GtfFNs52B8].opus,Joris Voorn,Joris Voorn,"{'name': 'ANTS 2025 Ushuaia', 'artist': 'Various Artists'}",Tech House,2025
Joris Voorn/Joris Voorn - Live @ Miami WMC 2017 in Miani (25.03.17).mp3,Joris Voorn,Joris Voorn,"{'name': 'Miami WMC 2017', 'artist': 'Various Artists'}",House,2017-03-25
Joris Voorn/Joris Voorn - Live on Radio 1 Essential Mix (31.01.15).mp3,Joris Voorn 2015,Joris Voorn,"{'name': 'Essential Mix', 'artist': 'Various Artists'}",Techno,2015-01-31
"Joris Voorn/Radio 1's Essential Mix, Joris Voorn.mp4",Joris Voorn,Joris Voorn,"{'name': 'Essential Mix', 'artist': 'Various Artists'}",Techno,
Jose Padilla/Jose Padilla - Live @ Radio 1 Essential Mix Ibiza 20 Special Part 10 (01.08.15).mp3,Jose Padilla 2015,Jose Padilla,"{'name': 'Essential Mix', 'artist': 'Various Artists'}",Electronic,2015-08-01
Jose Padilla/Jose Padilla - Live on Radio 1 Essential Mix (15.08.15).mp3,Jose Padilla 2015,Jose Padilla,"{'name': 'Essential Mix', 'artist': 'Various Artists'}",Electronic,2015-08-15
Joseph Capriati/Joseph Capriati - Live on Radio 1 Essential Mix (03.06.17).mp3,Joseph Capriati 2017,Joseph Capriati,"{'name': 'Essential Mix', 'artist': 'Various Artists'}",Techno,2017
Judge Jules/Judge Jules - Live @ Essential Mix in Hull (28.01.12).mp3,Judge Jules 2012,Judge Jules,"{'name': 'Essential Mix', 'artist': 'Various Artists'}",Trance,2012
Julio Bashmore/Julio Bashmore - Live on Radio 1 Essential Mix (02.05.15).mp3,Julio Bashmore 2015,Julio Bashmore,"{'name': 'Essential Mix', 'artist': 'Various Artists'}",House,2015-05-02
Justice/Justice - Live @ Coachella Festival 2012 in California (14.04.12).mp3,Justice,Justice,"{'name': 'Coachella 2012', 'artist': 'Various Artists'}",Electronic,2012-04-14
Justice/Justice - Live @ Coachella Music Festival 2017 in California (14.04.17).mp3,Justice,Justice,"{'name': 'Coachella 2017', 'artist': 'Various Artists'}",Electronic,2017-04-14
Justice/Justice - Live @ Coachella Music Festival 2017 in California (16.04.17).mp3,Justice,Justice,"{'name': 'Coachella 2017', 'artist': 'Various Artists'}",Electronic,2017-04-16
"KETTAMA/BBC Radio 1's Big Weekend, Live Sets_ Liverpool 2025, KETTAMA.mp4",KETTAMA,KETTAMA,"{'name': ""BBC Radio 1's Big Weekend 2025"", 'artist': 'Various Artists'}",Electronic,2025
"KETTAMA/Radio 1's Classic Essential Mix, KETTAMA 2022.mp4",KETTAMA 2022,KETTAMA,"{'name': 'Essential Mix', 'artist': 'Various Artists'}",Electronic,2022
"KETTAMA/The Residency on Radio 1 Dance, KETTAMA - Dreamscape with Sølv.mp4",KETTAMA,KETTAMA,"{'name': 'Radio 1 Dance Presents...', 'artist': 'Various Artists'}",House,
"KETTAMA/The Residency on Radio 1 Dance, KETTAMA - Left field with Soul Wun.mp4",Left field with Soul Wun,KETTAMA,"{'name': 'Radio 1 Residency, KETTAMA', 'artist': 'KETTAMA'}",House,
"KETTAMA/The Residency on Radio 1 Dance, KETTAMA - The groove with Robbie Doherty.mp4",The groove with Robbie Doherty,KETTAMA,"{'name': 'Radio 1 Residency, KETTAMA', 'artist': 'KETTAMA'}",House,
KH/KH - Live on Radio 1 Essential Mix (09.07.22).mp3,KH 2022,KH,"{'name': 'Essential Mix', 'artist': 'Various Artists'}",Electronic,2022-07-09
"KREAM/KREAM Presents - LIQUID ： LAB Vol. 12 (Adriatique, Prospa, WhoMadeWho) at Vemork [LUeHFSkbLlo].opus","LIQUID LAB Vol. 12 (Adriatique, Prospa, WhoMadeWho)","Adriatique, Prospa & WhoMadeWho","{'name': 'KREAM', 'artist': 'Various Artists'}",House,
KREAM/KREAM Presents LIQUID ： LAB London [Drumsheds]  (Artbat⧸Cristoph⧸Anyma) [mTEofWmQCYU].opus,"KREAM LIQUID : LAB London [Drumsheds]  (Artbat, Cristoph, Anyma)","Artbat, Cristoph & Anyma","{'name': 'KREAM', 'artist': 'Various Artists'}",Electronic,
"KREAM/KREAM at Printworks London (Camelphat, Gorgon City, ARTBAT) [zcldlAlF-jw].opus","KREAM - Printworks London (CamelPhat, Gorgon City, ARTBAT)","CamelPhat, Gorgon City & ARTBAT","{'name': 'KREAM', 'artist': 'Various Artists'}",House,
Kahn & Neek/Kahn & Neek - Live on Radio 1 Essential Mix (08.04.17).mp3,Kahn & Neek 2017,Kahn & Neek,"{'name': 'Essential Mix', 'artist': 'Various Artists'}",Electronic,2017-04-08
Kampire/Kampire - Live on Radio 1 Essential Mix (05.02.22).mp3,Kampire 2022,Kampire,"{'name': 'Essential Mix', 'artist': 'Various Artists'}",Electronic,2022
Karlsson & Winnberg/Karlsson & Winnberg - Live on Radio 1 Essential Mix (15.09.12).mp3,Karlsson & Winnberg 2012,Karlsson & Winnberg,"{'name': 'Essential Mix', 'artist': 'Various Artists'}",Electronic,2012-09-15
Kaskade/Kaskade - Live @ Coachella Festival 2012 in California (14.04.12).mp3,Kaskade,Kaskade,"{'name': 'Coachella 2012', 'artist': 'Various Artists'}",House,2012-04-14
Kaskade/Kaskade - Live @ Coachella Music Festival 2015 in California (12.04.15).mp3,Kaskade,Kaskade,"{'name': 'Coachella 2015', 'artist': 'Various Artists'}",House,2015-04-12
"Katy B/BBC Radio 1's Big Weekend, Live Sets_ Liverpool 2025, Katy B.mp4",Katy B,Katy B,"{'name': ""BBC Radio 1's Big Weekend 2025"", 'artist': 'Various Artists'}",Electronic,2025
"Katy B/Radio 1's Dance Weekend, Dance Anthems Ibiza, Katy B.mp4",Katy B,Katy B,"{'name': ""Radio 1's Dance Weekend"", 'artist': 'Various Artists'}",Dance,
Kaytranada/Kaytranada - Live @ Coachella Music Festival 2017 in California (16.04.17).mp3,Kaytranada,Kaytranada,"{'name': 'Coachella 2017', 'artist': 'Various Artists'}",Electronic,2017-04-16
Keinemusik/Keinemusik - Live on Radio 1 Essential Mix (19.09.20).mp3,Keinemusik 2020,Keinemusik,"{'name': 'Essential Mix', 'artist': 'Various Artists'}",House,2020-09-19
Kevin Saunderson/Kevin Saunderson - Live on Radio 1 Essential Mix (12.09.20).mp3,Kevin Saunderson 2020,Kevin Saunderson,"{'name': 'Essential Mix', 'artist': 'Various Artists'}",Techno,2020-09-12
Keys n Crates/Keys n Crates - Live @ Coachella Music Festival 2015 in California (10.04.15).mp3,Keys N Krates,Keys N Krates,"{'name': 'Coachella 2015', 'artist': 'Various Artists'}",Electronic,2015-04-10
Kiiara/Kiiara - Live @ Coachella Music Festival 2017 in California (16.04.17).mp3,Kiiara,Kiiara,"{'name': 'Coachella 2017', 'artist': 'Various Artists'}",Pop,2017-04-16
Kings of The Rollers/Kings of The Rollers - Live on Radio 1 Essential Mix (27.08.22).mp3,Kings of The Rollers 2022,Kings of The Rollers,"{'name': 'Essential Mix', 'artist': 'Various Artists'}",Electronic,2022-08-27
Kiss Dance/KISSDANCE-20250322-2100.mp4,TCTS & Gorgon City 2025,TCTS & Gorgon City,"{'name': 'Gorgon City Sets', 'artist': 'Gorgon City'}",House,2025-03-22
Knife Party/Knife Party - Live @ Coachella Music Festival 2013 in California (13.04.13).mp3,Knife Party,Knife Party,"{'name': 'Coachella 2013', 'artist': 'Various Artists'}",Electronic,2013-04-13
Kolsch/Kolsch - Live @ Coachella 2019 in California (19.04.19).mp3,Kölsch,Kölsch,"{'name': 'Coachella 2019', 'artist': 'Various Artists'}",Techno,2019
Kolsch/Kolsch - Live @ Ibiza Rocks Hotel in Ibiza (02.08.15).mp3,Kölsch,Kölsch,"{'name': 'Ibiza Rocks 2015', 'artist': 'Various Artists'}",House,2015-08-02
Kolsch/Kolsch - Live on Radio 1 Essential Mix (04.01.14).mp3,Kölsch 2014,Kölsch,"{'name': 'Essential Mix', 'artist': 'Various Artists'}",Techno,2014
Kolsch/Kölsch live from Drumcode London at Drumsheds 2024 [CPL9qQLBER0].opus,"Kölsch, Drumcode",Kölsch,"{'name': 'Drumsheds', 'artist': 'Various Artists'}",Techno,2024
Kryder/Kryder - Live on Radio 1 Essential Mix (21.03.15).mp3,Kryder 2015,Kryder,"{'name': 'Essential Mix', 'artist': 'Various Artists'}",House,2015-03-21
Kshmr/Kshmr - Live @ Coachella Music Festival 2016 in California (24.04.16).mp3,Kshmr,Kshmr,"{'name': 'Coachella 2016', 'artist': 'Various Artists'}",House,2016-04-24
Kungs/Kungs - Live @ Coachella Music Festival 2017 in California (14.04.17).mp3,Kungs,Kungs,"{'name': 'Coachella 2017', 'artist': 'Various Artists'}",House,2017-04-14
Kutski/Kutski - Live on Radio 1 Essential Mix (01.11.14).mp3,Kutski 2014,Kutski,"{'name': 'Essential Mix', 'artist': 'Various Artists'}",Electronic,2014-11-01
L-Vis 1990/L-Vis 1990 - Live on Radio 1 Essential Mix (07.01.12).mp3,L-Vis 1990 2012,L-Vis 1990,"{'name': 'Essential Mix', 'artist': 'Various Artists'}",Electronic,2012-01-07
LP Giobbi/LP Giobbi - Live on Radio 1 Essential Mix (16.09.22).mp3,LP Giobbi 2022,LP Giobbi,"{'name': 'Essential Mix', 'artist': 'Various Artists'}",Electronic,2022-09-16
"LP Giobbi/Radio 1's Dance Weekend, Dance Anthems Ibiza, LP Giobbi.mp4",LP Giobbi,LP Giobbi,"{'name': ""Radio 1's Dance Weekend"", 'artist': 'Various Artists'}",House,
LP Giobbi & Ben Hemsley/LP Giobbi & Ben Hemsley - Live @ Radio 1 Big Weekend in Coventry (18.06.22).mp3,LP Giobbi & Ben Hemsley,LP Giobbi & Ben Hemsley,"{'name': 'Radio 1 Big Weekend 2022', 'artist': 'Various Artists'}",House,2022-06-18
LXPFEQ~V/Luke Solomon  - Live on Radio 1 Essential Mix (17.01.15).mp3,Luke Solomon 2015,Luke Solomon,"{'name': 'Essential Mix', 'artist': 'Various Artists'}",Electronic,2015-01-17
La Roux/La Roux - Live @ Coachella Music Festival 2013 in California (13.04.13).mp3,La Roux,La Roux,"{'name': 'Coachella 2013', 'artist': 'Various Artists'}",Pop,2013-04-13
Laurent Garnier/Laurent Garnier - Live on Radio 1 Essential Mix (05.04.14).mp3,Laurent Garnier 2014,Laurent Garnier,"{'name': 'Essential Mix', 'artist': 'Various Artists'}",Techno,2014-04-05
Laurent Garnier & Erick Morillo/Laurent Garnier & Erick Morillo - Live @ Radio 1 Essential Mix Ibiza 20 Special Part 8 (29.07.15).mp3,Laurent Garnier & Erick Morillo 2015,Laurent Garnier & Erick Morillo,"{'name': 'Essential Mix', 'artist': 'Various Artists'}",Electronic,2015-07-29
"Layla Benitez/Radio 1's Essential Mix, Layla Benitez.mp4",Layla Benitez,Layla Benitez,"{'name': 'Essential Mix', 'artist': 'Various Artists'}",Electronic,
Lee Burridge/Lee Burridge - Live on Radio 1 Essential Mix (05.09.15).mp3,Lee Burridge 2015,Lee Burridge,"{'name': 'Essential Mix', 'artist': 'Various Artists'}",House,2015-09-05
Lee Foss/Lee Foss - Live @ EDC 2017 in Las Vegas (17.06.17).mp3,Lee Foss,Lee Foss,"{'name': 'EDC Las Vegas 2017', 'artist': 'Various Artists'}",House,2017-06-17
Lee Foss/Lee Foss - Live on Radio 1 Essential Mix (10.11.12).mp3,Lee Foss 2012,Lee Foss,"{'name': 'Essential Mix', 'artist': 'Various Artists'}",House,2012
Lil Silva/Lil Silva - Live on Radio 1 Essential Mix (04.06.22).mp3,Lil Silva 2022,Lil Silva,"{'name': 'Essential Mix', 'artist': 'Various Artists'}",Electronic,2022-06-04
Lilly Palmer/Lilly Palmer - Live on Radio 1 Essential Mix (28.05.22).mp3,Lilly Palmer 2022,Lilly Palmer,"{'name': 'Essential Mix', 'artist': 'Various Artists'}",Electronic,2022-05-28
"Lilly Palmer/Radio 1 Dance Presents..., Armada Music_ Lilly Palmer.mp4",Lilly Palmer,Lilly Palmer,"{'name': 'Radio 1 Dance Presents...', 'artist': 'Various Artists'}",Dance,
Liquid Soul/Liquid Soul - Live on Radio 1 Essential Mix (20.09.14).mp3,Liquid Soul 2014,Liquid Soul,"{'name': 'Essential Mix', 'artist': 'Various Artists'}",Psytrance,2014-09-20
Little Drago/Little Drago - Live @ Coachella Music Festival 2017 in California (14.04.17).mp3,Little Drago,Little Drago,"{'name': 'Coachella 2017', 'artist': 'Various Artists'}",Electronic,2017-04-14
Loco Dice/Loco Dice - Live @ Coachella Music Festival 2013 in California (13.04.13).mp3,Loco Dice,Loco Dice,"{'name': 'Coachella 2013', 'artist': 'Various Artists'}",House,2013-04-13
Loco Dice/Loco Dice - Live on Radio 1 Essential Mix (24.10.15).mp3,Loco Dice 2015,Loco Dice,"{'name': 'Essential Mix', 'artist': 'Various Artists'}",Techno,2015-10-24
Lost Frequencies/Lost Frequencies - Live @ Coachella Music Festival 2016 in California (23.04.16).mp3,Lost Frequencies,Lost Frequencies,"{'name': 'Coachella 2016', 'artist': 'Various Artists'}",House,2016-04-23
Louis The Child/Louis The Child - Live @ Coachella 2022 in California (19.04.22).mp3,Louis The Child,Louis The Child,"{'name': 'Coachella 2022', 'artist': 'Various Artists'}",Electronic,2022-04-19
Louis The Child/Louis The Child - Live @ Coachella Music Festival 2016 in California (22.04.16).mp3,Louis The Child,Louis The Child,"{'name': 'Coachella 2016', 'artist': 'Various Artists'}",Electronic,2016-04-22
Low Steppa/Low Steppa - Live on Radio 1 Essential Mix (08.08.20).mp3,Low Steppa 2020,Low Steppa,"{'name': 'Essential Mix', 'artist': 'Various Artists'}",House,2020-08-08
Lucianco/Lucianco - Live @ Coachella Music Festival 2013 in California (13.04.13).mp3,Lucianco,Lucianco,"{'name': 'Coachella 2013', 'artist': 'Various Artists'}",Electronic,2013-04-13
M83/M83 - Live @ Coachella Festival 2012 in California (14.04.12).mp3,M83,M83,"{'name': 'Coachella 2012', 'artist': 'Various Artists'}",Electronic,2012-04-14
"MEDUZA/MEDUZA live @ Drumsheds (London, 2024).mp4",MEDUZA,MEDUZA,"{'name': 'Drumsheds', 'artist': 'Various Artists'}",House,2024
"MEDUZA/MEDUZA live @ EDC Las Vegas Kinetic Field, 2025 [BlS2A-1nEb0].opus",MEDUZA,MEDUZA,"{'name': 'EDC Las Vegas 2025', 'artist': 'Various Artists'}",House,2025
MEDUZA/MEDUZA • LIVE DJ SET FROM A PIZZERIA IN IBIZA [dObRo5H4u3w].opus,"Pizzeria set, Ibiza",MEDUZA,"{'name': 'MEDUZA Sets', 'artist': 'MEDUZA'}",House,
MEDUZA/MEDUZA_live_@_TOMORROWLAND_Belgium_2024.mp3,MEDUZA,MEDUZA,"{'name': 'Tomorrowland 2024', 'artist': 'Various Artists'}",House,2024
MEDUZA/MEDVZA³ Live in Ibiza - End Of Summer Set 2025 @HostalLaTorre [M-sjHoykiLE].opus,"End Of Summer Set 2025, Ibiza",MEDUZA,"{'name': 'MEDUZA Sets', 'artist': 'MEDUZA'}",House,2025
MEDUZA/Meduza Live From Hï Ibiza's Club Room • 2023 [2jSKqaBiYvc].opus,Hi Ibiza Club Room 2023,MEDUZA,"{'name': 'MEDUZA Sets', 'artist': 'MEDUZA'}",House,2023
MEDUZA/Meduza WE1 ｜ Tomorrowland 2025 [jdFzWiq3A5c].opus,MEDUZA,MEDUZA,"{'name': 'Tomorrowland 2025', 'artist': 'Various Artists'}",House,2025
MEDUZA/Meduza_Live_From_Hi_Ibiza_s_Club_Room_2023.mp3,"Hi Ibiza Club Room, 2023",MEDUZA,"{'name': 'MEDUZA Sets', 'artist': 'MEDUZA'}",House,2023
MEDUZA/Meduza³ pres： Matt live dj set ｜ ID Room #1 [9HfoqOdNlZo].opus,MEDUZA Presents: Matt Live DJ Set,MEDUZA,"{'name': 'MEDUZA Sets', 'artist': 'MEDUZA'}",Electronic,
MEDUZA/Meduza³ pres： Matt live dj set ｜ ID Room #2 [P04myMdsUFY].opus,MEDUZA Presents: Matt live dj set - room 2,MEDUZA,"{'name': 'MEDUZA Sets', 'artist': 'MEDUZA'}",House,
MEDUZA/Selected_Sessions_Meduza_Iceland_DJ_Set.mp3,Iceland DJ Set,MEDUZA,"{'name': 'MEDUZA Sets', 'artist': 'MEDUZA'}",House,
"MIKA/MIKA - Finale Top14, Stade de France, Paris – June 2018 [MxYE0RSOu4o].opus","Finale Top14, Stade de France",MIKA,"{'name': 'MIKA Sets', 'artist': 'MIKA'}",Pop,2018
MIKA/MIKA_BERCY_2024_-_ACCOR_ARENA_PARIS_25.03.24.mp3,"Apocalypse Calipso Tour, Bercy, Paris",MIKA,"{'name': 'MIKA Sets', 'artist': 'MIKA'}",Pop,2024-03-25
"MK/MK - Live @ Radio 1 Party, Ushuaia in Ibiza (01.08.14).mp3",MK,MK,"{'name': 'Ushuaia 2014', 'artist': 'Various Artists'}",House,2014-08-01
MK/MK - Live on Radio 1 Essential Mix (08.02.14).mp3,MK 2014,MK,"{'name': 'Essential Mix', 'artist': 'Various Artists'}",House,2014-02-08
"MK/Radio 1's Dance Weekend, Dance Anthems Ibiza, MK.mp4",MK,MK,"{'name': ""Radio 1's Dance Weekend"", 'artist': 'Various Artists'}",House,
MK & Steve Angello/MK & Steve Angello - Live @ Creamfields 2015 in Ibiza (08.08.15).mp3,MK & Steve Angello,MK & Steve Angello,"{'name': 'Creamfields 2015', 'artist': 'Various Artists'}",House,2015-08-08
MORTEN/MORTEN live @ Tomorrowland Freedom Stage 2024 [EUFgQxRbNtQ].opus,MORTEN,MORTEN,"{'name': 'Tomorrowland 2024', 'artist': 'Various Artists'}",House,2024
Maceo Plex/Maceo Plex - Live on Radio 1 Essential Mix (07.11.15).mp3,Maceo Plex 2015,Maceo Plex,"{'name': 'Essential Mix', 'artist': 'Various Artists'}",Techno,2015-11-07
Maceo Plex/Maceo Plex - Live on Radio 1 Essential Mix (18.02.12).mp3,Maceo Plex 2012,Maceo Plex,"{'name': 'Essential Mix', 'artist': 'Various Artists'}",Electronic,2012-02-18
Madeon/Madeon - Live @ Coachella 2022 in California (19.04.22).mp3,Madeon,Madeon,"{'name': 'Coachella 2022', 'artist': 'Various Artists'}",Electronic,2022-04-19
Madeon/Madeon - Live @ Coachella Festival 2012 in California (14.04.12).mp3,Madeon,Madeon,"{'name': 'Coachella 2012', 'artist': 'Various Artists'}",Electronic,2012-04-14
Madeon/Madeon - Live @ Coachella Music Festival 2015 in California (12.04.15).mp3,Madeon,Madeon,"{'name': 'Coachella 2015', 'artist': 'Various Artists'}",Electronic,2015-04-12
Magda/Magda - Live on Radio 1 Essential Mix (08.03.14).mp3,Magda 2014,Magda,"{'name': 'Essential Mix', 'artist': 'Various Artists'}",Techno,2014-03-08
Major Lazer/Major Lazer - Live @ Coachella Music Festival 2013 in California (13.04.13).mp3,Major Lazer,Major Lazer,"{'name': 'Coachella 2013', 'artist': 'Various Artists'}",Electronic,2013-04-13
Major Lazer/Major Lazer - Live @ Coachella Music Festival 2016 in California (24.04.16).mp3,Major Lazer,Major Lazer,"{'name': 'Coachella 2016', 'artist': 'Various Artists'}",House,2016-04-24
Mall Grab/Mall Grab - Live on Radio 1 Essential Mix (02.12.17).mp3,Mall Grab 2017,Mall Grab,"{'name': 'Essential Mix', 'artist': 'Various Artists'}",House,2017
Mall Grab/Mall Grab - Live on Radio 1 Essential Mix (13.08.22).mp3,Mall Grab 2022,Mall Grab,"{'name': 'Essential Mix', 'artist': 'Various Artists'}",House,2022-08-13
Marcel Dettmann/Marcel Dettmann - Live on Radio 1 Essential Mix (19.04.14).mp3,Marcel Dettmann 2014,Marcel Dettmann,"{'name': 'Essential Mix', 'artist': 'Various Artists'}",Techno,2014-04-19
Marco Carola/Marco Carola - Live on Radio 1 Essential Mix (08.11.14).mp3,Marco Carola 2014,Marco Carola,"{'name': 'Essential Mix', 'artist': 'Various Artists'}",Tech House,2014-11-08
Marco Faraone & Eats Everything/Marco Faraone & Eats Everything - Live @ Amnesia in Ibiza (31.07.22).mp3,Live at Amnesia Ibiza,Marco Faraone & Eats Everything,"{'name': 'Marco Faraone & Eats Everything Sets', 'artist': 'Marco Faraone & Eats Everything'}",House,2022-07-31
Maribou State/Maribou State - Live on Radio 1 Essential Mix (02.01.15).mp3,Maribou State 2015,Maribou State,"{'name': 'Essential Mix', 'artist': 'Various Artists'}",Electronic,2015-01-02
Mark Knight/Mark Knight - Live on Radio 1 Essential Mix (22.04.17).mp3,Mark Knight 2017,Mark Knight,"{'name': 'Essential Mix', 'artist': 'Various Artists'}",House,2017-04-22
Marshmello/Marshmello - Live @ Coachella Music Festival 2017 in California (14.04.17).mp3,Marshmello,Marshmello,"{'name': 'Coachella 2017', 'artist': 'Various Artists'}",Electronic,2017-04-14
Marshmello/Marshmello - Live @ Coachella Music Festival 2017 in California (16.04.17).mp3,Marshmello,Marshmello,"{'name': 'Coachella 2017', 'artist': 'Various Artists'}",Electronic,2017-04-16
Martin Garrix/Martin Garrix - Live @ Coachella Music Festival 2014 in California (13.04.14).mp3,Martin Garrix,Martin Garrix,"{'name': 'Coachella 2014', 'artist': 'Various Artists'}",Electronic,2014-04-13
Martin Garrix/Martin Garrix - Live @ Coachella Music Festival 2017 in California (14.04.17).mp3,Martin Garrix,Martin Garrix,"{'name': 'Coachella 2017', 'artist': 'Various Artists'}",Electronic,2017-04-14
Martin Garrix/Martin Garrix - Live @ Coachella Music Festival 2017 in California (15.04.17).mp3,Martin Garrix,Martin Garrix,"{'name': 'Coachella 2017', 'artist': 'Various Artists'}",Electronic,2017-04-15
Martin Solveig/Martin Solveig - Live @ Coachella Music Festival 2015 in California (12.04.15).mp3,Martin Solveig,Martin Solveig,"{'name': 'Coachella 2015', 'artist': 'Various Artists'}",House,2015-04-12
"Martinez Brothers/Radio 1's Dance Weekend, Radio 1 Dance Ibiza, The Martinez Brothers.mp4",The Martinez Brothers,The Martinez Brothers,"{'name': ""Radio 1's Dance Weekend"", 'artist': 'Various Artists'}",House,
Martyn/Martyn - Live on Radio 1 Essential Mix (17.03.12).mp3,Martyn 2012,Martyn,"{'name': 'Essential Mix', 'artist': 'Various Artists'}",Electronic,2012-03-17
"Massano/Massano @ Ribblehead Viaduct (Yorkshire Dales, UK) [Melodic Techno Set 2025] [37T8LaFlrQM].opus",Melodic Techno Set 2025,Massano,"{'name': 'Massano Sets', 'artist': 'Massano'}",Melodic Techno,2025
Matador/Matador - Live on Radio 1 Essential Mix (05.07.14).mp3,Matador 2014,Matador,"{'name': 'Essential Mix', 'artist': 'Various Artists'}",Techno,2014
Mathame/Mathame - Live on Radio 1 Essential Mix (03.10.20).mp3,Mathame 2020,Mathame,"{'name': 'Essential Mix', 'artist': 'Various Artists'}",House,2020-10-03
Matoma/Matoma - Live @ Coachella Music Festival 2016 in California (23.04.16).mp3,Matoma,Matoma,"{'name': 'Coachella 2016', 'artist': 'Various Artists'}",House,2016-04-23
"Matt Tolfrey/Matt Tolfrey - Live @ Carnival, Sankeys in Ibiza (28.07.12).mp3",Carnival Sankeys Ibiza 2012,Matt Tolfrey,"{'name': 'Matt Tolfrey Sets', 'artist': 'Matt Tolfrey'}",House,2012-07-28
Matthew Herbert/Matthew Herbert - Live on Radio 1 Essential Mix (11.07.15).mp3,Matthew Herbert 2015,Matthew Herbert,"{'name': 'Essential Mix', 'artist': 'Various Artists'}",Electronic,2015
Matthias Tanzmann/Matthias Tanzmann - Live on Radio 1 Essential Mix (05.12.15).mp3,Matthias Tanzmann 2015,Matthias Tanzmann,"{'name': 'Essential Mix', 'artist': 'Various Artists'}",House,2015-12-05
Mau P/Mau P - Live From Coachella 2025 [wxKkaBoEWCk].opus,Mau P,Mau P,"{'name': 'Coachella 2025', 'artist': 'Various Artists'}",House,2025
Max Cooper/Max Cooper - Live on Radio 1 Essential Mix (28.02.15).mp3,Max Cooper 2015,Max Cooper,"{'name': 'Essential Mix', 'artist': 'Various Artists'}",Electronic,2015
"Max Dean/Max Dean B2B Luke Dean, neXup Stage, Mint Festival [--pWNwDDOu4].opus","Max Dean B2B Luke Dean, Mint Festival",Max Dean,"{'name': 'Max Dean Sets', 'artist': 'Max Dean'}",House,
Max Dean/Max Dean ｜ ANTS 2025 - Live at Ushuaïa Ibiza #Livestream [7QtNWKXSBDw].opus,Max Dean,Max Dean,"{'name': 'ANTS 2025 Ushuaia', 'artist': 'Various Artists'}",Tech House,2025
Max Styler/Max Styler Live @ ANTS Ushuaïa Ibiza 2025 [9m6GHuC7KH8].opus,Max Styler,Max Styler,"{'name': 'ANTS 2025 Ushuaia', 'artist': 'Various Artists'}",House,2025
Max Styler/Max Styler Live @ CRSSD San Diego 2025 [W16F7JYKcVA].opus,Max Styler,Max Styler,"{'name': 'CRSSD 2025', 'artist': 'Various Artists'}",House,2025
Max Styler/Max Styler Live @ EDC Vegas 2025 [N40pkDgwNfg].opus,Max Styler,Max Styler,"{'name': 'EDC Las Vegas 2025', 'artist': 'Various Artists'}",House,2025
Max Styler/Max_Styler_Live_@_EDC_Vegas_2024.mp3,Max Styler,Max Styler,"{'name': 'EDC Las Vegas 2024', 'artist': 'Various Artists'}",Electronic,2024
Maya Jane Coles/Maya Jane Coles - Live on Radio 1 Essential Mix (19.08.17).mp3,Maya Jane Coles 2017,Maya Jane Coles,"{'name': 'Essential Mix', 'artist': 'Various Artists'}",Electronic,2017-08-19
Michael Bibi/Michael Bibi - Live on Radio 1 Essential Mix (20.06.20).mp3,Michael Bibi 2020,Michael Bibi,"{'name': 'Essential Mix', 'artist': 'Various Artists'}",House,2020-06-20
Michael Canitrot/Michael Canitrot for the reopening of Notre-Dame de Paris - Monumental Tour [4BaDPxuPBeM].opus,Reopening of Notre Dame de Paris,Michael Canitrot,"{'name': 'Michael Canitrot Sets', 'artist': 'Michael Canitrot'}",House,
Miguel Campbell/Miguel Campbell - Live on Radio 1 Essential Mix (25.08.12).mp3,Miguel Campbell 2012,Miguel Campbell,"{'name': 'Essential Mix', 'artist': 'Various Artists'}",Electronic,2012-08-25
"Ministry of Sound Classical/Ministry of Sound Classical, live from Sidney Myer Music Bowl! [JbUUcPGBIDk].opus","Ministry of Sound Classical, Brisbane",Ministry of Sound Classical,"{'name': 'Classical House', 'artist': 'Various Artists'}",House,
Moby/Moby - Live @ Coachella Music Festival 2013 in California (13.04.13).mp3,Moby,Moby,"{'name': 'Coachella 2013', 'artist': 'Various Artists'}",Electronic,2013-04-13
Moderat/Moderat - Live @ Coachella Music Festival 2017 in California (15.04.17).mp3,Moderat,Moderat,"{'name': 'Coachella 2017', 'artist': 'Various Artists'}",Electronic,2017-04-15
Moguai/Moguai - Live on Radio 1 Essential Mix (10.03.12).mp3,Moguai 2012,Moguai,"{'name': 'Essential Mix', 'artist': 'Various Artists'}",Electronic,2012-03-10
Monika Kruse/Monika Kruse - Live on Radio 1 Essential Mix (01.04.17).mp3,Monika Kruse 2017,Monika Kruse,"{'name': 'Essential Mix', 'artist': 'Various Artists'}",Techno,2017-04-01
"Monki/Monki - Live @ Radio 1 Party, Ushuaia Hotel in Ibiza (31.07.15).mp3",Monki,Monki,"{'name': 'Ushuaia 2015', 'artist': 'Various Artists'}",Electronic,2015-07-31
Mountain Of Youth/Mountain Of Youth - Live @ Coachella Music Festival 2016 in California (24.04.16).mp3,Mountain Of Youth,Mountain Of Youth,"{'name': 'Coachella 2016', 'artist': 'Various Artists'}",Electronic,2016-04-24
Mr Carmack/Mr Carmack - Live @ Coachella Music Festival 2016 in California (23.04.16).mp3,Mr Carmack,Mr Carmack,"{'name': 'Coachella 2016', 'artist': 'Various Artists'}",House,2016
Mura Masa/Mura Masa - Live on Radio 1 Essential Mix (08.07.17).mp3,Mura Masa 2017,Mura Masa,"{'name': 'Essential Mix', 'artist': 'Various Artists'}",Electronic,2017
Mura Massa/Mura Masa - Live @ Coachella Music Festival 2017 in California (15.04.17).mp3,Mura Masa,Mura Masa,"{'name': 'Coachella 2017', 'artist': 'Various Artists'}",Electronic,2017-04-15
My Nu Leng/My Nu Leng - Live on Radio 1 Essential Mix (11.02.17).mp3,My Nu Leng 2017,My Nu Leng,"{'name': 'Essential Mix', 'artist': 'Various Artists'}",House,2017
"Myd/Radio 1's Essential Mix, Myd.mp4",Myd,Myd,"{'name': 'Essential Mix', 'artist': 'Various Artists'}",House,
Nav/Nav - Live @ Coachella Music Festival 2017 in California (15.04.17).mp3,Nav,Nav,"{'name': 'Coachella 2017', 'artist': 'Various Artists'}",Hip Hop,2017-04-15
Nero/Nero - Live @ Coachella Music Festival 2015 in California (10.04.15).mp3,Nero,Nero,"{'name': 'Coachella 2015', 'artist': 'Various Artists'}",Dubstep,2015-04-10
Nero/Nero - Live @ Hackney Weekend 2012 in London (07.07.12).mp3,Nero,Nero,"{'name': 'Hackney Weekend 2012', 'artist': 'Various Artists'}",Drum & Bass,2012
Nero/Nero - Live on Radio Essential Mix (12.09.15).mp3,Nero 2015,Nero,"{'name': 'Essential Mix', 'artist': 'Various Artists'}",Electronic,2015-09-12
New World Punx/New World Punx - Live @ Coachella Music Festival 2015 in California (12.04.15).mp3,New World Punx,New World Punx,"{'name': 'Coachella 2015', 'artist': 'Various Artists'}",House,2015-04-12
"Nia Archives/Radio 1's Classic Essential Mix, Nia Archives 2023.mp4",Nia Archives 2023,Nia Archives,"{'name': 'Essential Mix', 'artist': 'Various Artists'}",Electronic,2023
Nic Fanciulli/Nic Fanciulli - Live @ Coachella Music Festival 2016 in California (22.04.16).mp3,Nic Fanciulli,Nic Fanciulli,"{'name': 'Coachella 2016', 'artist': 'Various Artists'}",House,2016-04-22
Nic Fanciulli/Nic Fanciulli - Live on Radio 1 Essential Mix (11.11.17).mp3,Nic Fanciulli 2017,Nic Fanciulli,"{'name': 'Essential Mix', 'artist': 'Various Artists'}",House,2017-11-11
Nicky Holloway/Nicky Holloway - Live @ Radio 1 Essential Mix Ibiza 20 Special Part 9 (01.08.15).mp3,Nicky Holloway 2015,Nicky Holloway,"{'name': 'Essential Mix', 'artist': 'Various Artists'}",Electronic,2015-08-01
Nicky Romero/Nicky Romero - Live @ Coachella Music Festival 2013 in California (13.04.13).mp3,Nicky Romero,Nicky Romero,"{'name': 'Coachella 2013', 'artist': 'Various Artists'}",House,2013-04-13
Nicky Romero/Nicky Romero - Live on Radio 1 Essential Mix (28.04.12).mp3,Nicky Romero 2012,Nicky Romero,"{'name': 'Essential Mix', 'artist': 'Various Artists'}",House,2012-04-28
Nicolas Jaar/Nicolas Jaar - Live on Radio 1 Essential Mix (19.05.12).mp3,Nicolas Jaar 2012,Nicolas Jaar,"{'name': 'Essential Mix', 'artist': 'Various Artists'}",Electronic,2012-05-19
Nicolas Jaar/Nicolas Jaar - Live on Radio 1 Essential Mix (19.05.20).mp3,Nicolas Jaar 2020,Nicolas Jaar,"{'name': 'Essential Mix', 'artist': 'Various Artists'}",Electronic,2020-05-19
Nicolas Jar/Nicolas Jar - Live @ Coachella Music Festival 2014 in California (13.04.14).mp3,Nicolas Jaar,Nicolas Jaar,"{'name': 'Coachella 2014', 'artist': 'Various Artists'}",Electronic,2014-04-13
Nicole Moudaber/Nicole Moudaber - Live @ Coachella 2019 in California (19.04.19).mp3,Nicole Moudaber,Nicole Moudaber,"{'name': 'Coachella 2019', 'artist': 'Various Artists'}",Techno,2019-04-19
Nicole Moudaber/Nicole Moudaber - Live @ Coachella Music Festival 2014 in California (13.04.14).mp3,Nicole Moudaber,Nicole Moudaber,"{'name': 'Coachella 2014', 'artist': 'Various Artists'}",Techno,2014-04-13
Nicole Moudaber/Nicole Moudaber - Live on Radio 1 Essential Mix (23.06.12).mp3,Nicole Moudaber 2012,Nicole Moudaber,"{'name': 'Essential Mix', 'artist': 'Various Artists'}",Techno,2012-06-23
Nina Kraviz/Nina Kraviz - Live on Radio 1 Essential Mix (07.10.17).mp3,Nina Kraviz 2017,Nina Kraviz,"{'name': 'Essential Mix', 'artist': 'Various Artists'}",Techno,2017-10-07
Nina Kraviz/Nina Kraviz - Live on Radio 1 Essential Mix (12.05.12).mp3,Nina Kraviz 2012,Nina Kraviz,"{'name': 'Essential Mix', 'artist': 'Various Artists'}",Techno,2012-05-12
Nina Las Vegas/Nina Las Vegas - Live @ Coachella Music Festival 2016 in California (22.04.16).mp3,Nina Las Vegas,Nina Las Vegas,"{'name': 'Coachella 2016', 'artist': 'Various Artists'}",House,2016-04-22
Nocturnal Sunshine/Nocturnal Sunshine - Live on Radio 1 Essential Mix (13.03.20).mp3,Nocturnal Sunshine 2020,Nocturnal Sunshine,"{'name': 'Essential Mix', 'artist': 'Various Artists'}",Electronic,2020-03-13
Nora En Pure/Nora En Pure - Live @ Coachella Music Festival 2017 in California (14.04.17).mp3,Nora En Pure,Nora En Pure,"{'name': 'Coachella 2017', 'artist': 'Various Artists'}",House,2017-04-14
Object Blue/Object Blue - Live on Radio 1 Essential Mix-(15.08.20).mp3,Object Blue 2020,Object Blue,"{'name': 'Essential Mix', 'artist': 'Various Artists'}",Electronic,2020-08-15
Objekt/Objekt - Live on Radio 1 Essential Mix (03.05.20).mp3,Objekt 2020,Objekt,"{'name': 'Essential Mix', 'artist': 'Various Artists'}",Electronic,2020-05-03
Oliver Dollar/Oliver Dollar - Live on Radio 1 Essential Mix (20.12.14).mp3,Oliver Dollar 2014,Oliver Dollar,"{'name': 'Essential Mix', 'artist': 'Various Artists'}",House,2014-12-20
Oliver Heldens/Oliver Heldens - Live @ Coachella Music Festival 2015 in California (10.04.15).mp3,Oliver Heldens,Oliver Heldens,"{'name': 'Coachella 2015', 'artist': 'Various Artists'}",House,2015
Oliver Heldens/Oliver Heldens - Live on Radio 1 Essential Mix (15.07.17).mp3,Oliver Heldens 2017,Oliver Heldens,"{'name': 'Essential Mix', 'artist': 'Various Artists'}",House,2017-07-15
Oliver Heldens/Oliver Heldens Live at The Edge NYC ｜ Epic 2-Hour DJ Set from Marquee Skydeck (Heights Warning!)[4K] [98u3AJVEL8Q].opus,The Edge NYC,Oliver Heldens,"{'name': 'Oliver Heldens Sets', 'artist': 'Oliver Heldens'}",House,
Orla/Orla - Live on Radio 1 Essential Mix (07.11.20).mp3,Orla 2020,Orla,"{'name': 'Essential Mix', 'artist': 'Various Artists'}",Electronic,2020-11-07
POSITIV/✨ Revivez l’édition 2025 du POSITIV Electronic Festival ✨ [7IFVmjbini0].opus,POSITIV 2025 Aftermovie,Various Artists,"{'name': 'POSITIV Electronic Festival 2025', 'artist': 'Various Artists'}",Electronic,2025
Pa/Pan-Pot - Live on Radio 1 Essential Mix (28.01.17).mp3,Pan-Pot 2017,Pan-Pot,"{'name': 'Essential Mix', 'artist': 'Various Artists'}",Techno,2017-01-28
Paco Osuna/Paco Osuna - Live on Radio 1 Essential Mix (30.05.20).mp3,Paco Osuna 2020,Paco Osuna,"{'name': 'Essential Mix', 'artist': 'Various Artists'}",Techno,2020
PartyWave/PartyWave - Live @ Coachella Music Festival 2017 in California (14.04.17).mp3,PartyWave,PartyWave,"{'name': 'Coachella 2017', 'artist': 'Various Artists'}",Electronic,2017-04-14
Patrice Baumel/Patrice Baumel - Live on Radio 1 Essential Mix (23.09.17).mp3,Patrice Baumel 2017,Patrice Baumel,"{'name': 'Essential Mix', 'artist': 'Various Artists'}",House,2017-09-23
Patrick Topping/Patrick Topping - Live @ Radio 1 Big Weekend in Coventry (18.06.22).mp3,Patrick Topping,Patrick Topping,"{'name': 'Radio 1 Big Weekend 2022', 'artist': 'Various Artists'}",House,2022-06-18
Patrick Topping/Patrick Topping - Live on Radio 1 Essential Mix (18.04.15).mp3,Patrick Topping 2015,Patrick Topping,"{'name': 'Essential Mix', 'artist': 'Various Artists'}",Tech House,2015-04-18
Patrick Topping/Patrick Topping DJ Set Live @ Trick Edinburgh 2023 [0L9a8ADDDes].opus,"Patrick Topping, Trick Edinburgh",Patrick Topping,"{'name': 'Patrick Topping Sets', 'artist': 'Patrick Topping'}",Tech House,2023
"Patrick Topping/Radio 1's Dance Weekend, Radio 1 Dance Ibiza, Patrick Topping.mp4",Patrick Topping,Patrick Topping,"{'name': ""Radio 1's Dance Weekend"", 'artist': 'Various Artists'}",House,
Patrick Topping & Richie Ahmed/Patrick Topping & Richie Ahmed - Live @ Glastonbury 2017 in Sommerset (23.06.17).mp3,Patrick Topping & Richie Ahmed,Patrick Topping & Richie Ahmed,"{'name': 'Glastonbury 2017', 'artist': 'Various Artists'}",House,2017-06-23
Paul Oakenfold/Paul Oakenfold - Live @ Coachella Music Festival 2013 in California (13.04.13).mp3,Paul Oakenfold,Paul Oakenfold,"{'name': 'Coachella 2013', 'artist': 'Various Artists'}",Electronic,2013-04-13
"Paul Oakenfold/Paul Oakenfold - Live @ Radio 1 Essential Mix Ibiza 20 Part 4, Space (26.07.15).mp3",Paul Oakenfold 2015,Paul Oakenfold,"{'name': 'Essential Mix', 'artist': 'Various Artists'}",Electronic,2015-07-26
Paul Oakenfold/Paul Oakenfold - Live on Radio 1 Essential Mix (21.07.12).mp3,Paul Oakenfold 2012,Paul Oakenfold,"{'name': 'Essential Mix', 'artist': 'Various Artists'}",Trance,2012-07-21
Paul Woolford/Paul Woolford - Live on Radio 1 Essential Mix (14.11.15).mp3,Paul Woolford 2015,Paul Woolford,"{'name': 'Essential Mix', 'artist': 'Various Artists'}",House,2015-11-14
Peggy Gou/Peggy Gou - Live @ Glastonbury 2017 in Sommerset (23.06.17).mp3,Peggy Gou,Peggy Gou,"{'name': 'Glastonbury Festival 2017', 'artist': 'Various Artists'}",House,2017-06-23
Peggy Gou/Peggy Gou - Live @ Glastonbury in Somerset Replay (27.06.20).mp3,Peggy Gou,Peggy Gou,"{'name': 'Glastonbury Festival 2020', 'artist': 'Various Artists'}",House,2020-06-27
"Peggy Gou/Radio 1's Classic Essential Mix, Peggy Gou 2018.mp4",Peggy Gou 2018,Peggy Gou,"{'name': 'Essential Mix', 'artist': 'Various Artists'}",House,2018
Pet Shop Boys/Pet Shop Boys - Live @ Coachella Music Festival 2014 in California (13.04.14).mp3,Pet Shop Boys,Pet Shop Boys,"{'name': 'Coachella 2014', 'artist': 'Various Artists'}",Electronic,2014-04-13
Pete Tong/Pete Tong - Live @ Coachella Festival 2002 in California (05.05.02).mp3,Pete Tong,Pete Tong,"{'name': 'Coachella 2002', 'artist': 'Various Artists'}",Electronic,2002-05-05
Pete Tong/Pete Tong - Live @ Ibiza Rocks Hotel in Ibiza (02.08.15).mp3,Pete Tong,Pete Tong,"{'name': 'Ibiza Rocks 2015', 'artist': 'Various Artists'}",House,2015-08-02
Pete Tong/Pete Tong - Live @ Privilege in Ibiza (04.08.12).mp3,"Pete Tong, Ibiza, 2012",Pete Tong,"{'name': 'Pete Tong Sets', 'artist': 'Pete Tong'}",House,2012
Pete Tong/Pete Tong - Live @ The Road To Coachella  (12.04.19).mp3,"Pete Tong, The Road To Coachella 2019",Pete Tong,"{'name': 'Pete Tong Sets', 'artist': 'Pete Tong'}",Electronic,2019-04-12
Pete Tong/Pete Tong - Live on Radio 1 Essential Mix (20.04.12).mp3,Pete Tong 2012,Pete Tong,"{'name': 'Essential Mix', 'artist': 'Various Artists'}",Electronic,2012-04-20
"Pete Tong/Pete Tong's Hot Mix, Adam Ten.mp4","Hot Mix, Adem Ten",Pete Tong,"{'name': 'Pete Tong Hot Mix', 'artist': 'Pete Tong'}",House,
"Pete Tong/Pete Tong's Hot Mix, David Mackay, Fur Coat, Max Styler and more.mp4","Hot Mix, David Mackay, Fur Coat, Max Styler and more",Pete Tong,"{'name': 'Pete Tong Hot Mix', 'artist': 'Pete Tong'}",Electronic,
"Pete Tong/Pete Tong's Hot Mix, Moojo.mp4","Hot Mix, Moojo",Pete Tong,"{'name': 'Pete Tong Hot Mix', 'artist': 'Pete Tong'}",House,
"Pete Tong/Pete Tong's Hot Mix, OMRI., Goom Gum, Max Styler, Sasha and more.mp4","Hot Mix, OMRI., Goom Gum, Max Styler, Sasha and more",Pete Tong,"{'name': 'Pete Tong Hot Mix', 'artist': 'Pete Tong'}",House,
"Pete Tong/Pete Tong's Hot Mix, with Eats Everything.mp4","Hot Mix, with Eats Everything",Pete Tong,"{'name': 'Pete Tong Hot Mix', 'artist': 'Pete Tong'}",House,
"Pete Tong/Radio 1 Anthems, Huge Radio 1 Anthems!.mp4",Radio 1 Anthems,Pete Tong,"{'name': 'Pete Tong Sets', 'artist': 'Pete Tong'}",Electronic,
"Pete Tong/Radio 1 Dance Presents..., Radio 1 in Ibiza_ Pete Tong at ANTS, Ushuaïa.mp4","Pete Tong, ANTS Ibiza",Pete Tong,"{'name': 'Radio 1 Dance Presents...', 'artist': 'Various Artists'}",Electronic,
Pete Tong & Franky Wah/Pete Tong & Franky Wah - Live @ Radio 1 Big Weekend in Coventry (18.06.22).mp3,Pete Tong & Franky Wah,Pete Tong & Franky Wah,"{'name': 'Radio 1 Big Weekend 2022', 'artist': 'Various Artists'}",House,2022-06-18
Pete Tong & Friends/Pete Tong & Friends - Live @ Radio 1 - Live @ Ushuaia Hotel in Ibiza (03.08.12).mp3,Pete Tong & Friends,Pete Tong & Friends,"{'name': 'Ushuaia 2012', 'artist': 'Various Artists'}",Electronic,2012-08-03
"Pete Tong & Hot Since 82/Pete Tong & Hot Since 82 - Live @ Radio 1 Party, Ushuaia in Ibiza (01.08.14).mp3",Pete Tong & Hot Since 82,Pete Tong & Hot Since 82,"{'name': 'Ushuaia 2014', 'artist': 'Various Artists'}",House,2014-08-01
Pete Tong & Sasha/Pete Tong & Sasha - Live @ Radio 1 Essential Mix Ibiza 20 Special Part 1 (25.07.15).mp3,Pete Tong & Sasha 2015,Pete Tong & Sasha,"{'name': 'Essential Mix', 'artist': 'Various Artists'}",House,2015-07-25
Pete Tong b2b Kolsch/Pete Tong b2b Kolsch - Live @ Glastonbury 2014 in Somerset (28.06.14).mp3,Pete Tong b2b Kölsch,Pete Tong & Kölsch,"{'name': 'Glastonbury Festival 2014', 'artist': 'Various Artists'}",House,2014-06-28
Phantonogram/Phantonogram - Live @ Coachella Music Festival 2017 in California (14.04.17).mp3,Phantonogram,Phantonogram,"{'name': 'Coachella 2017', 'artist': 'Various Artists'}",Electronic,2017-04-14
Photek/Photek - Live on Radio 1 Essential Mix (06.10.12).mp3,Photek 2012,Photek,"{'name': 'Essential Mix', 'artist': 'Various Artists'}",Drum and Bass,2012-10-06
Porkchop/Porkchop - Live @ Coachella Music Festival 2017 in California (16.04.17).mp3,Porkchop,Porkchop,"{'name': 'Coachella 2017', 'artist': 'Various Artists'}",Electronic,2017-04-16
Porter Robinson/Porter Robinson - Live @ Coachella Music Festival 2015 in California (10.04.15).mp3,Porter Robinson,Porter Robinson,"{'name': 'Coachella 2015', 'artist': 'Various Artists'}",Electronic,2015-04-10
Porter Robinson/Porter Robinson - Live @ Coachella Music Festival 2017 in California (14.04.17).mp3,Porter Robinson,Porter Robinson,"{'name': 'Coachella 2017', 'artist': 'Various Artists'}",Electronic,2017-04-14
Porter Robinson/Porter Robinson - Live @ Coachella Music Festival 2017 in California (16.04.17).mp3,Porter Robinson,Porter Robinson,"{'name': 'Coachella 2017', 'artist': 'Various Artists'}",Electronic,2017-04-16
Porter Robinson/Porter Robinson - Live @ Essential Mix in Hull (28.01.12).mp3,Porter Robinson 2012,Porter Robinson,"{'name': 'Essential Mix', 'artist': 'Various Artists'}",Electronic,2012-01-28
Porter Robinson/Porter Robinson - Live on Essential Mix (21.06.14).mp3,Porter Robinson 2014,Porter Robinson,"{'name': 'Essential Mix', 'artist': 'Various Artists'}",Electronic,2014-06-21
Prospa/Prospa - Essential Mix (Full Audio) [I63V4aJuyPA].opus,Prospa,Prospa,"{'name': 'Essential Mix', 'artist': 'Various Artists'}",House,
Prospa/Prospa - Live DJs Set @ NYC Pop Up RAW CUTS [Sz1YDUR7WmM].opus,Prospa - NYC Pop Up,Prospa,"{'name': 'Prospa Sets', 'artist': 'Prospa'}",House,
"Prospa/Prospa ｜ Into Reality ｜ The Warehouse, Leeds UK [9fb45vCcLks].opus","Warehouse, Leeds",Prospa,"{'name': 'Prospa Sets', 'artist': 'Prospa'}",Tech House,
Prospa/Prospa ｜ NYC Pop Up ｜ RAW CUTS [k7Is8v-XEhQ].opus,NYC Pop up,Prospa,"{'name': 'Prospa Sets', 'artist': 'Prospa'}",House,
Prospa/Prospa_Boiler_Room_-_Sydney.mp3,Prospa Sydney,Prospa,"{'name': 'Boiler Room', 'artist': 'Various Artists'}",Techno,2024
Prospa/Prospa_Live_at_Electric_Brixton_2023.mp3,Electric Brixton 2023,Prospa,"{'name': 'Prospa Sets', 'artist': 'Prospa'}",House,2023
"Prospa/Radio 1 Dance Presents..., Drumsheds Prospa.mp4",Prospa,Prospa,"{'name': 'Drumsheds', 'artist': 'Various Artists'}",House,
Prospa b2b DJ Seinfeld/Rinse HQ067 ｜ Prospa B2B DJ Seinfeld [jf7UkY3gmiY].opus,Prospa & DJ Seinfeld B2B Set - Rinse HQ067,Prospa & DJ Seinfeld,"{'name': 'Prospa & DJ Seinfeld Sets', 'artist': 'Prospa & DJ Seinfeld'}",House,
Purple Disco Machine/Purple Disco Machine - Live on Radio 1 Essential Mix (21.10.17).mp3,Purple Disco Machine 2017,Purple Disco Machine,"{'name': 'Essential Mix', 'artist': 'Various Artists'}",House,2017-10-21
Purple Disco Machine/Purple Disco Machine House Set @ Glitterbox Hï Ibiza [yRYPwUxAGLQ].opus,House Set - Glitterbox Hi Ibiza,Purple Disco Machine,"{'name': 'Purple Disco Machine Sets', 'artist': 'Purple Disco Machine'}",House,
R3hab/R3hab - Live @ Coachella Music Festival 2015 in California (10.04.15).mp3,R3hab,R3hab,"{'name': 'Coachella 2015', 'artist': 'Various Artists'}",House,2015-04-10
Radio 1/Radio 1 - Live @ Creamfields in Liverpool (01.09.12).mp3,Radio 1,Radio 1,"{'name': 'Creamfields 2012', 'artist': 'Various Artists'}",Electronic,2012-09-01
"Radio 1/Radio 1 - Live @ Enter, Space in Ibiza Part 1 (30.07.15).mp3",Space Ibiza 2015,Radio 1,"{'name': 'Radio 1 Sets', 'artist': 'Radio 1'}",Electronic,2015-07-30
Radio 1/Radio 1 - Live @ T In The Park Slam in Glasgow (18.07.15).mp3,"T In the Park, Glasgow 2015",Radio 1,"{'name': 'Radio 1 Sets', 'artist': 'Radio 1'}",Electronic,2015-07-18
Radio 1/The Radio 1 Ibiza Prom [xs3BXVTF7mw].opus,Radio 1 Ibiza Prom,Radio 1,"{'name': 'Classical House', 'artist': 'Various Artists'}",Dance,
Radiohead/Radiohead - Live @ Coachella Festival 2012 in California (14.04.12).mp3,Radiohead,Radiohead,"{'name': 'Coachella 2012', 'artist': 'Various Artists'}",Alternative Rock,2012-04-14
Radiohead/Radiohead - Live @ Coachella Music Festival 2017 in California (14.04.17).mp3,Radiohead,Radiohead,"{'name': 'Coachella 2017', 'artist': 'Various Artists'}",Rock,2017-04-14
Ratatat/Ratatat - Live @ Coachella Music Festival 2015 in California (11.04.15).mp3,Ratatat,Ratatat,"{'name': 'Coachella 2015', 'artist': 'Various Artists'}",Electronic,2015-04-11
Rebekah/Rebekah - Live on Radio 1 Essential Mix (16.09.17).mp3,Rebekah 2017,Rebekah,"{'name': 'Essential Mix', 'artist': 'Various Artists'}",Techno,2017-09-16
Rebuke/Rebuke - Live on Radio 1 Essential Mix (22.08.20).mp3,Rebuke 2020,Rebuke,"{'name': 'Essential Mix', 'artist': 'Various Artists'}",Techno,2020-08-22
Redlight/Redlight - Live on Radio 1 Essential Mix (21.02.15).mp3,Redlight 2015,Redlight,"{'name': 'Essential Mix', 'artist': 'Various Artists'}",Electronic,2015-02-21
Rehab/Rehab - Live on Radio 1 Essential Mix (15.02.14).mp3,Rehab 2014,Rehab,"{'name': 'Essential Mix', 'artist': 'Various Artists'}",Tech House,2014-02-15
Ricardo Villalobos & Raresh/Ricardo Villalobos & Raresh - Live @ Amnesia in Ibiza (18.07.20).mp3,Amnesia Ibiza,Ricardo Villalobos & Raresh,"{'name': 'Ricardo Villalobos & Raresh Sets', 'artist': 'Ricardo Villalobos & Raresh'}",House,2020-07-18
Richie Hawtin/Richie Hawtin - Live @ Coachella 2022 in California (19.04.22).mp3,Richie Hawtin,Richie Hawtin,"{'name': 'Coachella 2022', 'artist': 'Various Artists'}",Electronic,2022-04-19
Richie Hawtin/Richie Hawtin - Live @ Coachella Festival 2010 in California (18.04.10).mp3,Richie Hawtin,Richie Hawtin,"{'name': 'Coachella 2010', 'artist': 'Various Artists'}",Techno,2010-04-18
Richie Hawtin/Richie Hawtin - Live @ Coachella Music Festival 2017 in California (14.04.17).mp3,Richie Hawtin,Richie Hawtin,"{'name': 'Coachella 2017', 'artist': 'Various Artists'}",Techno,2017-04-14
Richy Ahmed/Richy Ahmed - Live on Radio 1 Essential Mix (29.11.14).mp3,Richy Ahmed 2014,Richy Ahmed,"{'name': 'Essential Mix', 'artist': 'Various Artists'}",House,2014-11-29
Riordan/RIORDAN LIVE @ EDC VEGAS 2024 [uwUFZsC-KCw].opus,Riordan,Riordan,"{'name': 'EDC Las Vegas 2024', 'artist': 'Various Artists'}",Electronic,2024
"Riordan/Riordan @ The Edge, NYC [UvcP9j5QcyQ].opus",The Edge NYC,Riordan,"{'name': 'Riordan Sets', 'artist': 'Riordan'}",Electronic,
Roman Fluegel/Roman Fluegel - Live on Radio 1 Essential Mix (12.12.15).mp3,Roman Fluegel 2015,Roman Fluegel,"{'name': 'Essential Mix', 'artist': 'Various Artists'}",Electronic,2015-12-12
Royksopp/Royksopp - Live @ Coachella Music Festival 2017 in California (15.04.17).mp3,Röyksopp,Röyksopp,"{'name': 'Coachella 2017', 'artist': 'Various Artists'}",Electronic,2017-04-15
Rudimental/Rudimental - Live on Radio 1 Essential Mix (29.08.15).mp3,Rudimental 2015,Rudimental,"{'name': 'Essential Mix', 'artist': 'Various Artists'}",Drum & Bass,2015-08-29
Rufus/Rufus - Live @ Coachella Music Festival 2016 in California (23.04.16).mp3,Rüfüs Du Sol,Rüfüs Du Sol,"{'name': 'Coachella 2016', 'artist': 'Various Artists'}",House,2016-04-23
Rustie/Rustie - Live on Radio 1 Essential Mix (07.04.12).mp3,Rustie 2012,Rustie,"{'name': 'Essential Mix', 'artist': 'Various Artists'}",Electronic,2012-04-07
Ryan Elliott/Ryan Elliott - Live on Radio 1 Essential Mix (12.05.20).mp3,Ryan Elliott 2020,Ryan Elliott,"{'name': 'Essential Mix', 'artist': 'Various Artists'}",Electronic,2020-05-12
Barry Can't Swim/Barry Can't Swim ｜ Mixmag Lab London 2025 - 20250321.opus,Mixmag Lab London,Barry Can't Swim,"{'name': ""Barry Can't Swim Sets"", 'artist': ""Barry Can't Swim""}",House,2025-03-21
Confidence Man/Confidence Man DJ set ｜ Mixmag Lab London - 20241017.opus,Mixmag Lab London,Confidence Man,"{'name': 'Confidence Man Sets', 'artist': 'Confidence Man'}",Electronic,2024-10-17
Eats Everything/Eats Everything ｜ Mixmag Lab London x Fly San Miguel - 20250521.opus,Mixmag Lab London,Eats Everything,"{'name': 'Eats Everything Sets', 'artist': 'Eats Everything'}",House,2025-05-21
Ella Knight/Ella Knight ｜ Mixmag Lab London ｜ Horizon 22 - 20250918.opus,Mixmag Lab London,Ella Knight,"{'name': 'Ella Knight Sets', 'artist': 'Ella Knight'}",Electronic,2025-09-18
Faithless/Faithless (DJ Set) ｜ Mixmag Lab London - 20250910.opus,"DJ Set, Mixmag Lab London",Faithless,"{'name': 'Faithless Sets', 'artist': 'Faithless'}",Electronic,2025-09-10
Honey Dijon/Honey Dijon DJ set Barcelona ｜ Burn Energy Tour x Mixmag - 20241220.opus,"Burn Energy Tour, Mixmag",Honey Dijon,"{'name': 'Honey Dijon Sets', 'artist': 'Honey Dijon'}",House,2024-12-20
Patrick Topping/Patrick Topping tech-house set ｜ Mixmag Lab London ｜ Wagtail Rooftop - 20250829.opus,Mixmag Lab London,Patrick Topping,"{'name': 'Patrick Topping Sets', 'artist': 'Patrick Topping'}",Tech House,2025-08-29
Riordan/Riordan DJ Set ｜ Rise Festival 2024 ｜ Mixmag Netherlands + Germany Sessions - 20250113.opus,Rise Festival 2024,Riordan,"{'name': 'Riordan Sets', 'artist': 'Riordan'}",House,2024
Riordan/Riordan at The Concourse Project ｜ Full Set (1 Aug 2025) - 20250904.opus,The Concourse Project 2025,Riordan,"{'name': 'Riordan Sets', 'artist': 'Riordan'}",Techno,2025-08-01
Rufus/RÜFÜS DU SOL - Live from Joshua Tree - 20200305.opus,Live from Joshua Tree,Rüfüs Du Sol,"{'name': 'Rüfüs Du Sol Sets', 'artist': 'Rüfüs Du Sol'}",Electronic,2020-03-05
Rufus/RÜFÜS DU SOL (DJ SET) - Mayan Warrior - Burning Man 2024 - 20240909.opus,Rüfüs Du Sol,Rüfüs Du Sol,"{'name': 'Burning Man 2024', 'artist': 'Various Artists'}",House,2024-09-09
Rufus/RÜFÜS DU SOL ｜ Lollapalooza Chicago 2025 ｜ Full Set - 20250803.opus,Rüfüs Du Sol,Rüfüs Du Sol,"{'name': 'Lollapalooza Chicago 2025', 'artist': 'Various Artists'}",House,2025-08-03
SG Lewis/SG Lewis ｜ Mixmag Lab London x Forever Days ｜ 2025 - 20250606.opus,Mixmag Lab London,SG Lewis,"{'name': 'SG Lewis Sets', 'artist': 'SG Lewis'}",Electronic,2025-06-06
"SG Lewis/The Residency on Radio 1 Dance, SG Lewis - Anemoia.mp4",Anemoia,SG Lewis,"{'name': 'The Residency, SG Lewis', 'artist': 'SG Lewis'}",Electronic,
"SG Lewis/The Residency on Radio 1 Dance, SG Lewis - Heroes with TEED.mp4",Heroes with TEED,SG Lewis,"{'name': 'The Residency, SG Lewis', 'artist': 'SG Lewis'}",Electronic,
SNBRN/SNBRN - Live @ Coachella Music Festival 2017 in California (14.04.17).mp3,SNBRN,SNBRN,"{'name': 'Coachella 2017', 'artist': 'Various Artists'}",House,2017-04-14
SPFDJ/SPFDJ - Live on Radio 1 Essential Mix (12.03.22).mp3,SPFDJ 2022,SPFDJ,"{'name': 'Essential Mix', 'artist': 'Various Artists'}",Techno,2022-03-12
SWITCH DISCO/SWITCH DISCO - LIVE DJ SET FROM IBIZA ROCKS 2024 (IBIZA DANCE ANTHEMS) [7R5HeDbmY9c].opus,Switch Disco,Switch Disco,"{'name': 'Switch Disco Sets', 'artist': 'Switch Disco'}",House,2024
SWITCH DISCO/SWITCH DISCO - THE SWITCH UP ＊＊OVER 140 SONGS IN 45 MINUTES!!＊＊ [drNH0rEpZUg].opus,The Switch Up,Switch Disco,"{'name': 'Switch Disco Sets', 'artist': 'Switch Disco'}",House,
SWITCH DISCO/SWITCH_DISCO_-_LIVE_DJ_SET_FROM_CARPE_DIEM_BEACH_HVAR_CROATIA_HOUSE_MELODIC_TECHNO_TECH_HOUSE.mp3,"Carpe Diem Beach (Hvar, Croatia)",Switch Disco,"{'name': 'Switch Disco Sets', 'artist': 'Switch Disco'}",House,2025
SWITCH DISCO/SWITCH_DISCO_-_LIVE_FROM_DRUMSHEDS_LONDON_UK_2024.mp3,Switch Disco,Switch Disco,"{'name': 'Drumsheds', 'artist': 'Various Artists'}",House,2024
"SYREETA/Radio 1's Essential Mix, SYREETA.mp4",SYREETA,SYREETA,"{'name': 'Essential Mix', 'artist': 'Various Artists'}",Electronic,
S_P_Y/S.P.Y. - Live on Radio 1 Essential Mix (10.01.15).mp3,S.P.Y. 2015,S.P.Y.,"{'name': 'Essential Mix', 'artist': 'Various Artists'}",Drum & Bass,2015
Sabo/Sabo - Live @ Coachella Music Festival 2017 in California (15.04.17).mp3,Sabo,Sabo,"{'name': 'Coachella 2017', 'artist': 'Various Artists'}",House,2017-04-15
"Sam Divine/Radio 1's Dance Weekend, Dance Anthems Ibiza, Sam Divine.mp4",Sam Divine,Sam Divine,"{'name': ""Radio 1's Dance Weekend"", 'artist': 'Various Artists'}",House,
Sam Divine/Sam Divine - Live @ Radio 1 Big Weekend in Coventry (18.06.22).mp3,Sam Divine,Sam Divine,"{'name': 'Radio 1 Big Weekend 2022', 'artist': 'Various Artists'}",House,2022-06-18
Sam Feldt/Sam Feldt - Live @ Coachella Music Festival 2016 in California (22.04.16).mp3,Sam Feldt,Sam Feldt,"{'name': 'Coachella 2016', 'artist': 'Various Artists'}",House,2016-04-22
"Sammy Virji/Radio 1's Essential Mix, Essential Mix of the Year 2024 - Sammy Virji.mp4",Sammy Virji 2024,Sammy Virji,"{'name': 'Essential Mix', 'artist': 'Various Artists'}",Electronic,2024
Sander Kleinenberg/Sander Kleinenberg - Live @ The Road To Coachella  (12.04.19).mp3,The Road To Coachella 2019,Sander Kleinenberg,"{'name': 'Sander Kleinenberg Sets', 'artist': 'Sander Kleinenberg'}",House,2019-04-12
Sarah Story & Jaguar/Sarah Story & Jaguar - Live @ Radio 1 Big Weekend in Coventry (18.06.22).mp3,Sarah Story & Jaguar,Sarah Story & Jaguar,"{'name': 'Radio 1 Big Weekend 2022', 'artist': 'Various Artists'}",House,2022-06-18
Sasha/Sasha - Live @ Coachella Festival 2011 in California (15.04.11).mp3,Sasha,Sasha,"{'name': 'Coachella 2011', 'artist': 'Various Artists'}",Electronic,2011-04-15
Sasha/Sasha - Live @ Coachella Music Festival 2017 in California (16.04.17).mp3,Sasha,Sasha,"{'name': 'Coachella 2017', 'artist': 'Various Artists'}",Electronic,2017-04-16
Sasha/Sasha - Live on Radio 1 Essential Mix - Mandila Vale Replay (27.02.20).mp3,Sasha 2020,Sasha,"{'name': 'Essential Mix', 'artist': 'Various Artists'}",House,2020-02-27
"Sasha & Pete Tong/Sasha & Pete Tong - Live @ Radio 1 Party, Cream, Privilege in Ibiza (02.08.14).mp3",Sasha & Pete Tong,Sasha & Pete Tong,"{'name': 'Cream Ibiza 2014', 'artist': 'Various Artists'}",House,2014-08-02
Schak/Schak_The_Lab_London_Mixmag.mp3,Mixmag Lab London,Schak,"{'name': 'Schak Sets', 'artist': 'Schak'}",House,2023
Scratchclart/Scratchclart - Live on Radio 1 Essential Mix (12.11.22).mp3,Scratchclart 2022,Scratchclart,"{'name': 'Essential Mix', 'artist': 'Various Artists'}",Electronic,2022-11-12
Scuba/Scuba - Live on Radio 1 Essential Mix (09.05.15).mp3,Scuba 2015,Scuba,"{'name': 'Essential Mix', 'artist': 'Various Artists'}",Electronic,2015-05-09
Scuba/Scuba - Live on Radio 1 Essential Mix (25.02.12).mp3,Scuba 2012,Scuba,"{'name': 'Essential Mix', 'artist': 'Various Artists'}",Techno,2012-02-25
Seb Wildblood/Seb Wildblood - Live on Radio 1 Essential Mix (17.04.20).mp3,Seb Wildblood 2020,Seb Wildblood,"{'name': 'Essential Mix', 'artist': 'Various Artists'}",Electronic,2020-04-17
Sebastian Ingrosso/Sebastian Ingrosso - Live @ Coachella Festival 2012 in California (14.04.12).mp3,Sebastian Ingrosso,Sebastian Ingrosso,"{'name': 'Coachella 2012', 'artist': 'Various Artists'}",House,2012-04-14
Sebastian Ingrosso & Alesso/Sebastian Ingrosso & Alesso - Live @ Privilege in Ibiza (04.08.12).mp3,Privilege Ibiza,Sebastian Ingrosso & Alesso,"{'name': 'Sebastian Ingrosso & Alesso Sets', 'artist': 'Sebastian Ingrosso & Alesso'}",House,2012-08-04
Secretsundaze/Secretsundaze - Live on Radio 1 Essential Mix (21.05.22).mp3,Secretsundaze 2022,Secretsundaze,"{'name': 'Essential Mix', 'artist': 'Various Artists'}",Electronic,2022-05-21
Seth Troxler/Seth Troxler - Live on Radio 1 Essential Mix (07.05.22).mp3,Seth Troxler 2022,Seth Troxler,"{'name': 'Essential Mix', 'artist': 'Various Artists'}",House,2022-05-07
Seth Troxler/Seth Troxler - Live on Radio Essential Mix (19.09.15).mp3,Seth Troxler 2015,Seth Troxler,"{'name': 'Essential Mix', 'artist': 'Various Artists'}",Techno,2015-09-19
Shadow Child/Shadow Child - Live on Radio 1 Essential Mix (01.03.14).mp3,Shadow Child 2014,Shadow Child,"{'name': 'Essential Mix', 'artist': 'Various Artists'}",House,2014
Sherelle/Sherelle - Live on Radio 1 Essential Mix (14.11.20).mp3,Sherelle 2020,Sherelle,"{'name': 'Essential Mix', 'artist': 'Various Artists'}",Techno,2020-11-14
Shura/Shura - Live @ Coachella Music Festival 2017 in California (15.04.17).mp3,Shura,Shura,"{'name': 'Coachella 2017', 'artist': 'Various Artists'}",Pop,2017-04-15
Simian Mobile Disco/Simian Mobile Disco - Live @ Sonar Festival 2012 in Barcelona (16.06.12).mp3,Simian Mobile Disco,Simian Mobile Disco,"{'name': 'Sonar Festival 2012', 'artist': 'Various Artists'}",Electronic,2012-06-16
Simian Mobile Disco/Simian Mobile Disco - Live on Radio 1 Essential Mix (14.01.17).mp3,Simian Mobile Disco 2017,Simian Mobile Disco,"{'name': 'Essential Mix', 'artist': 'Various Artists'}",Electronic,2017-01-14
Sir Spyro/Sir Spyro - Live @ EDC 2017 in Las Vegas (17.06.17).mp3,Sir Spyro,Sir Spyro,"{'name': 'EDC Las Vegas 2017', 'artist': 'Various Artists'}",Electronic,2017
Skream/Skream - Live on Radio 1 Essential Mix (04.01.20).mp3,Skream 2020,Skream,"{'name': 'Essential Mix', 'artist': 'Various Artists'}",House,2020-01-04
Skrillex/Skrillex - Live @ Coachella Music Festival 2014 in California (13.04.14).mp3,Skrillex,Skrillex,"{'name': 'Coachella 2014', 'artist': 'Various Artists'}",Electronic,2014-04-13
Slander/Slander - Live @ Coachella 2022 in California (19.04.22).mp3,Slander,Slander,"{'name': 'Coachella 2022', 'artist': 'Various Artists'}",Dubstep,2022-04-19
Snails/Snails - Live @ Coachella Music Festival 2016 in California (23.04.16).mp3,Snails,Snails,"{'name': 'Coachella 2016', 'artist': 'Various Artists'}",Dubstep,2016-04-23
Sofia Kourtesis/Sofia Kourtesis - Live on Radio 1 Essential Mix (09.04.22).mp3,Sofia Kourtesis 2022,Sofia Kourtesis,"{'name': 'Essential Mix', 'artist': 'Various Artists'}",Electronic,2022
Soichi Terada/Soichi Terada - Live on Radio 1 Essential Mix (05.03.22).mp3,Soichi Terada 2022,Soichi Terada,"{'name': 'Essential Mix', 'artist': 'Various Artists'}",House,2022-03-05
"Solardo/Radio 1 Dance Presents..., Ibiza Ants - Solardo.mp4","Solardo, ANTS Ibiza",Solardo,"{'name': 'Radio 1 Dance Presents...', 'artist': 'Various Artists'}",Tech House,
Solardo/Solardo - Live on Radio 1 Essential Mix (10.06.17).mp3,Solardo 2017,Solardo,"{'name': 'Essential Mix', 'artist': 'Various Artists'}",House,2017-06-10
Solomun/Solomun - Live on Radio 1 Essential Mix (28.07.12).mp3,Solomun 2012,Solomun,"{'name': 'Essential Mix', 'artist': 'Various Artists'}",Electronic,2012-07-28
Solomun/Solomun ｜ Boiler Room： Tulum [bk6Xst6euQk].opus,Solomun,Solomun,"{'name': 'Boiler Room', 'artist': 'Various Artists'}",House,
"Sonny Fodera/Sonny Fodera Live from Alexandra Palace, London 2024 [IVceSlZRDbo].opus",Alexandra Palace 2024,Sonny Fodera,"{'name': 'Sonny Fodera Sets', 'artist': 'Sonny Fodera'}",House,2024
Soulwax/Soulwax - Live on Radio 1 Essential Mix (20.05.17).mp3,Soulwax 2017,Soulwax,"{'name': 'Essential Mix', 'artist': 'Various Artists'}",House,2017-05-20
Spectrasoul/Spectrasoul - Live on Radio 1 Essential Mix (04.11.17).mp3,Spectrasoul 2017,Spectrasoul,"{'name': 'Essential Mix', 'artist': 'Various Artists'}",Drum & Bass,2017-11-04
Spor/Spor - Live on Radio 1 Essential Mix (14.03.15).mp3,Spor 2015,Spor,"{'name': 'Essential Mix', 'artist': 'Various Artists'}",Electronic,2015-03-14
Steffi/Steffi  - Live on Radio 1 Essential Mix (08.11.14).mp3,Steffi 2014,Steffi,"{'name': 'Essential Mix', 'artist': 'Various Artists'}",Electronic,2014-11-08
Stephan Bodzin/Stephan Bodzin - Live on Radio 1 Essential Mix (22.01.22).mp3,Stephan Bodzin 2022,Stephan Bodzin,"{'name': 'Essential Mix', 'artist': 'Various Artists'}",Techno,2022-01-22
Steps/Steps What The Future Holds Tour 2021 Live @ London O2 Arena [6rJVObG4a6E].opus,"What the Future Holds, London O2",Steps,"{'name': 'Steps Sets', 'artist': 'Steps'}",Pop,2021
Steve Angello/Steve Angello - Live @ Coachella Music Festival 2017 in California (14.04.17).mp3,Steve Angello,Steve Angello,"{'name': 'Coachella 2017', 'artist': 'Various Artists'}",House,2017-04-14
"Steve Angello/Steve Angello - Live @ Radio 1 Party, Cream, Privilege in Ibiza (02.08.14).mp3",Steve Angello,Steve Angello,"{'name': 'Cream Ibiza 2014', 'artist': 'Various Artists'}",House,2014-08-02
Steve Aoki/Steve Aoki - Live on Radio 1 Essential Mix (27.10.12).mp3,Steve Aoki 2012,Steve Aoki,"{'name': 'Essential Mix', 'artist': 'Various Artists'}",House,2012-10-27
Strange Club/Strange Club - Live @ Coachella Music Festival 2017 in California (14.04.17).mp3,Strange Club,Strange Club,"{'name': 'Coachella 2017', 'artist': 'Various Artists'}",Electronic,2017-04-14
Studio Barnhus – Live on Radio 1 Essential Mix (05.09.20).mp/Studio Barnhus – Live on Radio 1 Essential Mix (05.09.20).mp3,Studio Barnhus 2020,Studio Barnhus,"{'name': 'Essential Mix', 'artist': 'Various Artists'}",Electronic,2020
Sub/Subb-An - Live on Radio 1 Essential Mix (30.08.14).mp3,Subb-An 2014,Subb-An,"{'name': 'Essential Mix', 'artist': 'Various Artists'}",House,2014-08-30
Sub Focus/Sub Focus ｜ Mixmag Lab London - 20241218.opus,Mixmag Lab London,Sub Focus,"{'name': 'Sub Focus Sets', 'artist': 'Sub Focus'}",Drum & Bass,2024-12-18
Sub Focus & Wilkinson/Sub Focus & Wilkinson - Live on Radio 1 Essential Mix (10.10.20).mp3,Sub Focus & Wilkinson 2020,Sub Focus & Wilkinson,"{'name': 'Essential Mix', 'artist': 'Various Artists'}",Drum & Bass,2020-10-10
Sunnery James & Ryan Marciano/Sunnery James & Ryan Marciano - Live on Radio 1 Essential Mix (18.01.14).mp3,Sunnery James & Ryan Marciano 2014,Sunnery James & Ryan Marciano,"{'name': 'Essential Mix', 'artist': 'Various Artists'}",House,2014-01-18
Sven Vath/Sven Vath - Live on Radio 1 Essential Mix - Masters Series 3 (04.07.15).mp3,Sven Vaeth 2015,Sven Vaeth,"{'name': 'Essential Mix', 'artist': 'Various Artists'}",Techno,2015-07-04
Sven Vath & Richie Hawtin/Sven Vath & Richie Hawtin - Live @ Cocoon in Ibiza Replay (10.05.20).mp3,"Cocoon, Ibiza",Sven Vath & Richie Hawtin,"{'name': 'Sven Vath & Richie Hawtin Sets', 'artist': 'Sven Vath & Richie Hawtin'}",Techno,2020-05-10
Swedish House Mafia/Swedish House Mafia - Live @ Coachella 2022 in California (19.04.22).mp3,Swedish House Mafia,Swedish House Mafia,"{'name': 'Coachella 2022', 'artist': 'Various Artists'}",House,2022-04-19
Swedish House Mafia/Swedish House Mafia - Live @ Coachella Festival 2012 in California (14.04.12).mp3,Swedish House Mafia,Swedish House Mafia,"{'name': 'Coachella 2012', 'artist': 'Various Artists'}",House,2012-04-14
Swedish House Mafia/Swedish House Mafia - Live @ Radio 1 Essential Mix Ibiza 20 Special Part 2 (25.07.15).mp3,Swedish House Mafia 2015,Swedish House Mafia,"{'name': 'Essential Mix', 'artist': 'Various Artists'}",House,2015-07-25
Swedish House Mafia/Swedish House Mafia - Live @ Ushuaia in Ibiza (06.08.22).mp3,"Ushuaia Ibiza, 2022",Swedish House Mafia,"{'name': 'Swedish House Mafia Sets', 'artist': 'Swedish House Mafia'}",House,2022-08-06
Synthony/SYNTHONY - Full Length Show - Live at Mānuka Phuel SYNTHONY Festival 2025 [p-EX2AEDhNs].opus,"Synthony, Mānuka Phuel",Synthony,"{'name': 'Classical House', 'artist': 'Various Artists'}",Electronic,2025
Synthony/SYNTHONY_-_World_Premiere_-_Full_Length_Show.mp3,"Synthony, World Premiere",Synthony,"{'name': 'Classical House', 'artist': 'Various Artists'}",Electronic,2024
TQD/TQD - Live on Radio 1 Essential Mix (26.08.17).mp3,TQD 2017,TQD,"{'name': 'Essential Mix', 'artist': 'Various Artists'}",Electronic,2017-08-26
Tale Of Us/Tale Of Us - Live @ Coachella 2019 in California (20.04.19).mp3,Tale Of Us,Tale Of Us,"{'name': 'Coachella 2019', 'artist': 'Various Artists'}",Techno,2019-04-20
Tale Of Us/Tale of Us  - Live on Radio 1 Essential Mix (24.01.15).mp3,Tale of Us 2015,Tale Of Us,"{'name': 'Essential Mix', 'artist': 'Various Artists'}",Electronic,2015-01-24
Tania Vulcano & Locodice/Tania Vulcano & Locodice - Live @ Radio 1 Essential Mix Ibiza 20 Special Part 5 (26.07.15).mp3,Tania Vulcano & Locodice 2015,Tania Vulcano & Locodice,"{'name': 'Essential Mix', 'artist': 'Various Artists'}",Techno,2015-07-26
"Ten Walls/Ten Walls - Live @ Radio 1 Party, Ushuaia in Ibiza (01.08.14).mp3",Ten Walls,Ten Walls,"{'name': 'Ushuaia 2014', 'artist': 'Various Artists'}",House,2014
Ten Walls/Ten Walls - Live on Radio 1 Essential Mix (13.09.14).mp3,Ten Walls 2014,Ten Walls,"{'name': 'Essential Mix', 'artist': 'Various Artists'}",House,2014-09-13
The 2 Bears/The 2 Bears - Live on Radio 1 Essential Mix (21.01.12).mp3,The 2 Bears 2012,The 2 Bears,"{'name': 'Essential Mix', 'artist': 'Various Artists'}",House,2012-01-21
The Avalanches/The Avalanches - Live @ Coachella 2022 in California (19.04.22).mp3,The Avalanches,The Avalanches,"{'name': 'Coachella 2022', 'artist': 'Various Artists'}",Electronic,2022
The Chemical Brothers/Chemical Brothers - Live @ Coachella Festival 2009 in California (18.04.09).mp3,The Chemical Brothers,The Chemical Brothers,"{'name': 'Coachella 2009', 'artist': 'Various Artists'}",Electronic,2009-04-18
The Chemical Brothers/The Chemical Brothers - Live @ Coachella Festival 2011 in California (15.04.11).mp3,The Chemical Brothers,The Chemical Brothers,"{'name': 'Coachella 2011', 'artist': 'Various Artists'}",Electronic,2011-04-15
The Glitch Mob/The Glitch Mob - Live @ Coachella Music Festival 2014 in California (13.04.14).mp3,The Glitch Mob,The Glitch Mob,"{'name': 'Coachella 2014', 'artist': 'Various Artists'}",Electronic,2014-04-13
The XX/The XX - Live @ Coachella Music Festival 2017 in California (14.04.17).mp3,The xx,The xx,"{'name': 'Coachella 2017', 'artist': 'Various Artists'}",Indie Pop,2017-04-14
Theo Kottis/Theo Kottis - Live on Radio 1 Essential Mix (23.07.22).mp3,Theo Kottis 2022,Theo Kottis,"{'name': 'Essential Mix', 'artist': 'Various Artists'}",Electronic,2022-07-23
Thomas Gold/Thomas Gold - Live on Radio 1 Essential Mix (03.11.12).mp3,Thomas Gold 2012,Thomas Gold,"{'name': 'Essential Mix', 'artist': 'Various Artists'}",House,2012
Thomas Jack/Thomas Jack - Live @ Coachella Music Festival 2016 in California (24.04.16).mp3,Thomas Jack,Thomas Jack,"{'name': 'Coachella 2016', 'artist': 'Various Artists'}",House,2016-04-24
Tiesto/Tiesto - Live on Radio 1 Essential Mix (02.01.14).mp3,Tiesto 2014,Tiesto,"{'name': 'Essential Mix', 'artist': 'Various Artists'}",Electronic,2014-01-02
Tim Reaper/Tim Reaper - Live on Radio 1 Essential Mix (15.01.22).mp3,Tim Reaper 2022,Tim Reaper,"{'name': 'Essential Mix', 'artist': 'Various Artists'}",Drum & Bass,2022-01-15
"Tita Lau/Tita Lau LIVE @ DRUMSHEDS, LONDON, Our House UK Tech House ⧸ House ⧸ Techno [sak5PnI4WkM].opus",Tita Lau,Tita Lau,"{'name': 'Drumsheds', 'artist': 'Various Artists'}",Tech House,
Tokimonsta/Tokimonsta - Live @ Coachella Music Festival 2016 in California (24.04.16).mp3,Tokimonsta,Tokimonsta,"{'name': 'Coachella 2016', 'artist': 'Various Artists'}",Electronic,2016-04-24
Totally Enormous Extinct Dinosaurs/Totally Enormous Extinct Dinosaurs - Live on Radio 1 Essential Mix (18.08.12).mp3,Totally Enormous Extinct Dinosaurs 2012,Totally Enormous Extinct Dinosaurs,"{'name': 'Essential Mix', 'artist': 'Various Artists'}",Electronic,2012-08-18
Tourist/Tourist - Live @ Coachella Music Festival 2017 in California (16.04.17).mp3,Tourist,Tourist,"{'name': 'Coachella 2017', 'artist': 'Various Artists'}",Electronic,2017-04-16
Tove Lo/Tove Lo - Live @ Coachella Music Festival 2017 in California (16.04.17).mp3,Tove Lo,Tove Lo,"{'name': 'Coachella 2017', 'artist': 'Various Artists'}",Pop,2017-04-16
Trentemoller/Trentemoller - Live @ Coachella Festival 2011 in California (15.04.11).mp3,Trentemøller,Trentemøller,"{'name': 'Coachella 2011', 'artist': 'Various Artists'}",Electronic,2011-04-15
Tube & Berger/Tube & Berger - Live on Radio 1 Essential Mix (18.02.17).mp3,Tube & Berger 2017,Tube & Berger,"{'name': 'Essential Mix', 'artist': 'Various Artists'}",Tech House,2017-02-18
Tycho/Tycho - Live @ Coachella Music Festival 2017 in California (15.04.17).mp3,Tycho,Tycho,"{'name': 'Coachella 2017', 'artist': 'Various Artists'}",Ambient,2017-04-15
Underworld/Underworld - Live @ Coachella Music Festival 2016 in California (22.04.16).mp3,Underworld,Underworld,"{'name': 'Coachella 2016', 'artist': 'Various Artists'}",Electronic,2016-04-22
Underworld & Eric Prydz/Underworld & Eric Prydz - Live @ Radio 1 Essential Mix Ibiza 20 Special Part 7 (28.07.15).mp3,Underworld & Eric Prydz 2015,Underworld & Eric Prydz,"{'name': 'Essential Mix', 'artist': 'Various Artists'}",Electronic,2015-07-28
Vanic/Vanic - Live @ Coachella Music Festival 2016 in California (23.04.16).mp3,Vanic,Vanic,"{'name': 'Coachella 2016', 'artist': 'Various Artists'}",House,2016-04-23
Vintage Culture/Vintage Culture - Live @ Hi in Ibiza (30.07.22).mp3,Hi Ibiza,Vintage Culture,"{'name': 'Vintage Culture Sets', 'artist': 'Vintage Culture'}",House,2022-07-30
Wankelmut/Wankelmut - Live on Radio 1 Essential Mix (07.06.14).mp3,Wankelmut 2014,Wankelmut,"{'name': 'Essential Mix', 'artist': 'Various Artists'}",House,2014-06-07
Warp Records/Warp Records - Live on Radio Essential Mix (13.12.14).mp3,Warp Records 2014,Warp Records,"{'name': 'Essential Mix', 'artist': 'Various Artists'}",Electronic,2014-12-13
Waze & Odyssey/Waze & Odyssey - Live on Radio 1 Essential Mix (07.02.15).mp3,Waze & Odyssey 2015,Waze & Odyssey,"{'name': 'Essential Mix', 'artist': 'Various Artists'}",House,2015-02-07
What So Not/What So Not - Live @ Coachella Music Festival 2015 in California (12.04.15).mp3,What So Not,What So Not,"{'name': 'Coachella 2015', 'artist': 'Various Artists'}",Electronic,2015-04-12
What So Not/What So Not - Live @ Coachella Music Festival 2017 in California (16.04.17).mp3,What So Not,What So Not,"{'name': 'Coachella 2017', 'artist': 'Various Artists'}",Electronic,2017-04-16
Whethan/Whethan - Live @ Coachella Music Festival 2017 in California (16.04.17).mp3,Whethan,Whethan,"{'name': 'Coachella 2017', 'artist': 'Various Artists'}",Electronic,2017-04-16
Wilkinson/Wilkinson - Live on Radio 1 Essential Mix (04.03.17).mp3,Wilkinson 2017,Wilkinson,"{'name': 'Essential Mix', 'artist': 'Various Artists'}",Electronic,2017-03-04
William Djoko/William Djoko – Live @ DC-10 in Ibiza (11.07.20).mp3,William Djoko 2020,William Djoko,"{'name': 'Essential Mix', 'artist': 'Various Artists'}",House,2020-07-11
Wu Tang Clan/Wu Tang Clan - Live @ Coachella Music Festival 2013 in California (13.04.13).mp3,Wu Tang Clan,Wu Tang Clan,"{'name': 'Coachella 2013', 'artist': 'Various Artists'}",Hip Hop,2013-04-13
Yotto/Yotto - Live @ Coachella Music Festival 2017 in California (15.04.17).mp3,Yotto,Yotto,"{'name': 'Coachella 2017', 'artist': 'Various Artists'}",House,2017-04-15
Yousef/Yousef - Live on Radio 1 Essential Mix (20.10.12).mp3,Yousef 2012,Yousef,"{'name': 'Essential Mix', 'artist': 'Various Artists'}",Electronic,2012-10-20
Zedd/Zedd - Live @ Coachella Music Festival 2014 in California (13.04.14).mp3,Zedd,Zedd,"{'name': 'Coachella 2014', 'artist': 'Various Artists'}",Electro House,2014-04-13
Zedd/Zedd - Live @ Coachella Music Festival 2016 in California (23.04.16).mp3,Zedd,Zedd,"{'name': 'Coachella 2016', 'artist': 'Various Artists'}",Electronic,2016-04-23
Zhu/Zhu - Live @ Coachella Music Festival 2016 in California (23.04.16).mp3,Zhu,Zhu,"{'name': 'Coachella 2016', 'artist': 'Various Artists'}",House,2016-04-23
_.rtf,Unknown Track,Unknown Artist,"{'name': 'Unknown Artist Sets', 'artist': 'Unknown Artist'}",Unknown,
dBridge/dBridge - Live on Radio 1 Essential Mix (31.01.20).mp3,dBridge 2020,dBridge,"{'name': 'Essential Mix', 'artist': 'Various Artists'}",Electronic,2020-01-31
Rufus/RÜFÜS DU SOL (DJ set) ｜ Mixmag Lab London - 20240809.opus,Mixmag Lab London,Rüfüs Du Sol,"{'name': 'Rüfüs Du Sol Sets', 'artist': 'Rüfüs Du Sol'}",House,2024-08-09
"James Hype, Get Closer Amsterdam [QThaqlzSqLw].opus",Get Closer Amsterdam,James Hype,"{'name': 'James Hype Sets', 'artist': 'James Hype'}",House,
Max Styler Live @ EDC Vegas 2025 [N40pkDgwNfg].opus,Max Styler,Max Styler,"{'name': 'EDC Las Vegas 2025', 'artist': 'Various Artists'}",House,2025
D.O.D Live in Brooklyn NYC ｜ Full DJ Set [bHGHzifLcrA].opus,D.O.D Brooklyn NYC,D.O.D,"{'name': 'D.O.D Sets', 'artist': 'D.O.D'}",Tech House,
Gorgon City DJ Set ｜ Rockstar Energy presents @creamfields  2025 ｜ @beatport  Live [Okt3b62OEec].opus,Gorgon City,Gorgon City,"{'name': 'Creamfields 2025', 'artist': 'Various Artists'}",House,2025
Purple Disco Machine House Set @ Glitterbox Hï Ibiza [yRYPwUxAGLQ].opus,Purple Disco Machine Glitterbox Hi Ibiza,Purple Disco Machine,"{'name': 'Purple Disco Machine Sets', 'artist': 'Purple Disco Machine'}",House,
"Radio 1's Classic Essential Mix, Pete Tong & Nick Warren live at Scream in Plymouth, 1996.mp4",Pete Tong & Nick Warren 1996,Pete Tong & Nick Warren,"{'name': 'Essential Mix', 'artist': 'Various Artists'}",Electronic,1996
DJS FROM MARS LIVE @ USHUAÏA IBIZA - F＊＊＊ ME I'M FAMOUS 23-06-2025 - FULL SET [L4VeFKUT42k].opus,Ushuaïa Ibiza F * * * Me I'm Famous,DJs from Mars,"{'name': 'DJS from Mars Sets', 'artist': 'DJs from Mars'}",House,2025-06-23
"Duke Dumont - DJ Set at Steelyard, Creamfields 2025 [EiTiJHgf0NA].opus",Duke Dumont,Duke Dumont,"{'name': 'Creamfields 2025', 'artist': 'Various Artists'}",House,2025
.DS_Store,DS_Store,Unknown Artist,"{'name': 'Unknown Album', 'artist': 'Unknown Artist'}",Unknown,
Honey Dijon DJ set Barcelona ｜ Burn Energy Tour x Mixmag [l35ok-7n2IU].opus,Burn Energy Tour Barcelona,Honey Dijon,"{'name': 'Honey Dijon Sets', 'artist': 'Honey Dijon'}",House,
"Radio 1's Essential Mix, Max Dean x Luke Dean x Joss Dean.mp4",Max Dean x Luke Dean x Joss Dean,"Max Dean, Luke Dean & Joss Dean","{'name': 'Essential Mix', 'artist': 'Various Artists'}",Electronic,
MEDUZA • LIVE DJ SET FROM A PIZZERIA IN IBIZA [dObRo5H4u3w].opus,Pizzeria set Ibiza,MEDUZA,"{'name': 'MEDUZA Sets', 'artist': 'MEDUZA'}",House,
Max Dean ｜ ANTS 2025 - Live at Ushuaïa Ibiza #Livestream [7QtNWKXSBDw].opus,Max Dean,Max Dean,"{'name': 'ANTS 2025 Ushuaia', 'artist': 'Various Artists'}",House,2025
Mau P - Live From Coachella 2025 [wxKkaBoEWCk].opus,Mau P,Mau P,"{'name': 'Coachella 2025', 'artist': 'Various Artists'}",Tech House,2025
Eric Prydz WE2 ｜ Tomorrowland 2025 [LIZCWL2zdPo].opus,Eric Prydz WE2,Eric Prydz,"{'name': 'Tomorrowland 2025', 'artist': 'Various Artists'}",House,2025
James Hype SYNC London (Full Set) [rLTCLSsqrXY].opus,SYNC London,James Hype,"{'name': 'James Hype Sets', 'artist': 'James Hype'}",House,2025
RÜFÜS DU SOL (DJ SET) - Mayan Warrior - Burning Man 2024 [eQ-OVsdK-hM].opus,RÜFÜS DU SOL,RÜFÜS DU SOL,"{'name': 'Burning Man 2024', 'artist': 'Various Artists'}",Electronic,2024
"Gorgon City Live from Navy Pier, Chicago 2025 [dMiYhLy8N6Q].opus","Navy Pier, Chicago",Gorgon City,"{'name': 'Gorgon City Sets', 'artist': 'Gorgon City'}",House,2025
Patrick Topping tech-house set ｜ Mixmag Lab London ｜ Wagtail Rooftop [9Gr-gDNaeEQ].opus,Tech House Set Mixmag London,Patrick Topping,"{'name': 'Patrick Topping Sets', 'artist': 'Patrick Topping'}",Tech House,
HANNAH LAING LIVE DJ SET FROM HÏ IBZA CLUB ROOM • 2025 [w_WXFQ59r34].opus,Hi Ibiza Club Room,Hannah Laing,"{'name': 'Hannah Laing Sets', 'artist': 'Hannah Laing'}",House,2025
Amelie Lens Tomorrowland 2025 ｜ MainStage Closing [q5Oz6Ja8iZs].opus,Amelie Lens,Amelie Lens,"{'name': 'Tomorrowland 2025', 'artist': 'Various Artists'}",Techno,2025
Eats Everything ｜ Mixmag Lab London x Fly San Miguel [lAIyhiqkS5M].opus,Mixmag Lab London,Eats Everything,"{'name': 'Eats Everything Sets', 'artist': 'Eats Everything'}",House,
CAMELPHAT at Giza Pyramids 2025 (Zamna) [h_aESLekNEQ].opus,Giza Pyramids,CamelPhat,"{'name': 'CamelPhat Sets', 'artist': 'CamelPhat'}",Tech House,2025
"Radio 1's Essential Mix, Interplanetary Criminal.mp4",Interplanetary Criminal,Interplanetary Criminal,"{'name': 'Essential Mix', 'artist': 'Various Artists'}",Electronic,
Radio 1’s Essential Mix with Barry Can't Swim at The Warehouse Project [F2Pw1lWWtl8].opus,Barry Can't Swim @ The Warehouse Project,Barry Can't Swim,"{'name': 'Essential Mix', 'artist': 'Various Artists'}",Electronic,
Max Styler Live @ CRSSD San Diego 2025 [W16F7JYKcVA].opus,Max Styler,Max Styler,"{'name': 'CRSSD 2025', 'artist': 'Various Artists'}",House,2025
Ewan McVicar Pumping House DJ Set Live From DJ Mag HQ [g3Btr8uMk-g].opus,Pumping House DJ Mag HQ,Ewan McVicar,"{'name': 'Ewan McVicar Sets', 'artist': 'Ewan McVicar'}",House,
Chris Lake LIVE From San Francisco 2025 ｜ Full Set [O_B5lTFUg_8].opus,Chris Lake San Francisco,Chris Lake,"{'name': 'Chris Lake Sets', 'artist': 'Chris Lake'}",Tech House,2025
FISHER LIVE FROM CREAMFIELDS 2025 [MT7zB-SbUl4].opus,FISHER,FISHER,"{'name': 'Creamfields 2025', 'artist': 'Various Artists'}",House,2025
"Radio 1's Essential Mix, Carl Cox at [UNVRS].mp4",Carl Cox @ UNVRS,Carl Cox,"{'name': 'Essential Mix', 'artist': 'Various Artists'}",Techno,
Faithless DJ set   Brighton Music Conference   @Beatport  Live [XCahxFzSNg0].opus,Faithless DJ Set Brighton Music Confrence,Faithless,"{'name': 'Faithless Sets', 'artist': 'Faithless'}",Electronic,
Gorgon City Live from Brooklyn Storehouse 2025 [EwkfX5_1D1M].opus,Brooklyn Storehouse,Gorgon City,"{'name': 'Gorgon City Sets', 'artist': 'Gorgon City'}",House,2025
Faithless (DJ Set) ｜ Mixmag Lab London [8c1QsuUpbO4].opus,Faithless DJ Set Mixmag London,Faithless,"{'name': 'Faithless Sets', 'artist': 'Faithless'}",Electronic,
MK Live at Creamfields Festival 2019 - FULL SET [HDkCCxzVmfk].opus,MK,MK,"{'name': 'Creamfields 2019', 'artist': 'Various Artists'}",House,2019
Sub Focus ｜ Mixmag Lab London [a3Pl-tG1RAs].opus,Mixmag Lab London,Sub Focus,"{'name': 'Sub Focus Sets', 'artist': 'Sub Focus'}",Drum and Bass,
David Guetta B2B MORTEN Live @ Soundstorm 2024 [QBwApbSqOSo].opus,David Guetta B2B MORTEN,David Guetta & MORTEN,"{'name': 'Soundstorm 2024', 'artist': 'Various Artists'}",House,2024
Solomun ｜ Boiler Room： Tulum [bk6Xst6euQk].opus,Solomun | Tulum,Solomun,"{'name': 'Boiler Room', 'artist': 'Various Artists'}",House,
"Radio 1's Classic Essential Mix, Axwell, Armand Van Helden & DJ Marky at The Warehouse Project 2007.mp4","Axwell, Armand Van Helden & DJ Marky @ The Warehouse Project","Axwell, Armand Van Helden & DJ Marky","{'name': 'Essential Mix', 'artist': 'Various Artists'}",Electronic,2007
MEDVZA³ Live in Ibiza - End Of Summer Set 2025 @HostalLaTorre [M-sjHoykiLE].opus,End Of Summer Set,MEDUZA,"{'name': 'MEDUZA Sets', 'artist': 'MEDUZA'}",House,2025
Sub Focus presents 'Circular Sound' Live From Alexandra Palace [jqAvZujP8OQ].opus,"""Circular Sound"" @ Alexandra Palace",Sub Focus,"{'name': 'Sub Focus Sets', 'artist': 'Sub Focus'}",Drum and Bass,
"Claptone： Day Trip In The Park, LA (Full Set) [vDbvcuDn-2Y].opus","Day Trip In The Park, LA",Claptone,"{'name': 'Claptone Sets', 'artist': 'Claptone'}",House,
"Danny Howard's Club Mix, Best of 2025 - Part 1.mp4","Danny Howard's Club Mix, Best of 2025 pt.1",Danny Howard,"{'name': 'Danny Howard Sets', 'artist': 'Danny Howard'}",House,2025
"Radio 1's Essential Mix, Romy.mp4",Romy,Romy,"{'name': 'Essential Mix', 'artist': 'Various Artists'}",Electronic,
"Confidence Man Live From 3Olympia Theatre, Dublin [-YmlEDjFfgM].opus","Live at 3Olympia Theatre, Dublin",Confidence Man,"{'name': 'Confidence Man Sets', 'artist': 'Confidence Man'}",Electronic,
Ella Knight ｜ Mixmag Lab London ｜ Horizon 22 [fMQo3zaxihs].opus,Mixmag Lab London,Ella Knight,"{'name': 'Ella Knight Sets', 'artist': 'Ella Knight'}",House,
"Radio 1 Dance Presents..., Glastonbury 2025_ Romy.mp4",Romy,Romy,"{'name': 'Glastonbury 2025', 'artist': 'Various Artists'}",Electronic,2025
"Danny Howard's Club Mix, Best of 2025 - Part 2.mp4","Danny Howard's Club Mix, Best of 2025 pt.2",Danny Howard,"{'name': 'Danny Howard Sets', 'artist': 'Danny Howard'}",House,2025
Meduza³ @ Kappa FuturFestival 2025 [bAFRWdcvT6Y].opus,Meduza,Meduza,"{'name': 'Kappa FuturFestival 2025', 'artist': 'Various Artists'}",House,2025
Alesso ｜ Tomorrowland Brasil 2025 [WCo6kS1h8aU].opus,Alesso,Alesso,"{'name': 'Tomorrowland Brasil 2025', 'artist': 'Various Artists'}",House,2025
MK DJ Set ｜ Rockstar Energy presents @creamfields 2025 ｜ @beatport Live [e3JPaO5WxKw].opus,MK,MK,"{'name': 'Creamfields 2025', 'artist': 'Various Artists'}",House,2025
"Radio 1's Essential Mix, Kölsch.mp4",Kölsch,Kölsch,"{'name': 'Essential Mix', 'artist': 'Various Artists'}",House,
John Summit Live @ The O2 Arena London [S8BEtGJzOfM].opus,O2 Arena London,John Summit,"{'name': 'John Summit Sets', 'artist': 'John Summit'}",House,
"Radio 1's Classic Essential Mix, Barry Can't Swim 2023.mp4",Barry Can't Swim,Barry Can't Swim,"{'name': 'Essential Mix', 'artist': 'Various Artists'}",Electronic,2023
Sub Focus & Dimension ｜ Printworks Closing Weekend x UKF On Air [rxH2q9VhEXM].opus,Sub Focus & Dimension,Sub Focus & Dimension,"{'name': 'Sub Focus & Dimension Sets', 'artist': 'Various Artists'}",Drum & Bass,
MK live @ Creamfields 2024 [kfquBvVAKPw].opus,MK,MK,"{'name': 'Creamfields 2024', 'artist': 'Various Artists'}",House,2024
"Radio 1's Classic Essential Mix, Sub Focus 2009.mp4",Sub Focus 2009,Sub Focus,"{'name': 'Essential Mix', 'artist': 'Various Artists'}",Drum & Bass,2009
RÜFÜS DU SOL (DJ set) ｜ Mixmag Lab London [aOuS9tivBL0].opus,Mixmag Lab Londond,Rüfüs Du Sol,"{'name': 'Rüfüs Du Sol Sets', 'artist': 'Rüfüs Du Sol'}",Electronic,
MK Full Set ｜ Capital Dance Live in Ibiza [FFwZzg_LSDg].opus,Capital Dance Ibiza,MK,"{'name': 'MK Sets', 'artist': 'MK'}",House,
SG Lewis ｜ Mixmag Lab London x Forever Days ｜ 2025 [u6Cd9p1-SSc].opus,Mixmag Lab London x Forever Days,SG Lewis,"{'name': 'SG Lewis Sets', 'artist': 'SG Lewis'}",Electronic,2025
Confidence Man DJ set ｜ Mixmag Lab London [-5G9sk8lk0o].opus,DJ Set @ Mixmag Lab London,Confidence Man,"{'name': 'Confidence Man Sets', 'artist': 'Confidence Man'}",Electronic,
James Hype @ EDC Orlando 2025 [saEEH-NPUMc].opus,James Hype,James Hype,"{'name': 'EDC Orlando 2025', 'artist': 'Various Artists'}",House,2025
Riordan DJ Set ｜ Rise Festival 2024 ｜ Mixmag Netherlands + Germany Sessions [ogb9ePXX_Uw].opus,Riordan,Riordan,"{'name': 'Rise Festival 2024', 'artist': 'Various Artists'}",House,2024
"Radio 1's Classic Essential Mix, Paul Oakenfold & Sasha at The Que Club in Birmingham, 1995.mp4",Paul Oakenfold & Sasha 1995,Paul Oakenfold & Sasha,"{'name': 'Essential Mix', 'artist': 'Various Artists'}",Electronic,1995
"Max Dean B2B Luke Dean, neXup Stage, Mint Festival [--pWNwDDOu4].opus",Max Dean B2B Luke Dean,Max Dean & Luke Dean,"{'name': 'Mint Festival', 'artist': 'Various Artists'}",House,
Alesso (Body Hi) B2B Gorgon City Live @ Coachella 2025 - Quasar Stage [KpNtP9lG6Sk].opus,Alesso B2B Gorgon City,Alesso & Gorgon City,"{'name': 'Coachella 2025', 'artist': 'Various Artists'}",House,2025
Everything Always (Dom Dolla & John Summit) Live @ Ultra Music Festival 2025 [9ZqJPIbTme4].opus,Everything Always (Dom Dolla & John Summit),Dom Dolla & John Summit,"{'name': 'Ultra Music Festival 2025', 'artist': 'Various Artists'}",House,2025
"Radio 1 Dance Presents..., Radio 1 in Ibiza_ John Summit at ANTS, Ushuaïa.mp4",John Summit & ANTS Ibiza,John Summit,"{'name': 'Radio 1 Dance Presents...', 'artist': 'Various Artists'}",House,
Selected Sessions MK b2b Sonny Fodera U-Bahn DJ Set [q7UxovvEkI0].opus,MK B2B Sonny Fodera U-Bahn set,MK & Sonny Fodera,"{'name': 'MK & Sonny Fodera Sets', 'artist': 'MK & Sonny Fodera'}",Tech House,
Riordan at The Concourse Project ｜ Full Set (1 Aug 2025) [F5-jMqj7F7A].opus,The Concourse Project,Riordan,"{'name': 'Riordan Sets', 'artist': 'Riordan'}",Techno,2025-08-01
FISHER PRESENTS OUT 2 LUNCH FESTIVAL [DAY 2- FULL LIVE SET] [3YctdJP8_eo].opus,FISHER,FISHER,"{'name': 'Out 2 Lunch Festival', 'artist': 'Various Artists'}",House,
John Summit live at AMF 2025 [vV6Uh6tQ1Rw].opus,John Summit,John Summit,"{'name': 'AMF 2025', 'artist': 'Various Artists'}",House,2025
"Sonny Fodera Live from Alexandra Palace, London 2024 [IVceSlZRDbo].opus",Alexandra Palace,Sonny Fodera,"{'name': 'Sonny Fodera Sets', 'artist': 'Sonny Fodera'}",House,2024
BICEP present CHROMA AV DJ @ Electric Castle 2025 [0ZJqGTejbFU].opus,CHROMA AV set @ Electric Castle,Bicep,"{'name': 'Bicep Sets', 'artist': 'Bicep'}",Electronic,2025
"D.O.D Live at LPR, New York City 2025 [2eQclohopJY].opus",LPR NYC 2025,D.O.D,"{'name': 'D.O.D Sets', 'artist': 'D.O.D'}",Tech House,2025
"Radio 1's Classic Essential Mix, Black Coffee at Printworks 2023.mp4",Black Coffee,Black Coffee,"{'name': 'Essential Mix', 'artist': 'Various Artists'}",House,2023
"Radio 1's Classic Essential Mix, Bonobo 2014.mp4",Bonobo,Bonobo,"{'name': 'Essential Mix', 'artist': 'Various Artists'}",Electronic,2014
"Hot Since 82 Epic Tech-House DJ Set From Sphere at Magazine, London [JWPUC3e9xk8].opus",Sphere at Magazine London,Hot Since 82,"{'name': 'Hot Since 82 Sets', 'artist': 'Hot Since 82'}",Tech House,
Barry Can't Swim ｜ Mixmag Lab London 2025 [q-uCp9VaF7g].opus,Mixmag Lab London,Barry Can't Swim,"{'name': ""Barry Can't Swim Sets"", 'artist': ""Barry Can't Swim""}",House,2025
"ARTBAT live at Cercle Odyssey, Paris, France [4hnJUB_g290].opus","Cercle Odyssey, Paris",ARTBAT,"{'name': 'ARTBAT Sets', 'artist': 'ARTBAT'}",Techno,
RÜFÜS DU SOL - Live from Joshua Tree [Zy4KtD98S2c].opus,Joshua Tree,Rüfüs Du Sol,"{'name': 'Rüfüs Du Sol Sets', 'artist': 'Rüfüs Du Sol'}",House,
"Radio 1 Dance Presents..., Radio 1 in Ibiza_ Pete Tong at ANTS, Ushuaïa.mp4",Pete Tong ANTS Ushuaia,Pete Tong,"{'name': 'Pete Tong Sets', 'artist': 'Pete Tong'}",House,
"Radio 1's Essential Mix, Barry Can't Swim at The Warehouse Project.mp4",Barry Can't Swim @ The Warehouse Project,Barry Can't Swim,"{'name': 'Essential Mix', 'artist': 'Various Artists'}",Electronic,
Max Styler Live @ ANTS Ushuaïa Ibiza 2025 [9m6GHuC7KH8].opus,Max Styler,Max Styler,"{'name': 'ANTS 2025 Ushuaia', 'artist': 'Various Artists'}",House,2025
